video_id,question,correct_answer,wrong_answer_1,wrong_answer_2,wrong_answer_3,wrong_answer_4
126598,"Analyzing c's actions throughout the video, can you determine the purpose of c's repeated activity at the counter?",Examining different belts and other items.,Attract the shopkeeper&#39;s attention by placing items on the counter.,Clearing the counter by leaving items there for a brief period.,Try to balance objects on the specific counter against the forces of gravity.,Search for items to pair with belts at the counter.
106701,What can be deduced about the individual's main goal in the video considering the sequence of actions performed?,Complete a sewing project,Teach an online sewing course,Repairing a broken sewing machine,Demonstration of the sewing machine,Compare different sewing techniques
118516,"Based on the video, what is the primary interaction taking place between c and the person, and how does it progress throughout the video?","A conversation intermittently connected to musical instruments, punctuated by periods of looking around and exploring their surroundings.","In-depth and continuous dialogue on musical instruments, subtly referenced and emphasized through movement and gaze.",A debate-like conversation in which cy and the person constantly counter each other&#39;s statements while actively interacting with their environment.,"A shared experience of observing and examining the environment over an extended period, followed by a thorough discussion of your findings.","A purely musical interaction where c and the person play various instruments throughout the video, occasionally pausing to discuss the specifics of each instrument."
96682,"How does c utilize the cable hider, and what is its potential purpose in the context of the video?","Measure the cable hider under the table, probably for cable management","Attach the cord cover securely under the table, as it is intended to create a cleaner and safer environment",Attaches the cable hider to the switch box for a clean and organized cable routing in the video,"Secures cable clogging, cleans and adjusts control cabinet.","C uses the cable hider to hide cables and minimize table clutter, leading to a cleaner workspace"
93854,"Can you identify any patterns in c's behavior throughout the video, and what do you think this suggests about his priorities in the environment?",Attention to detail and aesthetics,Lost in a room and struggling to find a way out,"Unfocused with shifting attention, without a defined goal.",Continuous search for a specific article,Setting up a still life painting station for an art class
66339,"Summarize the main steps c takes in preparing the piece of wood throughout the video, and compare these steps to the process followed with the other pieces of wood.","C cleans, scrapes, and applies sawdust to the wood, repeating the process for other pieces.","C uses brushes, trowels, and fingers to apply, move, and remove paint, sawdust, and other materials on the wood in the video.","C carefully maintains the work area, preparing the wood with various tools and managing the sawdust while manipulating both the cardboard and other pieces of wood.","C interacts with the cardboard, paints, cleans and adjusts tools while working on multiple pieces of wood in a consistent and focused way.","C engages in a complex series of tasks involving the deliberate use, handling, and placement of tools and materials to prepare and finish multiple pieces of wood."
17074,"What is the main objective accomplished in the video, and how does it involve the bowl and the blender?",Transfer the chocolate from the mixer to the bowl,Clean the bowl and blender before use,The sole purpose of the bowl and mixer was to store utensils,Prepare a fruit salad in the blender and transfer it to the bowl,Pour the juice from the blender into the bowl
88547,"Based on the various actions involving the jenga tower, what can you conclude about the dynamics between c and the man? how do their roles and actions differ throughout the video?","Both c and the man take turns playing Jenga, but occasionally adjust the tower or move the blocks.",C and the man seem to be competing against each other to remove as many jenga blocks as possible without any regard for the stability of the tower.,C removes blocks and the man places them on the tower.,"C acts as an assistant, removing blocks as instructed by the human, while the human is responsible for coordinating every action.",The dynamic between c and the man suggests that one is focused on clearing blockages and the other on directing and directing the clearing process.
27465,Summarize the key steps involved in the preparation and consumption of the main food item in the video.,"Cut paratha, dip in soup and eat.","Make the dough, roll out the paratha, fry it, cut it, dip it in the milk, then the soup, and enjoy it with a fork and a spoon.","C collect ingredients, prepare tools, make dough, shape it, fry it and dip it into sauces to achieve the perfect flavor.","The multi-step process started with preparing the dough, followed by rolling and cutting the dough, then frying and dipping the paratha in various sauces to achieve the desired flavor.","The video features a step-by-step guide to making classic paratha using ingredients from scratch, including kneading the dough, cutting it into desired shapes, and eating it with traditional side dishes."
122029,Briefly provide an overview of the main tasks completed by c in the video. how do they progress over time?,C mainly drills wood several times and later moves it around the house,"C picks up nails, sets up the drilling machine, drills wood, and gradually moves in and out of the room as he adapts to time changes","C starts by drilling the wood, then focuses on touching and analyzing the wood as they move around the house as they go.","C drills the wood, changes the position of the wood, then touches the wood before continuing with more advanced drilling exercises","C repeatedly grabs nails, drills through wood, and checks surroundings throughout the video."
111071,What key actions does c perform during the last part of the video to finalize the dough preparation and how do these actions differ from earlier steps?,"To finish, the dough must be rolled out and lifted, unlike the previous cutting and kneading.","The later steps involve rolling the dough on flour and cutting it, instead of the rolling and lifting seen earlier.",The last part increases the frequency of dough movement compared to the cutting and kneading at the beginning of the video.,"C increases plate interactions, maintaining dough consistency when pressing and turning.","C flips and presses the dough, which contrasts with the earlier focus on cutting, holding and wiping the table."
103284,"Can you provide a summary of the overarching interactions that occur during the video, focusing only on the most relevant or important actions?","C, a woman and a man participate in a draft game, often interacting with pieces on the board.","C, a queen and a man occasionally move the pieces around the board while playing checkers, with significant pauses between moves.","C, the woman and the man compete in a convoluted game of checkers, where c constantly interrupts, altering the course of the game.","Checkers is played primarily by c, with infrequent input from the woman and man, while the other two mostly watch.","C, a woman and a man all move each other&#39;s pieces during the game of checkers, causing confusion among the players."
21082,What order of actions demonstrates c's focus on maintaining cleanliness and organization in the kitchen?,"Move and dispose of waste, clean and organize items","Wash hands frequently, sanitize kitchen tools, clear countertops","Organize the pantry, do the dishes and sweep the floor","Put the groceries away, clean the surfaces and mop the floor","Clean the cutting board, wipe the blade and wash the vegetables"
81362,"What kind of adjustments or interruptions does c make during her work, and why do you think she does them?","C occasionally mends his cloth and collects bits of leaves, probably for convenience and to ensure the quality of his work.","C takes periodic breaks to inspect and rearrange the spinach leaves, ensuring proper placement and alignment on the floor.","C frequently stops to rest and adjusts her posture, taking breaks to stretch her limbs and stay focused on the task at hand.","C disrupts his routine to constantly experiment with new techniques, trying different cutting and binding methods to improve his efficiency.","C disrupts his work to regularly sharpen the sickle, ensuring that it remains effective in cutting spinach leaves."
104949,"In synthesizing the video, what is the primary activity that c regularly alternates between while creating their artwork?",Paint on paper and look at the laptop for reference,Change brushes and change colors while watching the laptop,Create digital art with colors on paper,Paint and brush cleaning process while continuously referencing the laptop,Create artwork looking at the laptop for inspiration using different brushes and materials
27958,"Based on the actions throughout the video, what can you infer was the primary purpose of c's activities in the garage?",Prepare and apply cement,Recording of a detailed tutorial on camera settings.,Carry out a thorough inspection of various items in the garage and their functionality,Efficient control of garage tools and equipment,Investigate the plumbing behind water pipes and faucets
13585,"From the entire set of actions c performs in the video, identify the two major components of his work and explain how they are interconnected.","The two main components are pulling weeds and disposing of them in the trash, two essential steps in maintaining a clean and organized environment.","C&#39;s primary responsibilities include tillage, such as tillage and fertilization, as well as planting and caring for a wide variety of flora to create a thriving, dynamic ecosystem.","C&#39;s work includes monitoring, detecting intruders in his garden and creating a visually appealing, functional landscape plan.","In the video, c meticulously trims hedges and trims tree limbs, ensuring a well-maintained and aesthetically pleasing outdoor space while simultaneously preventing overgrowth and potential damage.",An important aspect of c&#39;s work is to promote sustainable gardening practices by selecting plant species native to the region and providing habitat for local wildlife.
115364,"What were the primary ingredients c worked with during the video, and how did her preparations differ between these ingredients?","The main ingredients are onion, pepper and vegetables; onions were sliced, peppers were stalked and sliced, and vegetables were rinsed and sliced.","C worked with onions, peppers and carrots; the onions were peeled and diced, the peppers were chopped and the carrots were grated.","The main ingredients include onion, pepper, and cabbage; chopped onions, sliced peppers, and chopped cabbage.","C focused on the preparation of onions, potatoes and bell peppers; The onions were chopped, the potatoes were peeled and cut, and the peppers were diced.","C prepared onion, pepper and tomato; onion was thinly sliced, pepper was chopped into small pieces and tomato was quartered."
17266,"Taking into account the entirety of the video, discern at least three critical turning points or major shifts in the individual's behavior. how do these transitions contribute to the overall narrative of the video?","Individual transitions from lying down, to standing exercises, to telephone interaction, suggesting a progression from rest to activity and communication.","The person transitions from rest to physical activity and finally to phone use, representing a gradual change in behavior from passive to active and connected.","The video captures the subject moving from a resting position, doing exercises and then interacting with their phone, providing insight into how they manage their time and achieve their goals.","The video shows the person first taking a break, then exercising, and finally looking at their phone. The story is painted by someone trying to balance relaxation, health and communication.",The video shows a person balancing personal wellness with social engagement through fitness activities and phone use.
97244,"Based on the actions performed by c throughout the video, what can be deduced about the purpose of the cloth and what it signifies in the video?","The cloth is used to clean the books before placing them on the pile, signifying care for the books.",The purpose of the cloth is to protect c&#39;s hands from dust and germs as he flips through the books.,The fabric is used to conceal book covers to keep their contents secret.,The cloth serves as a bookmark and is placed between the pages of each book before stacking.,Fabric is a symbolic object that underlines the importance of books and the need for physical contact with them.
1759,Can you identify the recurring theme within the video? explain how it is significant in understanding the underlying storyline of the video.,Repetitive sharing of chips illustrating the social link,Consistent holding of the knees and lap reflects C&#39;s comfort level with the woman,Dish pass for ratio control,The shared experience of eating chips as a metaphor for their shared history,Mutual sharing of chips punctuated by quiet passage of time
77325,What were the primary tasks performed by c in this video focusing on the most common actions?,Washing and organization of kitchen utensils.,"Making a sandwich, pouring a glass of water, and putting dishes away","Sort groceries, put items in the refrigerator, and clean countertops","Preparing meals, setting the table and cleaning the hob.","Wash dishes, sweep the floor and prepare food"
81344,Can you break down the key steps of c's main repetitive action and describe the overall outcome of these actions?,"C binds the spinach, cuts off the stems and forms a pile of prepared spinach.","C prepares the spinach by tying it, trimming the stems, and stacking it for storage.","C picks up each spinach plant, adds a rubber band, slices the stem, places the spinach in a bowl, and ends up creating a neat pile to use for storage.","C meticulously grabs the spinach, binds it, removes the roots with a sickle and creates a mound of spinach to transport to market.","C collects spinach from the ground, secures it with rubber bands, carefully cuts the stems with a sickle, and finally collects a significant amount of spinach for sale."
10292,"Summarize how c interacts with the paint, pen scraper, and pouch in different ways over the course of the video. then, determine c's overall goal by considering how these interactions work together.","C peels and scrapes paint from the pouch using a pen scraper, emphasizing meticulous paint removal as the overall goal.","C performs various actions using paint, a pen scraper and a sleeve, showcasing the complex manipulation of paint and the arrangement of objects.","C employs various techniques with the paint, pen scraper and bag, suggesting an elaborate ritual to create an immaculate work of art.","Throughout the video, c&#39;s involvement with the paint, pen scraper, and bag is multifaceted, matching the ultimate goal of a detailed and careful paint preparation process.","C interacts with the paint, pen scraper and cover in a dynamic way, revealing the underlying concept of showcasing a wide range of skills and expertise."
109376,"Based on the sequence of events, what can we infer about the person's intention and possible purpose of dealing with the novels in this manner?",The person intends to clean and maintain the novels as he reads them.,They are searching and collecting specific parts of content from different novels.,They try to restore the books by performing specific behaviors.,The person is trying to categorize the novels based on their physical condition.,A person compares the content of several novels for research purposes.
89745,"Identify and compare the main techniques c uses throughout the video to handle the painting process. what are the differences between each technique, and how are they related to each other?","C alternates between painting and wiping, occasionally dipping the brush into the paint.","C uses three painting techniques, dipping the brush and wiping, and the fourth technique where the paint scale is carefully analyzed between painting phases.","C mainly dips the brush into the paint, wipes off the paint several times, and then applies paint to the wood.","The main technique used by c is a careful back-and-forth pattern of painting, then wiping, dipping the brush and holding the bowl of paint while pausing to contemplate the paint.","C uses a technique: paint the wood with precision, hold the paint dish, dip the brush and remove the excess paint."
109436,"Without listing each individual action, describe the steps c performs in the process of preparing and dicing the green peas.","C rinses the peas, slices into small portions and places them in polythene.","C cleans the peas, removes unwanted parts with a knife, and discards small portions in a polyethylene bag.","C begins by peeling the peas, expertly slicing them and methodically removing the small parts, placing them in a polyethylene bag for disposal.","C begins by rinsing the green peas, carefully removing small portions, and arranging the cut pieces neatly in a polythene bag.","C washes peas thoroughly, skillfully slices small pieces of peas and puts them in a container for later use."
50305,What is the main focus or recurring theme of the actions performed by c throughout the video?,Repeatedly drawing dogs with pens and other tools,Draw different dog breeds with a single pen,Draw multiple animals and change the artistic medium,"Sketch dogs quickly and accurately, improving pace and precision.",Explore different art techniques for sketching dogs on different surfaces
68616,"Based on their actions, what can you infer about the priorities and intentions of the person and ""c"" during this video?",The person was busy with the phone and the wooden board; &quot;c&quot; concentrated on the tea and the hand movements.,The person and &quot;c&quot; were mostly concerned with the phone and the wooden board.,The person focused on the tea and chopsticks; &quot;c&quot; dealt mainly with the telephone and the wooden board.,The person prioritized drinking tea while c focused on the wooden board and the phone.,"Both person and &quot;c&quot; had similar priorities, with neither taking the lead in any interaction."
57831,What aspects of c's process demonstrate their attention to detail and continuous refinement of their work?,C regularly checks the laptop and adjusts their painting accordingly.,C continuously perfects his work without interruptions or shifts in emphasis.,"C&#39;s process is characterized by a commitment to carry out every action with great precision and small deviations, and never to resort to external sources of improvement.","C&#39;s dedication to their craft is evident through their meticulous analysis of every trait, ensuring their work remains consistent and without any need for adjustment.","C diligently selects the perfect brush every time, making sure their strokes are flawless and making no adjustments."
6346,"How do the actions performed in the video present an iterative pattern, and why is that pattern essential for the final result?","The repetitive pattern involves cutting and adjusting pieces of fabric, sewing them together, trimming excess, and repeating this process to gradually build the final piece.","The actions exhibit a cyclical pattern involving the cutting, aligning, sewing, trimming and finishing of the textile units, creating the entire article.","Through a series of repetitive actions of assembling, cutting, sewing and shearing fabrics, the essential style of the finished fabric is gradually developed.","Through a pattern of folding, cutting, sewing and adjusting fabric components, creating a combined end result that is both structurally and aesthetically pleasing.","The fabrics are repeatedly cut, sewn, rearranged and trimmed, ensuring that the entire design is successfully assembled."
11448,"Using the context of the video, explain the significance of washing in the series of events and how it ties the various actions together.","Washing served to maintain hygiene and cleanliness during all actions, ensuring a safe and hygienic environment.","Washing was essential to c&#39;s satisfaction, as they derived immense pleasure from the feel of water on their hands and the sound of running water.","Washing was just a distraction, with c using the repeated act of cleaning to postpone their other pressing responsibilities.","Washing played a small role in the proceedings, a simple habit with little effect on the outcome.","The importance of washing was rooted in building c&#39;s character and resilience, with the act demonstrating their patience and determination."
94014,"Considering the chain of actions involving the screw set case, how did c ultimately select and utilize the correct screw? describe his decision-making and handling technique.","C opened the case of the screw set, selected and tested several screws before finding the right one, and used a cordless screwdriver for fastening.","Screws in the case sorted by size and purpose before selecting the right one, then used a manual screwdriver for fixing.",The screws were examined by analyzing their thread patterns and sizes before selecting and attaching the correct one using a ratchet screwdriver.,C tried several bolts on the clutch lever before settling on the one that fit perfectly and then installed it with his bare hands.,"Count the number of turns it takes to tighten the screw in the clutch lever, selecting the one that requires the fewest turns, then use the cordless screwdriver for fastening."
57901,"Focusing on the process c uses in the painting portion of the video, summarize its key components in a few sentences without listing individual actions.","C prepares the varnish, adds turpentine, mixes and applies the varnish to the board in a spray technique, indicating an unorthodox style.","C takes the paint, pours turpentine, splashes the mixture on the board, then cleans the workspace after the painting process.","C pours white spirit into the container, splashes the paint on the board, and stirs the paint while occasionally walking around the room.","C prepares the painting room, collects resources and uses tools to create artwork on the board.","C select a paint brush, adjust the texture of the paint, walk around before applying paint, and use a laptop for inspiration while painting."
118291,"Which vegetables and meat were prepared during the video, and what can you conclude as the likely purpose of these preparations?","Zucchini, tomatoes, and beef - to cook a dish.","Prepare delicious appetizers with zucchini, tomatoes, beef and herbs.","Zucchini, tomatoes, beef, onions and many other vegetables make a hearty stew.","Zucchini, tomatoes, beef and a complex array of spices - preparation for a gourmet meal.","Zucchini, tomatoes, beef and garlic - preparation for a traditional pasta dish."
16768,"Which sequence of actions in the video can be considered the most significant, and why? provide a clear justification for your choice, emphasizing the importance of these actions in the context of the video.",C feed the child prioritizes childcare amidst multitasking,The repetitive scrolling of devices such as the telephone and laptop emphasizes the importance of technology in life c,"The dialogues between c and the lady, especially in the midst of multitasking, illustrate the vital need to maintain social ties",C Placing items on the counter repeatedly defines the importance of kitchen-related tasks throughout the video,"By repeatedly walking, the significant role of c in the house is emphasized."
12728,"Based on the video, what can you conclude about c's main objective and how it relates to the car maintenance process?",C&#39;s main task is to carry out wheel-related maintenance work on the vehicle.,The main goal of c in this video is to clean the interior and exterior surfaces of the car.,C&#39;s main goal in the video is to diagnose and repair a malfunctioning car engine.,"In this video, c installs a new car audio system.","Throughout the video, c focuses on painting different parts of the car to make it look more presentable."
4692,"What is the primary goal that c is trying to achieve throughout the video, and which actions are most critical in achieving that goal?","C&#39;s main objective is to prepare a smoothie, the key actions being to blend and shake the mixture.","C focuses on successfully completing the smoothie process by using multiple techniques, handling different kitchen tools and appliances, and carefully handling each ingredient and operation to achieve the desired result.","C&#39;s goal is to prepare a tasty meal while paying attention to precise ingredient measurement, careful mixing and cleanliness.","The main objective is to make a nutritious smoothie by performing a series of actions, including managing ingredients, using kitchen utensils and diligently following each step.","C strives to create a tasty smoothie recipe by taking care of the ingredients, using different utensils, mixing and shaking, while keeping the work area clean."
