video_id,question,correct_answer,wrong_answer_1,wrong_answer_2,wrong_answer_3,wrong_answer_4
86056,"Considering the entire video, what critical moments appear to hold the most significance for shaping the narrative? explain your answer.",C&#39;s decision to play the video game changes their focus.,"The constant interaction between c and the man, and their changing relationship, are the core of the video&#39;s narrative.",C&#39;s dedicated attention to seating arrangements throughout the video introduces the viewer to the central theme of their quest for comfort.,C&#39;s constant movement around the room and her constant engagement with the various decorations sets the stage for the unfolding story.,The development of the room decoration significantly shapes the direction of the video and shows C&#39;s connection with the environment as the focal point of the narrative.
1247,"Can you outline the overall sequence of steps c takes while working with the clay mould, highlighting any key techniques or strategies?","C packs the clay into a mold, manipulates both the clay and the sand, and repeats the process to shape the final product.",C uses a cyclic process of just manipulating the clay and pouring sand onto the clay mold to create a specific shape.,"C grabs sand onto a clay mold, moves it, adds clay, and scratches repeatedly.","C carefully throws the clay on the clay mud, compacts the sand in several stages and spends most of the time scraping and shaping the clay.","C packs sand and clay into the mold in a random order and at random intervals, rotating and moving the mold on the ground repeatedly throughout the process."
10414,"Throughout the video, what two items does c interact with other than the tablet cover and how does this interaction reflect c's priorities during the task?","C interacts with a sticker remover pen and a phone, briefly distracting her from the main task.","C exchanges a book and a coffee cup, hinting that she is organizing her work environment as she cleans the cover of the tablet.","C briefly wields a screwdriver and tape measure, implying his attention shifts to more technical tasks.","C juggles tissues and bottle of water, possibly to thoroughly clean the cover of the tablet.","C uses scissors and glue, suggesting that she tries to repair or modify the tablet&#39;s cover in the process."
86917,"Based on the video, can you describe the underlying purpose behind the interactions between the man and ""c""?",Take part in a card game,Arguing about the specific handling techniques for cards,Deliberate specifications on the performance of card tricks,Teaching &quot;c&quot; the rules of a new man-made card game,Discussion of the arrangement of the cards
123753,What can you infer about the primary purpose of the character's actions in the kitchen based on the video's events? discuss the relevance of the key steps for this purpose.,Prepare food with attention to order and efficiency,Prioritize the strategic selection of kitchen items to create an elaborate meal,Demonstration of advanced cooking techniques for the benefit of the spectator,Demonstrate dexterity and expertise in navigating the kitchen environment while preparing food,Achieving impeccable execution and culinary mastery through a series of intricate steps
33597,Which tasks can be considered the most important in terms of organizing and tidying up the environment that c performed during the video? please provide a compressed list.,"C keeps things tidy by tidying things up in the living room, organizing the dresser and sorting storage spaces.",C keeps the space around his workstation tidy while alphabetizing his collection of books and organizing his desk.,"C spends a significant amount of her time cleaning the kitchen, scrubbing the floors, and washing the dishes.","C takes a methodical approach to dusting and cleaning every surface, corner and object in the house.","C completely rearranges the furniture, creates new storage spaces and makes various decorations for the environment."
3716,Identify the key turning points in the video that demonstrate c's transition from one task to another and explain their importance in the overall narrative of the video.,"Major turning points are the transition from the plastic storage box to the floor and later to the blue storage box, signifying a shift in focus and perseverance in their quest.","Moving from one storage box to the next, as well as examining books and papers in detail, mark pivotal moments in the development of a tribute to a personal hero or inspirational mentor.","Crucial transitions occur when c examines different types of books and storage boxes, implying a broader examination of resources and a more comprehensive analysis of the materials available.","Key turning points include C stepping up her quest and exploring various items and storage boxes, suggesting a high-risk situation and the urgent need for a breakthrough in her investigation.","Turning points involve dropping items, signifying frustration or despair, adding to the emotional narrative weight."
122300,"While there were numerous instances of c staring around and talking to the person, what critical moment in the video triggered a visible emotional reaction from both c and the person?",Play an electronic keyboard and express feelings through music,Engaging in a heated conversation that ultimately led to both of them crying.,Unexpectedly discovering a hidden safe containing valuables or a big secret,perform an impromptu magic show that cast a spell on both of them,Deep discussions about the nature and existence of life led to mutual spiritual enlightenment.
1759,How does the interaction between the woman and c evolve throughout the video? focus on the main stages of their interaction and compare their behavioral patterns.,The interaction involves sharing chips; c shows a repetitive knee and knee grip,Frequent use of the phone disrupts chip sharing and hand movement,Continuous reciprocating seat adjustments and chip passing,Constant and prolonged chip sharing intertwined with coordinated body language,"The woman constantly offers plates, while c shows reluctance and avoids interaction"
19855,"Can you summarize the main interaction between the man and c, and their respective actions, in one to two sentences?","The man focuses primarily on operating his phone, while c frequently watches TV with minimal interaction between them.","The man strikes up a conversation with c while adjusting his legs and operating his phone, with c constantly replying and adjusting his camera.","The man and c adjust their cameras for the video, make movements and engage in deep conversation.","The video captures the ec man playing an interactive game on the phone, resulting in a constant exchange of conversations and gestures.","Throughout the video, the man and c actively communicate and synchronize multiple activities such as adjusting cameras or swinging legs."
119798,"Compare the behaviors of the man and c in the video. were their actions similar, different, or complementary? provide specific examples to support your conclusion.","Man and c showed complementary behavior, taking turns organizing blocks and building on each other&#39;s progress.","The man and the C showed the same curiosity in the block arrangement, but did not communicate and did not cooperate, which hindered progress.","Man was passionate and determined about the block arrangement, leading the process, while c mostly watched and occasionally tried to help, but didn&#39;t get very far.","The man was much more focused on dragging blocks and arranging them in a certain pattern, while c was more curious about touching the blocks and trying different methods.",Their actions were completely different as the man took a more strategic approach and it seemed like he was arranging the blocks at random without considering the pattern.
69475,"What is the overarching theme of the entire video, considering the primary actions of both c and the person?",Observing and socializing while preparing a blended treat,"Person chatting with c while looking around, closing refrigerator and stretching body",C looks around and mainly observes and interacts with the person who is typing on his phone,The person mainly focused on communicating with gestures and rubbed their hips during the video,C observes carefully as the person uses a blender for various dishes
124013,"From the range of actions, identify three key activities in which c engaged, and connect these as part of an overall interpretation of c's motivation or story in the video.","Choose items, examine them and take their photos for documentation purposes","Endlessly searching for the perfect outfit by trying on, rejecting and capturing numerous options.","Capture the arrangement of items, rearrange them and report the results back to the store manager",Capturing a man&#39;s struggles on a shopping spree through an art performance with various items from the store,Perfect store displays through product adjustments and change documentation.
81661,What is the overarching task that c is performing throughout the video and how does the lady's brief appearance contribute to this process?,C is sewing and the lady brings an extra piece of cloth.,C folds the laundry with the help of the lady carrying the pile of clothes.,"C is doing some detailed embroidery, and the lady is helping by organizing the materials.",C creates a quilt and the lady helps her by giving her additional patterns to work on.,C is knitting and the lady is helping her iron the fabric.
25225,"Considering the overall video, identify two actions carried out by c that had the most significant impact on the accomplishment of the task or goal. explain your choices.",Cutting the apple and cleaning the counter eased the progression of the cooking process.,"Repeatedly opening and closing cabinets, as well as walking around the kitchen to organize the area, had the biggest impact on task completion.",Opening the refrigerator multiple times and focusing on placing utensils throughout the video played an important role in successfully completing the task or goal.,"The most important actions were the continuous cleaning of the kitchen counter and the arrangement of the objects on it, which ensured a tidy workspace and helped to achieve the main objective.",Opening the cabinet doors and rearranging the counter several times was crucial to achieving the goal.
50311,"Describe the overall progression of the artist's process in the video. is it linear, or are there breaks or repetition in the actions taken from start to finish?",Repetitive actions with short pauses.,"The process lacks structure, with no discernible pattern","Only recurrence, no clear progression",The process is linear with some small interruptions but no repeats,The process is totally linear without repetitions or pauses.
39961,What was the key difference between the actions in the video before and after the woman appeared?,"Before the woman appeared, only gameplay occurred; after its arrival, button interactions were introduced.",The appearance of the woman marked a transition in the game&#39;s actions from entirely gameplay-centric interaction to gameplay- and button-related interactions.,The primary focus of the video shifted from c to the woman after her arrival.,"The woman&#39;s appearance caused a change in the speed of the video, with gameplay slowing down and button interactions happening faster.","Before her arrival, c was playing, but after the woman appeared, she played while c just watched."
42374,Briefly describe the process c underwent in switching between different writing instruments and their usage for drawing. focus on summarizing the main actions without listing every single occurrence.,"C alternated between pen and pencil, using a plastic holder and eraser to make adjustments.","C switched between pen and pencil, frequently erasing mistakes and keeping the workplace tidy.","C strategically used a pen and pencil to draw, swapping them to make specific changes, and whenever he made a mistake, the eraser would come into play.","C started with a pen, moved to a pencil, used the eraser for corrections, and repeated the process to create the desired drawing.","C started by opening the pen, drew with it, and then switched to a pencil to make alterations while using an eraser."
31273,Summarize the key steps and techniques c employs throughout the video while practicing golf.,"C consistently hits the golf ball, looks around, and repositions himself for the next swing.","C holds the golf club, continuously adjusts her position, and changes her grip frequently to complement her swing.","C hits the golf ball, stretches, and looks around carefully to analyze the result of their swing.","C demonstrates a variety of different techniques, constantly alternating between putting, driving and analyzing each shot.","In the video, c alternates clubs, diligently practicing different strokes and techniques."
16687,"Identify the most significant event or turning point in the video that shows a change in the actions performed by c, and explain why it is important in the context of the overall video.","Placing the pipette container on the table, as this marks the transition to placing pipettes on the holder.","Move around the room, as it allows you to effectively navigate between different tasks and objects.","Opening the refrigerator, which helps maintain the correct temperature for the items used in the video.","The interaction with the uncertain item, as it represents a crucial moment in determining the next action.","Pressing the machine, as it leads to c interact with a variety of objects around the room."
62660,How does the subject's interaction with the surrounding tools and objects contribute to the primary goal of the video?,"Use tools to sew, adjust and remove thread to refine fabric.",Emphasis is placed on the efficient use of sewing and cutting tools to maximize the speed of fabric finishing.,"Demonstrate competent use of sewing tools, including fabric shaking and table adjustment.","Handle threads, scissors and the sewing machine itself to showcase all aspects of the sewing process.",Constantly switching between tools to ensure each tool is used at least once in the video to establish thoroughness.
78036,"Analyze the sequence of c's actions and identify the key stages in the overall activity, highlighting the significance of c's multitasking ability.","C collects ingredients, prepares and cooks, multitasks with his phone.","C performs several interconnected actions, alternating between making phone calls and cooking.",C multitasking includes different cooking steps and phone interactions.,"C communicates with nature, multitasks with the phone and performs various tasks.","C excels at harvesting, telephone handling, and cooking."
10202,How does the woman's conversation with c during the video impact the main progression of c's actions? describe the significance of this interaction.,The conversation has no significant impact on the progression of c&#39;s actions.,The conversation between the woman and c contributes to a complete change in the actions of c as it focuses more on communication.,"The interaction transforms c&#39;s focus, prompting her to switch to completely different tasks and abandon the old one.","As a result of the conversation, the woman&#39;s suggestion causes C to pay more attention to the tablet pouch, so that she adjusts her actions accordingly.","The interaction affects c&#39;s actions, causing her to lose focus and change the behavior of the tablet pouch."
117275,"What is the primary task that c is performing throughout the video, and what are the different stages involved in completing this task?","Preparation and cooking of vegetables, with steps: cutting and peeling onions, slicing and bagging tomatoes, chopping lettuce and cooking onions in a pot","Provide a tutorial on how to handle various kitchen tools, from knives to nylon bags and bowls, using vegetables as learning aids","Filming a demonstration of preparation and selection of ingredients, movement of products between various places and use of nylon bags for storage.","Demonstrate a range of food-related activities, including washing vegetables, picking up and putting down utensils, using a tap, and organizing items on a table","Cut and organize different vegetables into separate piles, pack some in nylon, and arrange them on the table"
126832,"What is the main objective of c and the man throughout the video, and how do their actions differ to achieve this objective?",Strategically arrange the cards on the table,Repeatedly pointlessly placing and selecting the same cards,"Have a conversation while handling cards, with little connection between the two activities",Compete to see who can pick up and place the most cards on the table in the given time,Prolonged card sorting to play.
25181,Which actions indicate that c is being meticulous throughout the video and how does this reflect on the importance of cleanliness and organization?,"Fold up the sleeves, discard the carrot peels, clean the table and wash the tablecloth.","Choosing carrots from the cupboard, picking sweet potatoes and folding sleeves.","Open and close cupboards, repeatedly touch spoons and fold handles.","Pick vegetables carefully, carefully arrange peeled vegetables and constantly clean the kitchen.","Open drawers to find a potato peeler, remove carrot skins from the floor and wash your hands."
24815,"In the final section of the video, describe the key actions that led to c completing the repair they were engaged in.","He used cutting pliers to force the bolt out, picked up a screwdriver and dowel wrench","Key Actions: Remove Bolt, Drop Pliers, Grab Screwdriver, Check Wrench.","Hold a screwdriver, pick up a socket wrench, remove the tip, drop it in the box and examine the socket wrenches","The final section involves picking up a pair of cutting pliers, pushing out the bolt, and then picking up a screwdriver and socket wrench to finish","I took a screwdriver, held a socket wrench, forced some bolts out using wire cutters and checked the box containing socket wrenches"
116377,"What is the overall process c is performing in the video, and how does her interaction with someone else contribute to this activity?","C makes dumplings while frying them, with regular conversation not affecting the process.","C often talks about making balls of dough, slowing down the process.","C focuses mainly on talking to someone and occasionally makes dumplings and fries them, the conversation being central to the activity.","Throughout the process, c engages in back-and-forth communication with someone to continually improve their dough ball making and frying methods.","C sings and engages in conversation as an essential part of the process of making and frying dumplings, indicating his pleasure."
13489,What key activity or task is the main focus of the video? consider the majority of the video's actions and provide an overarching theme.,Painting a ladder stand,"Paint an entire room, furniture and a stair rack",Research into different painting methods in a building,Interacting with other people while performing various tasks,Touch and adjust different objects
63036,What sequence of tasks and procedures did c follow to ensure safety and maintain sterility while working with test tubes and petri dish?,"Rub by hand, use a spray bottle, and handle test tubes and Petri dish carefully.",Disinfect work surfaces and change gloves frequently.,Clean up spills and seek assistance in managing the laboratory environment.,Always wash your hands and wear gloves while working.,"Clean equipment, use pups for handling, and wear masks."
40366,What is the primary focus of the interactions between character c and the man in the video?,Communication and occasional mutual attention on the phone.,"Attempt to discover the hidden purpose of the refrigerator, its contents and its role in the story.",Share personal anecdotes to strengthen bonds and reflect on the meaning of friendship.,"Discuss favorite games, examine gameplay and share top scores.","Explore the environment together, search for clues together and solve puzzles."
79411,"By evaluating c's actions, identify which sequences signify crucial turning points, and explain their significance in the overall process carried out by c.",Manipulating and fixing the plastic cylinder represented a crucial advancement in the overall process.,The crucial turning points were the times when c took new tools off the board.,The continuous movements of the spoon meant the most critical moments of the entire process.,"The turning point was when it stretched the wire, indicating their progression into a new phase.",The most critical sequence was when it started to organize the elements at the beginning of the video.
9623,Summarize the primary objective of the person in the video and describe the techniques they used to achieve it.,Mend the seat fabric with a needle and string.,"Needle-stitch seat material, stapler",Repair the seat fabric by sewing as well as using a hot glue gun,"Repair a torn seat using a needle, thread, and duct tape","Restore a seat with the help of thread, needle and scissors, and then assemble it"
114714,"In this video, what objects did c primarily interact with, and what were the main techniques used when interacting with these objects?","paper, marker, bag; Draw, Adjust, Hold","Table, cloth, pen; editing, drawing, writing","post-its, hand, fabric; Move, Draw, Tilt","Paper, marker pen, bag; writing, returning, sending","Paper, pen, post-it; color, rub, pick"
126292,Identify the primary activity in the apartment and discuss its importance/significance. how does it influence the actions and atmosphere of the video?,"The main activity is the man playing the guitar, which creates a relaxed environment.",The primary activity is a heated argument between c and the man that escalates over time.,The main activity is c and the man planning to commit a crime together.,"The main activity is to stare at different objects, which indicates a deep curiosity.","The main action is the man walking around the apartment anxiously, creating a tense atmosphere."
38183,What is the overarching goal of c's actions throughout the video and how did c's interactions with the boy contribute to this objective?,Maintaining cleanliness while providing guidance and supervision during interactions.,"Clean systematically by repeating actions, talking to the child from time to time to teach him the process.","Sweep and uproot the lawn, involve and instruct the child in various tasks.","Focused on tidying up and completing tasks, conferring with the boy to align collaborative efforts.",Thoroughly clean the area and have detailed conversations with the boy to focus on.
123088,"Considering the recurring activities in the video, what could be a primary purpose of c's actions in the room?",Organize the room,Rearranging and examining the contents of the room in search of a hidden object,Dismantling of the room for a rearrangement of the furniture,Search diligently for lost items,Decorate the room for a surprise birthday party
17006,"Based on the video, can you explain how the character's interaction with the environment and other people evolved throughout the video sequence?","C starts out interacting mostly with the environment, then briefly interacts with a lady, and resumes environmental interactions","C spends as much time interacting with the environment as he does with people, with both gaining importance as time goes on","C&#39;s interactions with others increased more frequently, while interactions with the environment decreased markedly over time",The character only focuses on her surroundings and avoids any interaction with other people during the video sequence,"Throughout the video, c&#39;s attention gradually shifts from focusing on the environment to focusing on interactions with people"
48662,"Analyze the sequence of events in the video and determine c's main objective, without listing the individual actions.",C&#39;s main purpose is to blend,The main purpose of C is to maintain cleanliness and organization in the kitchen,C&#39;s main purpose is to engage in conversation after completing tasks in the kitchen,The goal of C is to perform various unrelated kitchen tasks.,The main purpose of C is to organize ingredients from cupboards and fridge
29738,"In the context of this video, what main tasks c completes to ensure cleanliness, and how does c maintain the focus and efficiency while performing these tasks?","Clean the floor, oven, and pull the chair; methodical and timely.",Use a timer and take regular breaks to ensure maximum efficiency.,Prioritize high traffic areas and repeat the cleaning routine on a weekly basis.,Complete all tasks in a specific order and adhere to a strict schedule.,Stay organized by dealing with various areas of the home in a structured way.
1369,"Describe the process c goes through to make adjustments on the fabric and thread, and what tools they utilize throughout the video.","Alternating between adjusting and sewing the fabric, scissors are used to cut threads and a needle is used to thread the needle bar.","C carefully and methodically manipulates the fabric and thread by sewing, adjusting and using various tools such as scissors and a needle.","C adjusts the fabric many times with one or both hands on various occasions, making sure the stitches are straight and neat.","The process involves multiple adjustments, sewing, cutting threads, threading needles, moving the presser foot lifter and measuring the fabric.","C is constantly adjusting the fabric, sewing, measuring and folding to ensure a well-finished product."
