video_id,question,correct_answer,wrong_answer_1,wrong_answer_2,wrong_answer_3,wrong_answer_4
111263,"In the overall structure of the video, what would you identify as the most crucial actions c took to ensure proper functioning of the lawn mower after completing the maintenance tasks?","C nuts tightened, parts lubricated and oil tank checked.","C cleaned the mower, fastened nuts, ran the color, greased parts, pulled the pull cord, and checked the oil tank.","C tightened the nuts, cleaned the mower, greased the parts, checked the oil tank, opened the lock and closed the lock.","C assembled the tube, ran the grease gun, greased the parts, opened a lock, and closed a lock.","C locknuts, greased, oil tank inspected and locked."
29726,"Based on the video, discuss how cleaning tasks seem to be prioritized by the main character in a concise manner, without listing every action.",Prioritize cooking and socket zones,Design an intricate cleaning plan that encompasses thorough completion of every surface and minor appliance.,"Prioritize cleaning hard-to-reach spots in the room, e.g. B. Areas under certain objects",Follow a strict cleaning routine that addresses all surfaces consistently and without deviation,Efficiently follow an orderly cleaning method for appliances and surfaces.
9319,"Summarize the two main stages of the overall artistic process in this video, and explain how each stage contributes to the final result.","The two main stages were drawing with the fineliner pen and adding decorative glitters; the sketch laid the foundation, while the highlights enhanced the final piece.","The two main steps were to draw the entire image with the fineliner, then use the same pen to apply embellishments and decorative glitter to enhance the piece.","The two main stages were the initial drawing with the fineliner pen, which focused on the structure, and the second stage of enhancing the image with the decorative glitters.","The two main steps were to create an outline of the image with the fineliner, then fill in details and add decorative elements with glitter.","The two main phases included drawing basic shapes with fineliner, then embellishing those shapes with ornate detailing and decorative glitter."
91080,Summarize the development and progress of the board game-related activities demonstrated in the video.,From examining the game to assembling and covering the box,"The development of the board game involved reviewing, discussing, setting up and clarifying the rules.","Examine the game components, discuss strategies, set up the board, have a test round, and then pack up the game.","Inspect the game components, set up the game, and complete the preparations to start playing","Periodically, the game is examined and discussed, eventually leading to a full understanding and initiation of gameplay"
58834,Identify the most significant moment in the video that suggests a shift in c's objective or motivation.,The significant moment is when c handles the phone.,The crucial moment occurs when c picks up a book from the floor.,The significant moment is when c starts selecting entire piles of books at once.,The important moment is when c repeatedly stares at the books on the floor before continuing with their tasks.,The significant moment is when c finishes putting a book on the shelf and moves on to the next one without interruption.
60035,What is the primary goal for c based on the series of actions taken in the video?,Preparation of vegetables cutting and peeling,Prepare a complete meal with different types of vegetables,Mastering advanced vegetable cutting,Recreating a recipe from memory by following exact steps,"Experiment with different techniques for cutting, mixing and presenting the vegetables"
22850,"Based on the information provided in the video, what motivated character c to engage with the man, and how did their interaction impact the task c was performing in the video?","C interacts with the man seeking guidance, detailing the completion of the task.","The character c shares his free time with the man, without affecting his task.",The interaction with the man is purely coincidental and creates confusion regarding the completion of the task.,"C interacts with humans as a means of distraction from the task, with no impact during task performance.","Character c talks to the man to take a break from the task, making the task completion process longer."
9231,"By observing the main actions in the video, what can you conclude is the primary goal that c is trying to achieve?",Gardening by planting multiple plants in a bucket,Prepare and organize different containers for a large project,Experiment with different techniques for working with soil for an art project,Organize different tools for a future project,Demonstration of various ways to handle and move heavy objects
45896,"Provide a brief summary of the video, focusing on the main goal of the man and how he adapts to the various changes in his environment.","The man does his laundry, interacts with c, and then converses outside with a dog",The man does the housework while building a strong bond with his companion,The man efficiently does the laundry and sorts clothes by color.,People carry out activities in the home environment with multiple changing task selections,The man completes some mundane activities before moving on to outdoor leisure time
20695,"What are the primary tasks performed by c in this video, and how do they differ from one another in terms of priority and context?","C primarily prepares and consumes food, disposes of waste, and cleans kitchen items and surfaces.","The process of c&#39;s diverse, independent kitchen duties is highlighted and the entire event is presented in detail, from food preparation to proper waste disposal.","C spends most of her time cleaning, specifically adapting her technique for a variety of kitchen items while emphasizing proper waste disposal.","This video shows c&#39;s kitchen activities, focusing on cooking, arranging cutlery, and managing waste.","C only cleans different types of kitchen cutlery, disposes of waste and maintains cleanliness in the kitchen space."
45911,What is the main objective of the actions performed by c in the video?,C is engaged in a cutting and measuring process.,"C shows a complete method, performing actions such as cutting, measuring and marking for the assembly of complex projects.",C takes on a multitude of roles crafting and refining a variety of materials to carry out his project throughout the video.,"C demonstrates skills in carpentry, metalworking, and other disciplines by crafting a complex item.",C carefully goes through the steps involved in building a device from scratch in the workshop.
2521,Identify and compare the two main tasks c performs throughout the video. how do they connect to the overall goal?,"C measure and mark the wood, then prepare and use the circular saw to cut the marked wood, connecting to the overall goal of woodworking.",C and the man share anecdotes as they reminisce about past woodworking projects and peruse the planning process for new furniture projects.,"C evaluates the tools in the shop while the man learns to manipulate the environment for maximum productivity, emphasizing both efficiency and time management.","C instructs the man to analyze the differences in color and texture in the wood, and together they select the ideal pieces for their artistic project.","C teaches the man the right techniques, alternates between giving tools and showing them how to use them, emphasizing the importance of precision."
93504,"In this video, what major change occurs in c c's process of painting the wall midway through the video, and what impact does it have on their actions?","Midway through the video, cc pushes the ladder, indicating a possible change in position or reach.","Halfway through, CC stops picking up paint and uses a new brush, making the strokes of paint smoother.","In the middle, cc abandons the brush and begins to use his hands to create a new style.","C c stops using the container and starts wiping the brush directly on the wall, which speeds up the process.","Once CC gets halfway through the work, he&#39;ll take more frequent breaks between painting gestures, slowing down progress."
29203,"Identify and explain the three primary tasks c engages in throughout the video, and how they relate to each other in the overall process.","Kneading dough, adjusting stove, using a phone","Adjusting rolling board, adjusting tray, kneading dough with both hands","Put wood in the oven, align the roller board, align the cloth","Knead the dough, arrange the clothing, operate the phone","Turn the dough, fix the stove, fix the cloth"
70074,Explain the significance of the 'liquid fertilizer' in relation to the overall video.,The liquid fertilizer feeds the plants as part of the care process.,"From 71-87 c takes liquid fertilizer, pours it into a broken bottle and seals it.","The liquid fertilizer, picked up, poured into a broken bottle and capped with c, greatly influences the overarching theme of the video.","C&#39;s handling of the liquid fertilizer bottle, opening and pouring out the contents illustrate the crucial role of the product in the video.",The cases where c interacts with the liquid fertilizer are critical to understanding the broader implications of the video.
14872,What were the two primary tasks c performed repeatedly throughout the video involving the wall?,Smooth the wall and pour the mortar paste into a pan,"Removing stones, holding planks, cleaning planks, and clapping together",Remove metal bars and place stones on the ground,Holding a trowel in his right hand and interacting with the woman,He passes a board from left hand to right hand and aligns the wall with his left hand
60041,"Based on your observations, what would you consider to be the main goal or purpose of the actions performed by c in this video?",Preparing sliced cabbage for later use.,Teaching the right cutting techniques with different tools.,Experimenting with different cutting techniques without a specific goal.,Cabbage cleaning maintenance display.,Comparison of stool cutting and rasping methods in terms of effectiveness.
94254,"In the process of working with carved shapes, what are the key steps taken by c to modify and assemble them?","Removing, adjusting and taping sculpted shapes","Separate cut out shapes, fold, cut, trim","Extract, paste, flip and sort carved shapes","Manage, connect, cut and rotate carved shapes","Manipulating, arranging, cutting and securing carved shapes"
96829,Identify and explain the significance of two key actions that indicate the overall direction and purpose of c's actions in the video.,Wash the dishes and put the glass glasses in the cupboard,Walking to the kitchen and opening a tap with the right hand,Lift a plate with the left hand and close a door with both hands,Interact with a dog and adjust the closet door,"Remove the tray from the microwave, put the cup on the slab."
14872,Identify the key tools c used for the tasks performed in the video and explain their purpose.,"Board for applying and smoothing the mortar, hand trowel and wooden spatula for the finishing touches","Metal pole for balancing, hand trowel for applying mortar, and wooden trowel for decorative purposes only","Using the same plank for all tasks, effectively eliminating the need for tools or other assistance","Use a hand trowel for wall construction, a wooden trowel for support, and a tray for mixing the mortar.","Metal post to hold up the wall, stone to reinforce the structure and formwork as support"
31896,Summarize the primary goal of the video and the key tools c used to achieve it.,"Build a wooden structure using tools such as a nail gun, drill, and laminate router.","The goal of the video is to show c&#39;s expertise in carpentry and provide a tutorial on how to build a wooden frame using a saw, screwdriver, and drill.","C wants to make a table out of wood using a nail gun, ladder, steel strap and a saw.","C wants to demonstrate proper use of tools such as drilling, measuring and nailing for general construction projects.","The main objective is to learn how to use tools such as the table, the drill, the pencil and the ruler for woodworking."
56426,"How did c maintain cleanliness and organization during the process, and why was it important for the progress of the task?","C kept it clean by using a towel to wipe his hands and removing papers from the stabilizer compartment, ensuring a smooth workflow.","C meticulously followed a series of specific steps to ensure cleanliness, such as turning the metal, moving the grease, and applying it to the tailpipe.",C kept the room clean by dropping and picking up items such as towels and brushes while working on the task.,The main focus was on the constant rotation of the anti-roll bar and the application of grease to make the surrounding area clean and tidy.,"By constantly walking around the area, c ensured that all objects, including the sway bay, were kept clean and organized."
116974,How does c ensure the workspace remains clean during the process?,By using a cloth to clean the table,Stopping often to replace dirty tablecloths with clean ones,Using a vacuum cleaner or dustpan to remove debris from the table,Arrange the wood pieces in an orderly manner to minimize clutter and clutter,Carefully apply glue to the edges of the wood to avoid spills.
70414,"Based on the series of actions and behaviors exhibited by c in the video, what might be her role or main responsibility in the kitchen?",C&#39;s main role is to manage cooking and organizational tasks.,C&#39;s main job is handling dangerous or complicated kitchen appliances.,C&#39;s main duty is to talk to the woman and have fun with her.,It is the designated taste tester for food prepared in the kitchen.,C&#39;s job is to supervise and teach the woman every step of the cooking process.
24166,Explain how c's behavior evolved throughout the video. what does this reveal about their purpose and priorities?,"A transition from tidiness to testing, implying a focus on maintaining a clean workspace","Started uncertain, found confidence, sought personal validation.","Moved from creating a chaotic environment to correcting their mistakes, showing an intention to learn from their mistakes",C initially tried to impress others by pretending to know what they were doing before realizing the importance of the tasks at hand.,"He evolved from a timid individual to a skilled strategist, developing his desire to control the environment around him."
100895,"Considering the entire video, can you identify a key pattern that demonstrates c's focus and systematically contributes to the outcome of their actions?","C regularly dips the brush, drains excess paint and paints the wall.","It can be observed that c enters into a consistent rhythm of transitions between different colors, which serves as the basis for the composition of the final masterpiece.","C carefully divides the painting process into a succession of painting sections, taking breaks and using various accessories to maximize the visual aesthetic.","The video shows a notable pattern where the two individuals strategically plan their process and alternate their actions to ensure precise, calculated, and meaningful brushstrokes.","A key motif in the video is the careful pacing of c&#39;s actions, showing a deep understanding of the importance of timing in mural painting."
81383,"What is the main recurring sequence of actions performed by c to prepare the spinach for bundling, and what tool does she use for cutting the spinach?","C cuts the spinach with the sickle, drops it, uses a rubber band to tie it off, and then adds it to a pile.","C examines spinach, cuts it, bundles it with a rubber band and neatly stacks it.","C cuts the spinach accurately with the sickle, rearranges them into a perfect bunch, bundles them with a designer rubber band and stacks them on top of the spinach pile.","C first sands the sickle sharp as a razor, then cuts the spinach smoothly, collects the cut pieces in an aluminum tray and wraps them with an elastic band.","C cuts spinach with the sickle, wraps each one in paper, ties the bundle with a rubber band, and places it in the stack of bundled spinach."
83243,Can you identify any major turning points in the video that alter c's approach to working with the straw grass and rope? explain your reasoning.,The man dropping the straw near c introduces a slight change in the focus and intensity of c.,A significant change occurs when c begins to throw the string sideways with greater force.,"The interaction of C with the string becomes more complex over time, but not due to any specific turning points.","When c begins to move the straw more intensively, it acts as a major turning point in his approach.",C&#39;s approach changes significantly after stepping on the thatch grass many times.
11994,"Based on the sequence of repeated actions, what is c's general workflow for working on the art? remember to compress the information in a concise conclusion.",C regularly polishes the graphics and looks at the laptop to keep up the progress.,"C&#39;s workflow includes scratching the face, raising the left hand, and grabbing the brush on the fabric.","C applies paint to the brush, scratches the face, and regularly buffs the paint.","C is constantly focused on applying paint, moving around the room, and checking the laptop for guidance.","During the process, C regularly alternates between raising the left hand and moving around the room."
736,"Based on c's actions in the video, what can you infer about their level of experience and focus on the task at hand? provide supporting evidence for your conclusion.","C demonstrates focus and experience, evident through controlled brushstrokes, frequent reapplication of paint, and consistent work without unnecessary breaks.","C appears completely unfocused, randomly dipping his paintbrush and roller brush into paint, pausing frequently and looking around repeatedly for no apparent intent.","C appears inexperienced, performing tasks carefully, using touch as a guide, and often observing the environment.","C shows a lack of focus by constantly switching aimlessly between tasks, touching the wood and wall for support, and moving the brushes wildly.","C shows minimal experience while painting, continually lifting his brush and roller brush, dipping them into the paint, but never actually applying it to the surface."
61165,"During the video, several instances of similar actions are performed multiple times by c. in your opinion, what could be the reason behind these repetitions, and how might it contribute to the overall purpose of c's actions in the video?",Repeats ensure complete removal of barbed wire sticks,Repeated mistakes stem from c&#39;s struggle with handling side cutter and sticks.,Repeated actions depict c&#39;s inability to handle barbed wire and sticks efficiently,Repetition occurs when c forgets his previous actions on the barb wire and the sticks,The barbed wire is to be reinforced by stick attachments through repeated actions
47952,What key steps can be identified in the preparation and cooking of bean batter in this video that make the process successful?,"Shape the bean mass, fry and transfer to a strainer.","First, dip the dough, soaking in boiling oil and turning the mandazi repeatedly to ensure they cook properly.","Ensure the right consistency of the batter, keep mixing, heating and frying.","Mix the raw ingredients, fry them at the same time, mix them with a slotted spoon and transfer them back and forth until cooked through.","Go through steps like pressing the dough, boiling the pan, frying the mandazi, and carefully placing each piece on a wooden surface."
22898,"What was the main objective of c throughout the video, and how did their actions progress to achieve this goal?","C&#39;s main goal was to clean the shoes and remove paint, which they gradually achieved by washing, tapping and using a screwdriver.","C&#39;s main plan was to inspect the stairs and sink, and they accomplished this by turning on the tap, picking up shoes, and washing hands.","Throughout the video, c tried to master his handwashing skills and succeeded by turning on the faucet, washing shoes, and using a screwdriver.","C&#39;s primary goal was to visit different rooms, and they accomplished this by opening doors, going up the stairs, and walking around.","C&#39;s central objective was to fix the sink, which they accomplished by using a screwdriver, turning on the faucet, and manipulating the knobs and screws."
49577,Students' ability to identify the most important parts of the video.,Wash and discard plates,Continually wash and rearrange bowls and glasses to create more space,Drop and pick up glasses repeatedly without breaking them,Cleaning dropped plates from over-washing,Squeezing the sponge and wringing tools
86050,"Identify the three most significant moments in the video where c interacts with the various objects, and explain why you believe these moments are crucial to understanding the overall narrative.","C puts the decorations on the flower, interacts with the man and removes the decorations from the card.","C finds decorations, looks at the window, and talks to the man who keeps them.","C looks at the TV, walks around the room and sticks decorations on the flower after removing them from the paper.","C first examines the decorations, adds more decorations while looking at the window, and then goes to the flower to add more decorations.","C focuses on collecting decorations from different sources, walks around the room, and focuses on interactions between the flower, the window and the man."
83249,"In the video, c interacts with another person. describe the overall purpose of this interaction and explain how this interaction contributes to c's main activity in the video.","The interaction helps c to get more straw grass, which further contributes to the arrangement of the heap.","C briefly chats with a man, receiving straw grass for a minor process.","While interacting with the man, c receives guidance on how to trim the grass and use the ropes efficiently in their core business.",Interaction includes sharing task-related information and receiving a pile of dried blades of grass to add to the collection.,The purpose of the interaction is to increase the C&#39;s understanding of the whole process and build positive relationships with those involved in the task.
39191,Identify the key turning points in the video and explain their importance in the context of c's overarching goal.,"Turning on the light and going up the stairs as needed represents shifts in focus, ensuring optimal visibility and reach for the wall painting.","Turning on the light and walking up the stairs, taking paint out of the can and painting the wall are crucial steps in c&#39;s overall process of painting the wall effectively.","Main turns: c climbs the stairs, paints the wall with a brush, takes the paint from the pot for the wall painting objective.","Key turning points include removing the paint from the paint bucket, climbing the stairs, and painting the wall, all contributing to the completion of a complete mural.","Stopping to paint, climbing the steps, and turning on the light indicate important adjustments to successfully complete the painting process."
125787,"What role does the rag play in the video, and how does it relate to the main goal of the character's actions?",The cloth is used to clean the books before placing them on the shelf,The rag serves as a motif representing the character&#39;s love of cleaning,The character uses the cloth as a cleaning ritual before reading each book,The rag is used to clean the camera lens to capture high quality video,The rag acts as a retainer in every book he reads
73999,"In this video, some actions occur more frequently than others. considering this, which actions can be considered 'crucial' and contribute significantly to the overall process c is carrying out?",Shaping vegetable dough and using oil to lubricate are crucial actions.,Smearing your hands with oil and leveling the platter on the floor are important steps in this process.,"The vital elements are shaping the dough, lubricating your hands, and moving the plate across the floor.","The crucial actions are dipping your hands in the oil, shaping the dough, and arranging the position of the container.","In c&#39;s technique, oil dipping hands and nylon handling are crucial."
65607,"Summarize the interaction between c and the man in the video, and explain how the man assists c in the painting process.","The man gives C a bucket of paint, which C uses throughout the painting process.","Throughout the video, c and the man engage in friendly competition to create a more impressive result in the painting.","In constant exchange, Mann and C share advice and techniques to achieve the perfect colors for the painting project.","The man teaches c painting techniques, often exchanging tools and paints.",The man regularly helps c by handing c brushes and adjusting the scaffolding as they paint and mix different colors of paint.
90823,"Identify three key moments when c deviates from moving sand within the irrigation system, and discuss the purpose behind these actions.","Rinsing the hoe, rinsing body parts, and caring for a plant, all for cleanliness and precise work.","Think about next steps, arrange tools and evaluate the progress of the irrigation system.","Clean the hoe three times, maintain the efficiency of the hoe and take a short break.",Briefly observe the irrigation system and the plants.,"Pass the hose through the hands, clean the hoe and examine the condition of the hoe while continuing to use it effectively."
