video_id,question,correct_answer,wrong_answer_1,wrong_answer_2,wrong_answer_3,wrong_answer_4
114610,"From the actions observed, what are the two main objectives that both c and the man are consistently focused on while participating in the activity?",Move figures and roll,"Move several pawns, focus on the ludo board, take turns and choose certain actions to win the game","Adjust pawns, shuffle dice, take turns, improve board positions, and properly manage dice.","Compete in the game, follow game rules, move pawns through cells, roll dice and strategize","C and the man move pawns on the game board, the man shuffles the dice in the container, both rearrange the pawns and throw the dice in"
15592,"From the various actions c performed during the video, identify the three most vital steps that indicate c is engaged in baking-related activities.","Collect the flour, pour the sugar into the planetary mixer and operate the kneading machine.","Preheat the oven, apply a layer of icing and decorate the baking with various toppings.","Set the oven temperature, line a baking tray with parchment paper and time the baking process to ensure even cooking.","Measure out the liquid ingredients, whisk them together in a large bowl and grease a baking pan before transferring the mixture.","Mix the batter, add chocolate chips and flatten with a rolling pin."
106403,Identify the most important moments in the video where c demonstrates effective washing techniques and efficient tool usage. explain how these moments contribute to the overall narrative of long-term video understanding.,Important moments were when c efficiently used the washing sponge and soap for several washes and scratched a cup with a spoon.,"Noteworthy moments were when c changed tools, as those instances determined the overall effectiveness of the washing process.","When c managed to wash the items in a short amount of time, they demonstrated effective washing techniques and tool use.",The essential moments focused on constantly dipping the washing sponge into the soap to ensure an even cleaning of all items.,"Key moments were when c opened and closed the faucet repeatedly, demonstrating his mastery of water control."
5414,"Although the video is predominantly focused on one recurring action, there is an interruption in c's activity. briefly describe this interruption and its significance within the video.","C takes a break to drink from a cup, which causes the focus to shift for a moment","C stops scrolling to check notifications on his phone, indicating a possible distraction","C briefly stops scrolling to engage in conversation with others, emphasizing the social aspect","C interrupts scrolling to type on the laptop, adding variety to the main focus of the video","C briefly interrupts scrolling, showing a drifting fire."
114420,"Based on the sequence of events, identify three key elements or areas that c prioritized during the cleaning process, and explain why these areas may have been chosen as a priority.","The cabinet, drawer and table were prioritized for their central role or emphasis in the room.","By focusing on corners, furniture legs and the ceiling, it addresses areas that are usually hard to reach or easily overlooked.","C prioritized the windows, doors and all electronic items to ensure a safe and clean environment.","C emphasized the cleanliness of all personal items, decorative items and cooking utensils throughout the cleaning process.","Throughout the process, C focused on cleaning the wallpaper, lighting fixtures and floor as these are the areas where most dirt tends to accumulate."
73500,"Keeping in mind the entire video, pinpoint two key moments in which c's interaction with the dried sticks and the utility cable demonstrates a change in his approach or a significant milestone in achieving his primary goal.",There are no clear changes in c&#39;s approach or significant milestones; He continuously performs similar tasks throughout the video.,C achieves a significant milestone when he performs a dry stick pull action on the utility cable and then demonstrates shifts in his approach by moving to a smooth holding action.,"During the video, c completes a subtle transformation in his approach, first focusing on pruning stems quickly and later focusing on the precision of his handiwork.",The key moments occur when c begins to hold the sticks with both hands and then goes back to using his left hand for holding and his right hand to cut the stems.,"In the video, progress is marked by two moments: first, when c picks up a dried stick, and later, when he adjusts his position on the power cord."
5032,"Considering the video, what can you infer about c's shopping strategy and how they are utilizing their shopping list to accomplish it?","C intermittently checks the shopping list, combining exploration and targeted selection to choose items.",C instantly reviews the shopping list before quickly selecting items to maximize shopping efficiency while eliminating unnecessary exploration.,"C frequently returns to the shopping list, stopping at every shelf in the store to confirm his decisions, but never commits to a clear selection of items.","C relies solely on the shopping list, constantly using it to select items without focusing on further browsing the store shelves.","C ignores shopping list, examines store shelves and intuitively chooses items."
57828,"Based on the video, describe the relationship between the painting sessions and the artist's use of the laptop. how did they complement each other?",The laptop served as a reference during painting breaks.,"The artist painted on the laptop screen, using it as a canvas rather than a point of reference.","The laptop and the painting sessions were unrelated, and the artist only used the laptop to check social media.",The music from the laptop inspired the artist&#39;s painting sessions and supported their rhythm.,The artist relied solely on the laptop and did not paint at all.
13246,"Based on the key actions in the video, what can you infer about c's overall goal and how he goes about achieving it?",Prepare a meal by gathering ingredients and using kitchen tools,Rearrange the contents of the refrigerator to make it more efficient,Inspect kitchen appliances to ensure proper operation and safety.,Clean the kitchen by removing food and wiping surfaces,Organize a messy kitchen by putting things back in their respective places
45161,"Evaluate the significance of the flower pot preparation process, including both the ordering and the methods employed by c.","Flower pot preparation involves gluing plant stems, adding soil in increments, and firmly adjusting the stems and soil for stability.","C arranges several pots in a circle, places stems in each pot while singing, and then scoops up soil from a larger pot, sprinkling it into each pot evenly and harmoniously.","The preparation of flowerpots requires a delicate relationship between soil and water, a sacred plant-stem arrangement based on ancient customs, and a careful integration of organic and inorganic materials.","C digs a deep hole in the flowerpot with a small shovel, planting the stems one by one, while singing to the ground to urge her to welcome the newcomers.","C uses a sophisticated method to measure soil ph, sun intensity and plant compatibility, optimizing flower pot arrangement."
86670,"Based on the video, identify critical actions that contribute the most to c's objective and explain why you consider them essential.","Key actions include picking up dirt and weeds using a trash can, and collecting larger amounts of soil and weeds in the bucket, which greatly helps in clearing the area.","Key actions in the video include collecting specific types of weeds to use as fertilizer and putting them in the trash, while simultaneously transporting soil to promote plant growth.","Illustrated critical actions consist of carefully separating valuable plant species from weeds and collecting them in the bucket, while disposing of unnecessary weeds using the trash can.","Essential actions include the preparation of various sections of soil, with an emphasis on adding nutrients by collecting specific weeds in the trash can and mixing them with the soil in the bucket.","Critical actions include creating a soil mixture in the dust pan and then transferring this mixture to a bucket, which gradually makes the garden plot more fertile for plant growth."
91086,"Based on the video, what can be inferred about the relationship between c and the woman and the overall purpose of their actions?",C and the woman appear to have a friendly bond as they engage in a pleasurable activity.,"Demonstrating a teacher-student dynamic, the woman and c appear to be navigating the game process in search of clarification, instruction, and mastery of the rules of the game.",Researchers examine the details of the game to provide thorough feedback for development.,"Their interactions suggest a professional relationship, focused on describing the game&#39;s rules and mechanics in detail for later explanation to others.",It seems that C and the woman they know are engaged in a complex process of testing and analyzing the functionality of the game for possible improvements.
94008,"Considering c's actions and interactions with the mini dumper, what could one infer about the main focus or goal of these actions?",Adjustment and locking of clutch and brake levers.,Demonstration of how to use a cordless screwdriver and pliers.,Carrying out regular maintenance work on mini dumper parts.,Fixing the tool rack and unpacking various tools.,Testing the tools and their effectiveness on the mini dumper.
126292,"Analyze the dynamics of the video in terms of changes in characters' actions, interactions, and spatial movement. how do these shifts contribute to the overall narrative?","Actions and interactions are casual and relaxed, reflecting a comfortable environment.",A dramatic event radically changes the dynamics of the video towards the end.,C&#39;s actions indicate growing uneasiness and uneasiness as the video progresses.,The video shows a deep sense of conflict and tension between the characters.,The characters show an increasingly urgent need to solve a problem in the apartment.
11869,"How can you describe the overall progression of c's actions in the video, focusing on the pattern of interactions with the cards and dice?",Cyclical engagement with cards and dice,Constant battle between card and dice interactions,Growing confrontation with objects,Relying on each action gradually,Random and unpredictable sequence of object manipulation
81625,"Can you summarize the interaction between c and the person throughout the video, and highlight the main theme of their conversation?",Discuss and weigh vegetables,Share personal anecdotes unrelated to the grocery store,There is extensive debate about the prices of vegetables,Just discussing apples and their nutritional benefits in detail.,"Debating vegetables, their weight and politics"
88615,"Considering the main tasks performed in the video, what might c's ultimate goal be, and why?",Create an accurate layout on paper,Careful study and analysis of the content of the painting to assess its value,An elaborate layout was adopted to efficiently catalog and store the painting,Improvement and revitalization of the artwork using various tools and materials.,Build a very detailed plan for a project heavily influenced by painting
106958,Describe the overall process that c carries out in this video and identify two distinct steps in the process that are performed multiple times.,C constantly alternates between chopping and cutting celery throughout the video.,"C obsessively cleans the knife while they peel the celery peel, slice and chop the celery.","C spends the same time peeling the celery peel, slicing the celery and slicing it into a tray.","C requires long breaks between cutting and dicing the celery, with the occasional peeling.",C peel and cut the celery with precision.
73518,"What can be considered as the key action c took to manipulate the barb wire, and why was this action emphasized in the video?",Cutting twigs with pliers was the most important action as it made removing the twigs easier.,Pulling branches out of the barbed wire was highlighted as important for a smooth workflow and demonstrates c&#39;s attention to detail.,"The central action that c performed was cutting twigs, as this showcased his skills and technique throughout the video.","Adjusting the barbed wire was the most important aspect of handling it, as it underscores C&#39;s adaptability and dexterity in the task.",Both hands were used to highlight the intricacy and coordination required when handling barbed wire.
107915,"Based on the video's content, what do you think might have been the significance of the dialogue between c and another person and the subsequent actions involving the jacket and hat?","The dialogue probably guided c&#39;s decision to wear the jacket and hat, involving possible instructions or suggestions from the person.","The exchange with the person could have encouraged c to engage in a new activity or task, and she chose to wear a jacket and hat as part of this exploration.","The conversation could have prompted c to change course, causing them to put on the jacket and hat while considering the possibility of leaving the house.","The conversation influenced c&#39;s decision to go out, so they grabbed her hat and jacket.","The dialogue seemed to have drawn c&#39;s attention to the presence of the jacket and hat, which they decided to wear after careful consideration."
19855,"In this video, what is the primary activity of the man and how does it compare to c's primary activity?",The man primarily uses the phone while primarily watching television.,"The man interacts with c throughout the video by gesturing and operating a camera, while c actively listens and watches television.","The man continues to raise and lower his left hand, while c mainly raises his left and right hands several times.","The man continually adjusts his legs and feet, while she focuses on swinging her legs and raising her hands.","The man mainly engages in various movements with his legs, while c concentrates on adjusting a camera."
24785,"Based on your observations, what can you conclude about c's role and objectives while on the farm, and how does this inform their actions in the video?","C acts as a harvester and collector, focusing on gathering vegetables and preparing them for distribution or sale.","C appears to be trying to gain farming experience by engaging in various farming activities and immersing himself in the environment, including carrying tools and harvesting vegetables.","C&#39;s role includes enjoying the farm, exploring and adapting to the dynamics of farm life.","C is responsible for the operation and management of the farm and performs a variety of farming tasks, from exploring the farm to picking vegetables and tilling the soil.","C plays a multifaceted role in maintaining the farm, handling tasks such as interacting with the vegetables, checking farm status, and gathering produce."
24479,"In the context of the video, what are the most important moments that showcase character c's ability to multitask? provide an explanation in the form of a concise conclusion.",C multitasks by playing cards and snacking simultaneously throughout the video.,"Character c demonstrates multitasking by shuffling cards, preparing a large meal, and performing yoga poses during the ongoing card game.","C&#39;s multitasking can be seen as she takes on the role of a card game umpire, cheerleader, and snack provider, delivering a skillful performance throughout the game.","C multitasks such as snacking, balancing cards, solving math problems, and playing cards.",C showcases his multitasking ability while participating in the card game by also painting a beautiful portrait and reciting poetry.
60910,Identify and explain the most crucial moments or actions that contributed significantly to the individual's goal.,Fixing the wire with a drill and cutting the wire with pliers were crucial moments.,"The crucial moments were holding the camera, unfolding the wire and cutting the tape for an efficient cable fixation process.","Standout moments included dropping several tools, picking up the clamp, and looking at the tape as part of the individual&#39;s overall cable management strategy.","Important actions were arranging the tools, cutting the tape, and pointing around for effective cable manipulation.","Required tasks included taping, cable tying, and cable cutting for effective cable management."
71686,Identify and explain at least two critical moments in the video when c performs key actions that contribute significantly to the dish's preparation.,Critical moments include selecting the right ingredients and combining them in the proper proportions.,C focuses on cutting vegetables precisely and adding them to the pot in a specific order while maintaining a clean work surface.,Two critical moments were when c placed the wooden spoon on the worktop and moved the spatula.,C&#39;s frequent bending and standing up to reach cabinets or drawers were critical moments in the video.,Critical moments involve opening and closing kitchen cabinets and refrigerators several times to ensure that all the ingredients are included in the dish.
23660,In what sequence did c organize and arrange their belongings in the car and why did they choose this pattern?,"Items loaded in car and trunk, adjusting slots for optimal organization","Car items arranged by setting boots, tent, then customize bags by size, priority.","Bags are loaded into the car first, then a bottle of water is placed in it, and then the items are arranged in the car boot for maximum accommodation",Items such as a water bottle and bags placed in the car while you analyzed the best possible setup by looking around and adjusting them later,"Starting with the tent, the boots and the bags, they worked out a plan and carefully followed the sequence to best store the items, evaluating their locations."
119557,"Based on your understanding of the video, which parts or actions appear to be the most significant, and why?","Phone use and conversations, as they appear most in the video","The timing and duration of interactions, as these indicate the relationship between the two individuals","The woman&#39;s grooming and multitasking habits, emphasizing her interest and appearance","Observe the use of the telephone, demonstrate the technological interest of the subjects","Hand gestures and posture adjustment, as they reflect the concentration of the subjects"
62610,Identify the key activities that drive the progression of the video and how they contribute to the overall storyline.,Bowling sequences and laughing together,"A series of demonstrations coordinated by c and the lady, showing various bowling strategies and techniques accompanied by animated discussions","A series of competitive bowling challenges thrown by c and the woman, followed by in-depth commentary on their performance and potential improvements","Several philosophical discussions between c and the woman, triggering emotional reactions in the context of the bowling game","Stimulating talks between c and the woman, with observations of the bowling alley and the rules."
59166,"What are the two primary activities that c and the man perform throughout the video, and how do their actions differ?","C mainly files the cage, while the man clears the ground with a hoe.",C and the man are both filing the cages while gesturing at different times.,"The male mainly files cages, and c clears the ground with hooves; both signs from time to time.",C holds the cage and the man clears the ground; there is no significant difference in their actions.,"Both c and man fill cages and alternately clear the ground, gesticulating throughout the video."
59411,"Identify the most important action c performed at the end of the video, and explain its significance and relationship to the rest of the events in the video.","C wiped the door handle with a cloth, ensuring cleanliness after finishing the painting process.","C lifted up the paint bucket, signifying the official end of the painting process and the beginning of the cleanup phase.","C placed the fallen brush on the edge of the bucket, demonstrating skill and suggesting the completion of the painting.","C dipped the brush into the paint one last time, symbolizing the end of the painting process and the beginning of the next phase, which may involve further activity.","C opened the door and facilitated the proper drying of the door frame by allowing air to circulate, thus emphasizing the importance of proper drying techniques."
3688,"Based on the pattern of actions, what might have prompted c to engage with a phone mid-way, and how does it affect the overall goal of the main action?",C&#39;s altercation with the phone may have been due to receiving a message that temporarily distracts him from the main action but then resumes it afterwards.,"C picks up the phone due to an emergency, resulting in a change in priority and a change in the overall goal of the main action.","C contacts the phone for additional guidance, ensuring the success of the main action.","C engages with the phone due to confusion or forgetfulness, negatively affecting the efficiency of the main action.","C engages with the phone as a break from the main action, causing disruption in the sequence of actions but not affecting the overall goal."
107016,"Can you identify the main sequence of events that occurred during c's interaction with the man, and explain the underlying purpose of these actions?","C purchased items from the man, paying and receiving change.","C observed the man, approached the counter and interacted directly with the man.","C assessed the area, interacted with the man, and explored the objects.","C looked around, walked towards potato skins, and reached the counter.","C picked up a product, paid for it and put it on the table after receiving it."
68610,"Considering c's actions with the items in the video, what can you infer about c's role in the situation?",C was primarily responsible for making and serving the tea,He was an observer without any participation,C tried to find a specific item among the kitchen clutter,C taught the other to cook,C focused on creating an art project
17359,"Considering the major actions carried out by c, what was the primary purpose of the video?",Prepare and cook a vegetable dish,Engage in multitasking using different items in the kitchen,Cleaning the kitchen using chopsticks,Explore object usability,Learn different techniques for picking up objects with chopsticks
5426,Identify key moments in the video where c's behavior may suggest a change in tasks or focus. explain why you think these moments are important.,Switch between typing and scrolling,"Switches between typing, scrolling and looking","Fluctuations between typing, scrolling, and viewing as they adjust their primary focus","Shifts from writing to scrolling, inducing a comprehensive task management strategy",Extended periods of typing are interrupted by casual scrolling or looking at the laptop
108408,"Describe the general process that c goes through in regards to the nozzle, without mentioning specific items or steps, but still capturing the essence of the task.",C meticulously cleans and assembles the nozzle by connecting it to an object.,"C undergoes a systematic procedure of rinsing, washing, and securing the nozzle before placing it on the concrete and connecting it to an unknown object for optimal performance.","Character c performs a series of actions that include picking up, cleaning and covering the nozzle to ensure its efficient assembly and eventual connection with a relevant item.","Specifically, c performs a sequence of actions such as selecting a nozzle, performing a cleaning process, placing it on concrete, and establishing a connection with an unspecified object.","C performs various steps with the nozzle, such as rinsing, washing, covering and placing on concrete, demonstrating her careful approach."
80202,"Identify the three most critical actions c takes in order to set up the campsite, and explain why they are important.","Organizing the camping tent, storing camping supplies in the car, and communicating with the woman","Removing the blue bag from the camping backpack, releasing the camping bag, and picking up the camping backpack with his hands","Open the trunk of the black car, put the camping backpack in the trunk and close the trunk of the black car","Talk to the dog, walk around the campsite and open the black car","Unfold the camping cot, search the camping backpack and unzip the camping tent"
