batch_name,video_id,question,correct_answer,wrong_answer_1,wrong_answer_2,wrong_answer_3,wrong_answer_4
batch6_1,53944,"How would you describe the primary purpose of c's actions in the video, and what events support this conclusion?",The primary purpose of c's actions is to prepare a bottle of water and leave the house.,C's main goal is to perform random actions and make phone calls.,The main focus of the video is c's frequent hand movements and exploration of the house.,C's primary action in the video is walking up and down the stairs while looking around.,The focus of the video is c's consistent usage of the phone in various locations.
batch5_set_3,58417,What is the primary goal the video demonstrates?,Sewing a cloth with a zipper attachment.,C watches attentively as the sewing machine operates,How to unjam the sewing machine's storage compartment,Removing and managing sewing machine compartment objects,The process of measuring and cutting cloth to create a garment
batch6_0,18476,"After observing the video, identify which steps c repeatedly performs in handling the containers and discuss the significance of this repetition in maintaining consistency.","C repeatedly picks up containers, manipulates their contents with a toothpick, and places them back down, creating consistency.","C maintains consistency by analyzing container content, noting observations, and rotating containers in the workspace.","C repeatedly places containers on and off the table, demonstrating a deep concern for the precise positioning of each container and maintenance of order.","C maintains a consistent workflow, ensuring equal attention to all containers by regularly adjusting their positions according to an elaborate pre-determined pattern.","C consistently follows a process of systematic inspection, sterilization, and re-organization of each container, paying close attention to hygiene and order maintenance."
batch5_sample_4,107547,"Reflect on the significance of c's repeated staring at the garlic. what could be the reason behind these pauses, and how might it impact the overall process?",The staring at the garlic may indicate thoughtful evaluation or contemplation during the process.,"The staring at the garlic suggests fascination with the ingredient, distracting c from the task at hand.","Staring at garlic may show confusion in the process, causing dish inconsistency.","The staring at the garlic implies hesitation, possibly due to inexperience with the particular technique and reflecting a slow pace.","The staring at the garlic shows that c is trying to remember the next step in the recipe, indicating difficulty in memorization."
batch6_0,2184,Identify the most significant events in the video and explain how they contribute to the video's overall meaning.,"The most significant events are c's interactions with the woman and their adjustments of glasses, highlighting their connection and a possible focus on appearance.","The most significant events are the cars of different colors passing by, communicating information about transportation patterns and vehicle diversity.","The most important events are the woman's adjustments to her hair, signifying the importance of personal appearance in their walk.","The most significant events include c's conversation with the woman and their mutual adjustments to hair and glasses, indicating a shared emphasis on personal grooming.","The most crucial events involve c and the woman walking together and crossing the street, symbolizing the importance of companionship in navigating different situations."
batch6_1,2023,"Summarize c's main actions while handling the gazebo frame, from discovery to completion. how do these actions indicate the importance of the gazebo frame in the video?","C discovers, opens, unzips, turns over, and removes the bag from the gazebo frame to progress with the canopy tent assembly.","C finds, manipulates, unzips, turns upside down, and clears the gazebo frame bag to fully establish the tent's structure and demonstrate professional assembly techniques.","C locates, opens, breaks the seal, changes position, and eliminates the bag of the gazebo frame, emphasizing its central role in the construction of the canopy tent.","C stumbles upon, accesses, unfastens, modifies the orientation, and disposes of the bag from the gazebo frame, signifying the importance of the frame to the overall tent assembly.","C efficiently removes the bag from the gazebo frame, showcasing his impressive tent-building skills."
batch5_sample_4,55489,"What is the central purpose of c's actions throughout the video, and what is the most essential tool c uses to achieve this goal?",The central purpose is to transfer sand to the wheelbarrow using a shovel as the main tool.,"The central activity is shoveling sand throughout the video, and the most used tool is the garden fork.","The primary activity is moving sand, while frequently switching between the shovel and the garden fork.",The main goal is to transport sand around using a wheelbarrow with the help of a garden fork.,The main goal is to level the sand with a garden fork.
batch6_0,6208,Which tasks were given the most importance and attention by c in the video? highlight the tasks that stand out and explain why they are crucial in the context of the video.,"C placed the most importance on washing dishes, including pans, plates, and glasses.","C prioritized tasks related to arranging kitchen tools and accessories, highlighting the importance of an orderly workspace.",Main focus was on personal hygiene tasks like adjusting gloves and hand washing.,"C dedicated significant time to maneuvering through the kitchen efficiently, ensuring the completion of multiple tasks without delay.",The primary tasks that stood out were those that involved sorting and preparing a variety of ingredients for use in the cooking process.
batch6_0,15504,"How would you summarize the main theme of the video by highlighting the relationship between the man and c, including the primary activities the man is focused on?",The main theme focuses on the man's interactions with c as he cleans and organizes the kitchen.,Video shows man carefully preparing food with c's assistance.,The central theme involves c giving guidance and instructions to the man as he performs his tasks.,The video is mainly concerned with the man entertaining c while he goes about his kitchen duties.,"In the video, the man is primarily occupied with managing multiple tasks while ignoring c's frequent interaction attempts."
batch6_1,8468,"Which sequence of actions showcases c using a different method of paint application, and why might this method be considered important in the context of the video? focus on identifying the crucial part of the video.","C uses a paint squeeze container to add paint to the pallet, highlighting a different method of paint introduction.","C experiments with a sponge to add texture to the painting, showing a unique method of paint application.","C begins finger painting, demonstrating a different way of interacting with the canvas.","C chooses to use a spray bottle instead of using regular paint, featuring a new approach to painting.","C employs the palette knife to mix paint colors, demonstrating an alternative way to blend colors."
batch6_1,67107,Can you describe the overall goal and process that c is focusing on throughout the video? please provide a concise summary.,"C's main goal is to paint the door frame and wall skirt, requiring several paint scoops and careful workplace organization.",C is painting the wall and also trying to have phone conversations while managing a tidy workspace.,C aims to paint various parts of the room and keeps the working area clean by constantly switching between paint tools.,"Concentrating on the wall skirt specifically, c uses a paint brush and a paint roller to apply paint and engages in thorough cleaning tasks to keep the space neat.","C is concerned with painting surfaces in the room, using different techniques, while making sure all other objects, like the phone, are safe from paint splashes."
batch6_1,90968,Describe the primary activity c is engaged in throughout the video and how it relates to his overall objective on the farm.,C primarily focuses on creating drainage on the farm for water management.,C spends most of his time looking around the farm to assess all the tasks that need to be done on the farm.,"C handles farm and animals leisurely, maintaining balance between upkeep and relaxation.","C is mainly responsible for managing the cable on the farm, ensuring it's properly placed to avoid hazards.",C's main task is to communicate with his cows and ensure their wellbeing and comfort on the farm.
batch6_0,85607,"Considering the actions taken by the character, what can be identified as the most significant and impactful moments in the video, and how do they relate to the overall narrative?",The most significant moments included deforming the ladder and manipulating important objects like cables or scrapers.,The most impactful moments were the character's constant checking of their surroundings while pointing at various objects in the room.,The most significant moments involved the character finally acknowledging the presence of another person in the room and their departure at 125 seconds.,The most significant moments centered around the character's use of the phone in their pocket and their frequent interactions with cables.,The video's key impact was the character constantly observing and interacting with their surroundings.
batch6_1,3674,"If you were to identify the key turning points in the video that would largely influence the narrative, which moments do you think constitute those turning points and why?","Key turning points include the child dropping the book, c documenting the child's interaction with the book, and c's sudden involvement in rearranging items.","The child's interactions with the teddy bear and pen, c's constant swiping of the phone, and the child's continuous flipping through the book.","The child writing in the book, c taking a photo of the book, and the child's eventual focus on interactions with the teddy bear.","The child opening and closing the book repeatedly, c's heavy involvement with the phone, and the child's consistent writing efforts.","The child dropping the book, c's regular attention to the phone, and the child continually interacting with the teddy bear and the pen."
batch6_1,2023,Compare and contrast c's interactions with objects in the video. how do these interactions contribute to the central objective of the video?,"C handles various objects to construct a canopy tent, with the gazebo frame being the main focus.","C plays with the gazebo frame, the utility knife and the canopy tent in a continuous manner to complete the canopy assembly.","C organizes bottles, uses a retractable cutter knife and devotes attention to the gazebo frame in order to structure and assemble objects related to the canopy tent.","C engages with dispenser, knife, and frame to ensure cleanliness and establish tent.","C manipulates the gazebo frame, canopy cover, and utility knife in an effortless manner to showcase his mastery of tent construction techniques."
batch6_1,53999,"Based on the repeated actions and emphasis on certain tasks, identify the most crucial elements of c's food preparation technique that contribute to the final dish's quality.",The crucial elements of c's cooking technique were the frequent addition of spices and scooping food portions into dishes.,C's cooking expertise shone with their meticulous spice selection and constant stirring to improve flavor.,"The most important aspects of c's dish preparation appeared to be their focus on continual interaction with the stove, as well as picking up spices and integrating them properly.","By taking periodic breaks to handle the phone and wiping their hands, c demonstrated a keen regard for cleanliness, which in turn contributed to the optimal preparation of the dish.",The quality of c's food preparation was largely influenced by their ability to sequentially add spices while ensuring an adequate rest period between spices for them to properly infuse into the dish.
batch5_set_3,125734,"Based on the information provided, can you summarize the general progression of c's interaction with various parts of the drum set throughout the video? be concise and avoid listing individual actions.",C's interactions with the drum set mainly consist of playing the drums and adjusting the ride cymbal in between.,"Throughout the video, c constantly picks and passes drumsticks, touches drums and cymbals, and makes unsure movements with his instruments.","C picks drumsticks, adjusts ride cymbals and crash cymbals, passes drumsticks between hands, and alternates between playing drums and making adjustments.","The video portrays c's proficiency in moving drumsticks from one hand to another, frequently adjusting ride cymbals, and maintaining a rhythmic drumming performance.","In the video, c mainly adjusts ride cymbals, plays drums, and controls various cymbals and snare drum using hands and feet."
batch6_0,118127,"Which two items, besides woodblocks, played a role in the video and were interaction points for the man?",The man interacted with a mug and water bottles in addition to the woodblocks.,"In addition to the woodblocks, the man interacted with a spoon and a table.",The man handled a box of game and a coffee mug besides the woodblocks.,"In the video, the man engaged with a kettle and various boxes along with the woodblocks.","Apart from the woodblocks, the man was involved with utensils and a bowl during the course of the video."
batch6_1,113782,"Considering the different objects c interacted with during the video, can you provide an overview of the purpose or function of these objects and how they relate to the main action?","The objects c interacted with were mainly used for cleaning purposes, such as hand broom, packer, sponge, and soap.","C used objects such as a hand broom, sponge, and soap to perform a variety of unrelated tasks, including cleaning, moving, and arranging her surroundings.","In the video, c used items like a broom, packer, sponge, soap, and grater for balancing kitchen cleaning and food prep tasks.","C employed cleaning tools, such as a hand broom and sponge, as well as items like a toy and nylons to decorate and personalize her space.","The video focused primarily on c's use and manipulation of assorted kitchen tools and gadgets, with no particular connection to a specific purpose or action."
batch6_1,104646,"Considering the different interactions c had with the man, the shop attendant, and the products themselves, identify the most crucial conversation or interaction that occurred, and briefly explain its importance.","The most crucial interaction was between c and the man, as they had multiple conversations that influenced their product choices.","The most important interaction involved c and the flowers, representing a turning point in their decision-making journey.","The most significant interaction was between c and the shop attendant, as it resulted in the shop attendant giving invaluable product recommendations.","The most pivotal conversation took place when c discovered the herdez bottle, unlocking their ultimate purchasing conclusion.","The most essential dialogue happened when c confronted the dona maria bottle, which eventually persuaded them to finalize their decision."
batch6_0,7835,"Considering c's actions throughout the video, what could be identified as the most significant recurring elements in terms of general activities, and why do these actions hold importance?","Handwashing and water-related activities, which maintain personal hygiene and cleanliness, are the most significant recurring elements.",Water-related repeated actions and hygiene preservation are key in most of c's undertakings.,"Ongoing attention to cleanliness and engagement with water-related activities are underscored as the most crucial elements, emphasizing a safe and hygienic environment.",The importance given to sanitary measures and actions encompassing water usage are the most vital factors throughout the video due to their significance in maintaining a healthy lifestyle.,"Recurring water-specific actions coupled with a commitment to upholding cleanliness standards are identified as notable themes in the video, highlighting essential hygienic practices."
batch6_1,35449,"Based on the long-term understanding of the video, what is the possible significance of c placing her right hand on the pillow at multiple instances?",The regular hand placements on the pillow suggest a need for rest or relaxation during her interaction with the tablet device.,C placed her hand on the pillow exclusively to position the stylus more precisely on the tablet.,She did it spontaneously to break the pattern of using the stylus and her hand.,"As c got tired of using the tablet, she used the pillow as support to continue operating the device effortlessly.","C continuously checked the pillow for the stylus, as she tended to forget where she put it after using her hand."
batch6_0,47980,"Determine and compare the main differences between the woman and c's approach to handling and closing the paint tubes, and how they organize their painting supplies.","The woman uses both hands effectively to handle tubes, while c drops a tube and tends to use her right hand for closing and organization.","The woman organizes paint tubes and supplies in a neat, orderly manner, whereas c throws things around carelessly, making a mess in the process.","The woman uses her left hand to close the paint tubes, whereas c uses her right hand and is less efficient in organizing her painting supplies.","The most noticeable differences in their approaches are the woman's rapid handling of paint tubes versus c's slower, more deliberate actions.","The woman and c swap paint tubes and share supplies in an organized manner, displaying teamwork and efficient use of materials."
batch6_0,105130,Identify the most important actions c took during the video that contributed to his primary goal. what conclusion can you draw about c's objective based on these actions?,C's primary goal was taking precise measurements on the drawing board and recording them on the jotter for reference.,"C's main objective was to create an artistic composition using the wooden rods, pencil, and tape measure on the drawing board.","C aimed to assemble a wooden structure on the drawing board, while taking accurate measurements with the tape measure and jotting them down.","C was focused on demonstrating a variety of measuring techniques using the wooden rods, tape measure, and pencil.","C's central goal was silently showing students different ways to use these tools for measuring, drawing, and aligning objects on the drawing board."
batch6_1,9681,"What were the significant adjustments c made during the video, and why do you think these adjustments were necessary for the final outcome?","C made adjustments to perfect the dough, align it with the baking powder, and ensure proper cooking and presentation.","C made slight corrections to the amount of ingredients used, the order in which they were combined, and the overall texture to guarantee a balanced flavor profile.","C corrected the water level in the pot, added spices, and tested the dish repeatedly to achieve the desired consistency and proper seasoning.","C changed different toppings, the number of layers in the cake, and the icing color scheme to ensure the cake met the desired visual appeal and taste.","C cooked and seasoned vegetables evenly, adjusting heat and timing for perfect texture and color before serving."
batch6_0,6313,Describe how c's approach to handling and organizing the cloth evolved throughout the video. provide a brief comparison between the beginning and end of the video.,"C improved their cloth handling and organization skills, going from dropping and picking up the cloth repeatedly to folding and arranging it more efficiently.","In the beginning, c dropped the cloth multiple times and struggled with organizing the cloth, while at the end, c started multitasking with multiple cloth items and organizing them efficiently into the drawer.","C went through a series of cloth-related tasks like stretching and folding before ultimately focusing on drawer-related tasks, showcasing their learning curve with organizing the cloth.","The process evolved from simply handling the cloth to more complex tasks like folding, arranging, and interacting with the drawer, with c demonstrating mastery over the tasks.","Initially disorganized, c improved by efficiently managing cloth and clothes, repeatedly closing drawers, and frequently walking around."
batch6_0,19749,"Based on the actions in the video, what was the main sequence or theme of events that occurred?",The main sequence of events was c organizing and preparing items for a meal.,The primary focus of the video was c's interaction and organization of the fridge.,C mainly rearranged items near the fridge.,The entire video revolved around c trying to position items effectively in different locations.,The main theme was c repeatedly picking up and putting down various objects.
batch6_0,8368,"Based on the video, what are the primary functions that c and the woman performed in the lab, and what specific actions showed their attention to detail while performing these tasks?","C and the woman were involved in organizing and examining lab samples, displaying attention to detail through careful storage and examination of items.","They functioned as sample handlers within the laboratory, meticulously analyzing and organizing the samples through a series of deliberate actions.","The video highlights their roles as efficient lab technicians, with c and the woman showcasing their focus on details by cautiously opening and closing various compartments.","Both of them can be seen participating in critical lab tasks and ensuring that their actions are carried out with the utmost attention, including handling and examining samples.","Their primary responsibilities included maintaining the laboratory's orderliness and analyzing samples, as evidenced by their concentrated efforts on specific tasks."
batch6_1,54765,"Identify three critical moments in the video that were essential to the progress of the primary activity, and explain the significance of each moment in terms of the overall context.","Picking the knife and yam, chopping the yam on the chopping board, and placing the chopped yam into the dish were three critical moments.","Washing hands, putting on an apron, and setting the oven temperature were key moments in the video that played a pivotal role.","Measuring ingredients, mixing them in a bowl, and setting a timer were crucial elements of the process to ensure a well-cooked dish.","Stirring the mixture, tasting it for seasoning, and adding garnish were the essential points that contributed to the final preparation of the meal.","Plating the dish, wiping the edges of the plate, and photographing the meal were integral steps towards the successful completion of the activity."
batch6_1,95721,"In this video, what were the primary items that c was focused on gathering and why might they be significant?","C primarily gathered peanut butter, mayonnaise, ketchup, and a box of cheese to complete their shopping list.","C collected food items such as peanut butter and condiments, reflecting their preference for savory foods.","C obtained several items, including peanut butter and mayonnaise, which can be combined to make a delicious sandwich.","C concentrated on picking up basic ingredients, indicating that they were shopping for the essentials on this trip.","C was attentive to accumulating diverse products, possibly for a party or special event."
batch6_1,1937,Summarize the primary activities c engaged in throughout the video and identify the central theme or focus of c's actions.,"C engaged in tasks related to digital devices, such as operating desktops, phones, and typing, with the central theme being technology use.","The core theme of c's actions revolved around writing and using the pen, with less importance placed on technology.",C primarily engaged in discussions with the woman with occasional use of technological devices as a secondary theme.,The central focus of c's actions was shifting between different activities while maintaining equal emphasis on technology and non-technology tasks.,"Most of c's actions were related to organizing the work environment, with technology only occasionally used to achieve that goal."
batch6_1,72193,Compare and contrast how c used the pocket knife and the drill for different purposes within the video. provide a concise overview of the tasks performed with these tools.,"The pocket knife is used for cutting and marking the cardboard, while the drill is employed for securing the wooden stick to the wall.","The pocket knife was utilized to create intricate patterns on the cardboard, whereas the drill was used to sculpt the wooden stick.","The pocket knife was employed to transform the cardboard into a canvas, sketching an intricate design that the drill was used to etch onto the wall.","The pocket knife served as c's utensil for whittling parts of the wooden stick, while the drill's role was to puncture the cardboard.","The pocket knife was used to demonstrate various carving techniques, while the drill functioned as a piece of performance art."
