batch_name,video_id,question,correct_answer,wrong_answer_1,wrong_answer_2,wrong_answer_3,wrong_answer_4
batch6_0,8112,"In the context of this video, summarize the primary activity c focuses on throughout the video while also highlighting the secondary tools used during the process.","The primary activity is fixing a wheel bearing and brake pad, with secondary tools being a screwdriver and pliers.","C repairs various components of the bicycle, using a wide range of tools including wrenches, hammers, and duct tape.","The primary focus is on organizing the garage and rearranging tools, with an emphasis on proper storage and maintenance of equipment.","The video demonstrates replacing a car tire with a jack, lug wrench, and torque wrench for correct installation.","C demonstrates the process of assembling a wooden cabinet, utilizing a hammer, nails, and wood glue for proper construction."
batch6_0,51753,"Summarize the key interactions between c and the wooden structure in this video, focusing on the most important actions.","C repeatedly raised, dropped, and flipped the wooden structure while writing on the board.",C occasionally touched the wooden structure without any aim and didn't interact with it much.,C was continuously attaching multiple objects to the wooden structure in a complex pattern.,C spent most of the time carefully building the wooden structure using all available tools.,C meticulously painted and decorated the wooden structure throughout the video.
batch6_0,42554,What is the main progression observed in the video and how does this repetitive process contribute to the creation of the final product?,The main progression observed is the continuous process of rolling thread and knitting the fabric using a crotchet needle to create an elaborate final product.,"In the video, c rolls thread around the crotchet needle and knits a fabric, and this cycle unfolds multiple times to create an intricate fabric piece.","The primary process seen throughout the video is c's repetitive actions of rolling thread around the crotchet needle, knitting fabric, and examining the stitches to ensure a well-crafted end product.","The prevalent progression in the video involves c's recurring actions of yarn wrapping and fabric knitting, culminating in a detailed and finished fabric product.","The video showcases c consistently repeating the process of wrapping thread around the crochet needle and forming fabric with it, together building a complex final product."
batch6_1,59665,What does the woman repeatedly do with the napkin throughout the video and why can it be considered important?,"The woman uses the napkin to clean her hands multiple times, showcasing hygiene as an important aspect.","She puts the napkin on her lap at 46, wipes hands at 7, 16, 62, 143, placing it on the table between actions.","The woman utilizes the napkin to indicate her changing roles and procedures during the video, such as talking, eating, and feeding.","The woman uses the napkin to only clean the dirty utensils before using them for eating, highlighting a focus on cleanliness.","She constantly picks up and drops the napkin in conjunction with her various activities, showcasing the video's repetitive patterns."
batch6_1,94838,"Analyze and explain the significance or importance of c's interactions with the bicycle and accessories, such as the charger, purse, and key chain. what do these interactions suggest about c's objectives or concerns for the bicycle?",C's interactions with the bicycle and its accessories suggest careful inspection and evaluation of their condition.,C engaging with the bike and its components implies a thorough examination to determine their quality and functionality.,C's interaction with the bike and accessories shows their intent to carefully evaluate condition and usage potential.,"By closely scrutinizing the bicycle and related items, c's actions point to a comprehensive evaluation of the bike's condition and overall readiness.",C's examination of the bicycle and its attachments signifies his keen interest in understanding and maintaining their proper functioning and purpose.
batch6_0,34299,"Identify and concisely summarize the primary activity c is engaged in throughout the video, as well as any minor variations in the process.","The primary activity is c repeatedly preparing and eating flatbread with stew, adjusting and cutting the flatbread at different stages.",C eats flatbread and dips it in stew occasionally while preparing it in various ways.,C spends most of the time cutting and adjusting the flatbread before dipping it in stew and eating it.,C follows a complex process with multiple variations while eating and engaging with flatbread.,"C continuously interacts with flatbread, making different adjustments before dipping it into stew and consuming it."
batch6_1,82330,"What were the two main ingredients the protagonist added to the pan, and why do you think they were essential for the dish being prepared?",Flour and oil were the main ingredients added to achieve desired consistency and flavor.,"Flour and water, essential for the dish's texture and moisture, were the main ingredients.","The protagonist added both oil and wooden spoon, which were essential for cooking and stirring the dish.","Flour, oil, and water were the most important ingredients, which established the dish's foundation and taste.",The protagonist added undisclosed spices and vegetables for an additional flavor boost to the pan.
batch6_1,25673,"Considering the entire video, what would you identify as the primary objective of c's actions, and how do they progress towards achieving this goal?",The primary objective is to flatten and fry dough.,C's aim is to form complex designs by folding and layering dough.,The central purpose is to practice dough manipulation techniques for maximum dexterity.,"C aims to create a certain number of dough portions within a time limit, focusing on speed and efficiency.",The primary focus is to create dough balls with essential ingredients for a balanced nutritional profile.
batch6_0,111752,"Can you describe the overarching goal of the person (c) throughout the entire video, and what tools do they utilize in the process?",C's overarching goal is to clean and organize books using a cloth napkin.,"C carefully examines various books, takes notes, and uses a pen to make annotations.",C continuously reorganizes the books by size and color while using a ruler to measure their dimensions.,"C skims book pages, reads intriguing sections, and highlights key info.","C inspects the condition of books, repairs torn pages, and applies glue to fix damaged parts."
batch6_0,107093,"Keeping in mind the video content, which objects does c appear to prioritize for cleaning, and why might that be the case?","C prioritizes cleaning containers, probably because there are more of them or they're more frequently used.",C focuses on cleaning spoons and cups as they are the most contaminated.,"C cleans chopsticks first, as they require more attention to detail.",C prioritizes washing plates to ensure they are ready for the next meal.,C selectively cleans kitchen items based on their size and the space available in the tray.
batch5_set_3,39718,"What is the main objective of c's actions in the video, and how do their actions relate to this objective?","The main objective of c's actions in the video is to clean the kitchen, including washing dishes and tidying up the sink area.",The primary objective is for c to reorganize and redecorate the kitchen to create a more appealing and comfortable environment for cooking and other kitchen activities.,"C aims to improve kitchen skills like utensil handling, liquid pouring, and hand coordination for effective dishwashing and cleaning.","The video demonstrates the individual's interest in exploring various kitchen tasks, with a focus on examining unfamiliar items and tools while trying to figure out their purposes.","C aims to complete a comprehensive inspection of the kitchen, evaluating the quality of kitchenware, appliances, and surfaces to determine potential improvements."
batch6_0,97195,"Based on c's actions throughout the video, what key action has been repeated multiple times and why do you think this action was crucial in achieving c's overall goals?",The key action is cleaning the books to maintain their condition.,C skims multiple books to determine the best one to read.,"C frequently rearranges the books, intending to maintain a specific order to keep track for future reference.","C consistently places the books in specific positions, demonstrating an obsession towards perfection and tidiness.","The vital action is repeated opening and closing of the books, hinting at c's indecisiveness regarding which book to read."
batch6_0,12630,"Considering the video as a whole, recall the most critical steps in the process involving the wrapper, gift, and cups. summarize how these items were handled and connected throughout the sequence.","The critical steps involved preparing the wrapper, wrapping the gift, and arranging cups.","Throughout the sequence, the wrappers were picked and adjusted, cups were assembled, and then gift wrapping was done by cutting and sticking tape on the gift.","In the video, the wrapper was cut multiple times, then tape was used to secure the gift, and finally cups were put together and placed on the table.","The person cut the wrapper, taped the gift and cups together.","The person handled the wrapper, cut it, used tape on the gift, and then placed the cups on the table after turning them."
batch6_1,19051,Identify and explain the significance of three key moments in the video where c's actions indicate a change in focus or intention.,"Key moments include when c starts singing, switches between textbook and white paper, and engages with the switch on the wall.","Crucial moments occur when c lifts her pen, adjusts the white paper on the file folder, and swings her leg in the living room.","Key moments are when c holds her white paper with her left hand, lifts her textbook, and plays with the textbook page.","Three main moments include when c sings, changes textbook pages, and writes on the white paper.","Pivotal points occur when c interacts with her textbook, takes breaks to contemplate the white paper, and focuses on her singing."
batch6_0,7290,"How does the character in the video transition from one main activity to another, and what is their ultimate goal?",The character transitions from cleaning the space to organizing pantry items in the kitchen.,"C transitions from grabbing tins to pushing a bucket, sweeping, and raising hand.",The character transitions by pausing to look around and walking to another area before continuing to organize the kitchen.,"C shifts from multiple cleaning tasks like sweeping the floor and picking up tins, to standing and looking around.","The character is interrupted by walking and looking around before changing tasks, ultimately aiming to clean the entire area."
batch6_1,108450,Compare and contrast the two main techniques c uses to create her artwork on the floor. analyze their purpose and contribution to the final product.,C alternates between adding colored details to the flower and using white powder to create outlines or patterns.,C blends color and white powders for varied color intensities.,C primarily focuses on obtaining shades of different colors by mixing the color powders and white powder and then applying the mixture to the floor drawing.,"C combines the techniques of drawing with color powders in one hand while she handles white powder in the other, making the drawing process quick and fluid.","C interchanges between using color powders to create a base layer and the white powder to create a textured overlay, resulting in a three-dimensional floor drawing."
batch6_1,38411,"What is the overall goal of the actions demonstrated in the video, and how does the character accomplish that goal?",The overall goal is to clear leaves using a hand rake and throw them into the truck.,"The goal is to organize various objects at the back of the truck, and then clear the leaves.",The main objective is to operate a backpack leaf blower and remove leaves from the area.,"The character's purpose is to prepare various gardening tools, including a hand rake and leaf blower.",Demonstrate various leaf raking and disposal techniques in a truck.
batch6_0,2091,"What is the primary objective of the woman's actions in the video, and what similarities can you find between her various activities to achieve this goal?","The primary objective is to wash the jacket, and her activities mainly involve using detergent, a brush, and her hands for cleaning.","In the video, the woman aims to starch a piece of fabric and all her activities involve spreading and adjusting starch on the net.","The primary objective is to clean a floor, and she uses a brush, detergent, and water to scrub and rinse the surface thoroughly.","The main goal is to paint the jacket, and the woman uses a brush and various colors to apply intricate designs on the fabric.","The goal is to teach a pet tricks, and the woman consistently rewards its good behavior with treats while giving clear commands."
batch6_1,42328,"Explain the process by which c assembled and secured the wooden structure, focusing on the key steps they took to ensure its stability.","C followed a process that involved pressing and attaching corners, using screws to secure the structure, and tightening them with a utility screwdriver.","C first examined the wooden structure, then applied glue to the corners, and finally used a hammer to hit the corner to ensure stability.","C sawed and sanded the corners, then used nails and a hammer, followed by balancing the structure to make sure it was stable.","C primarily focused on moving and shaking the wooden structure, ensuring its stability by adjusting the panel and bolts as needed.","C used clamps to hold the structure steady, then proceeded to drill holes and insert screws, continuously checking the corners for stability."
batch6_1,13835,"Identify the most critical moments within the video that exemplify c's problem-solving, precision, and adaptability. explain how these moments contribute to her overall success in executing the project.","Critical moments include c's selection of tools, her precise adjustments of the crochet, and her adaptability when transitioning between different manipulations.","Key instances in the video showcasing c's talent are her choice of materials, her careful alignment of the crochet, and her flexibility during various stages of her project.","C's capabilities are showcased through strategic tool selection, precise crochet adjustments, and smooth item handovers during her craft.","Significant moments reflecting c's expertise are her tool selection, precise manipulation of yarn, and her ability to modify her grips and movements when required.","The most critical occurrences, exemplifying c's aptitude, are her choice of suitable equipment, thorough placement of strands, and dexterity in transitioning between tasks."
batch6_1,7518,"Describe the interactions that occurred among the three participants (c, the man, and the woman) in the video, and explain how these interactions were significant?","The interactions involved sharing and operating a phone, climbing a wall, and conversing, showcasing cooperation and engagement with each other.","In the video, three participants partake in activities like staring, a woman sitting, and a man passing a phone to c.","The interactions between the three participants primarily revolved around a phone; however, they also included non-essential physical movements such as scratching, hitting hands, and walking around in the video.","The participants in the video engaged in several actions, including holding hands, conversing, lifting hands, and touching, which seemingly indicate strong relationships and camaraderie between them.","The interactions began with a woman sitting down, continuing with various phone exchanges and actions, and, ultimately, culminating in conversations between all three participants, which demonstrated their interconnected relationships."
batch6_0,83890,"How do the actions of c and the woman relate to each other in the video, and what conclusion can be drawn from analyzing their joint activities?",Both c and the woman are preparing to leave the campsite and head towards a car.,C and the woman are engaging in unrelated activities with no specific purpose.,The woman is setting up the camp while c is preparing to leave the campsite.,Both the woman and c are arranging their belongings and organizing the campsite without the intention to leave.,C and the woman are performing a series of random tasks that don't show any clear goal.
batch6_0,25626,"What is the primary activity being progressed throughout the video, and what are the two main components involved in completing this task?","The primary activity is cooking custard, and the two main components involved are washing and preparing the plant and stirring the custard.","The primary activity is cleaning the kitchen, and the two key actions involved are washing dishes and adjusting the stove.","Throughout the video, c is mainly focused on watering plants, with two key actions being cutting branches and adding water to the custard pot.","The primary activity is cooking custard, with adjusting the stove settings and washing dishes as the main components.","In the video, c's main task is to prepare a meal with two main actions being setting the table and collecting ingredients."
batch6_0,42170,"Analyze the importance of c's actions related to the cap in the video, and discuss their relevance to the overall narrative.",C's actions related to the cap signify an attention to comfort and appearance during the bicycle ride.,C's cap-related actions indicate a habit of adjusting personal items and focus on getting ready for the bicycle ride jointly.,The actions regarding the cap exemplify c's apprehension towards the person and stress the value of visual presentation.,C's cap behavior reveals self-consciousness about looks during the bike ride.,"The cap adjustments stress the need for proper preparation, signaling a meticulous approach to their shared bicycle journey."
batch6_0,4118,"Summarize the overall purpose and main actions of ""c"" in the video, focusing on how their actions contribute to achieving their goal.",C's primary goal was to efficiently maneuver the forklift to transport and reposition rocks.,"C's objective was to use the forklift to lift multiple rocks, ensure ongoing safety by looking at surroundings, and transport the rocks to other locations.","The main purpose of c's actions was to showcase proficiency in forklift operation, expertly move rocks, and maintain a keen awareness of their surroundings.","C's goal was to demonstrate their skill in operating a forklift, conducting various activities involving rock transportation, and maintaining a safe working environment.","The video showed c's goal of proper forklift use, transporting rocks efficiently, and maintaining safety through constant observation."
batch6_0,116040,Identify and discuss the two most important parts of the video that demonstrate c's expertise and carefulness while working on the project.,C demonstrates expertise and carefulness by tightening screws precisely and using a hammer to secure the rear brake lever.,C showcases skills by meticulously analyzing the door handle and swiftly transitioning from tightening screws to manipulating a motorcycle brake lever.,"C demonstrates expertise by adjusting the door handle, smoothly shifting to motorcycle work, and effortlessly concentrating on tasks.",C demonstrates aptitude and caution by routinely switching between tools suitable for each specific task and employing an impressive range of skills while maintaining an organized workspace.,"C reveals proficiency by utilizing an array of tools, consistently observing the construction process, and maintaining a steady hand throughout the installation of both a door handle and a motorcycle brake lever."
batch6_0,2017,"What can you conclude about c's actions involving the can of paint in the video, and what do you think was the motivation behind these actions?","C's actions involving the can of paint were to secure the lid, preventing potential spills or mess, by placing the lid, covering it with a paper towel, and hammering it shut.","C's actions involving the can of paint were only to move it around the workspace, and the motivation was to create more space for other tasks.","C's actions involving the can of paint revolved around painting, mixing colors, and cleaning his paintbrush.","C's actions involving the can of paint were focused on making an art project, and the motivation was to create a masterpiece.","C's actions involving the can of paint were centered on opening, closing, and stirring the paint, so he could check the paint's consistency."
batch6_0,20191,"Considering the entirety of the video, what are the two distinct types of actions c primarily performs, and how do these actions contribute to the overall plot?",C focuses on painting the room ceiling and interacting with the woman regarding the bathroom lighting situation.,"C primarily paints and converses with the woman about the kitchen and bathroom designs, as well as the overall renovation process.",The two distinct actions are c painting the ceiling and demonstrating the correct way to use the paint roller brush to the woman.,C mainly paints house areas and collaborates with the woman for effective renovations.,He focuses on painting the room ceiling in one instance and teaches the woman about proper painting techniques in another.
batch6_1,5502,"Determine what the most crucial sequence of actions in the video is, while avoiding merely repeating the step-by-step narrative. explain why it is the most important.","The most crucial sequence is c drawing and erasing in the book, as it represents the main creative task within the video.","The most important sequence is when c organizes the bookshelf and arranges a bookend, as it displays their attention to detail.","The pivotal sequence is when c arranges the bookshelf, then talks to a woman, as it shows a break before moving on to the drawing task.","The most crucial sequence is when c draws on the book, erases it repeatedly, and picks up books from the floor, as they indicate multitasking skills.","Primary actions include organizing bookshelf and drawing on a book, emphasizing balance between tidiness and creativity."
batch6_0,2398,"Identify and explain the three most important tasks c carries out in the video, taking into account their significance in the greater context of the scene.",The most important tasks are,The top three tasks are,The essential tasks are,C's primary tasks are,C's key tasks
batch6_1,26252,"Based on the entire video, explain how c adapts her technique throughout the process of hanging laundry on the rope.",C adjusts her technique by holding pegs in her mouth to streamline the process.,"C persistently hangs laundry, uses pegs from the basket, and shakes items before hanging.","C changes her approach by putting the sock on the washing machine, adding variation in her approach when hanging laundry.","C sequentially takes a cloth from the washing machine, flaps the cloth, and uses pegs from the basket every time before hanging.",C occasionally takes a longer pause to scratch her head and develop a sound hanging technique for the laundry.
batch6_0,48006,Summarize the primary action occurring throughout the video and discuss how it relates to the interaction between c and the girl.,"The primary action is writing, with c frequently adjusting papers while the girl writes using a pencil.","C and the girl regularly arrange papers and sometimes write, mainly concentrating on organizing.","The primary action involves c writing using a pen and the girl adjusting papers on the notebook, which constitutes a collaborative effort.","C mainly focuses on writing using a pen while the girl drops and picks up her pencil, making it difficult to understand the task at hand.","Both c and the girl mainly adjust papers and write occasionally, showing that they are working on a drawing task rather than a writing task."
batch6_0,116504,What is the overall objective of c's actions with the cloth and clothing items throughout the video?,C's overall objective is selecting and examining clothes.,C's ultimate goal is trying on clothes and assembling outfits.,C is just organizing the clothes and accessories in the room.,"C organizes storeroom, hangs fallen clothes.",C is helping someone else choose clothes by demonstrating how to evaluate them.
batch6_0,63144,"How do the man and c work together in the video, and what are their respective roles in the process?","The man primarily applies mortar and uses tools to shape it, while c's main tasks involve selecting, transporting, and interacting with bricks.","In the video, the man puts on a safety helmet while c mixes mortar, then they lay bricks together by aligning them with a long ruler.",Both the man and c share tasks relating to the handling of mortar and bricks while also collaborating on detailed measurements of the construction layout.,"The man leads the project by instructing c on the proper way to move materials and the proper technique to apply mortar, while continuously monitoring the construction site.","To build the wall, the man and c alternate tasks such as applying mortar and stacking bricks, with both continuously involved in every stage of the process."
