batch_name,video_id,question,correct_answer,wrong_answer_1,wrong_answer_2,wrong_answer_3,wrong_answer_4
batch6_0,64269,"Considering the entirety of the video, what are the key techniques used by c and how do they contribute to the final result?","Key techniques include wetting the brush, applying and wiping off paint, and using tissue paper to clean or modify layers.",C meticulously layers the paint until the desired effect is achieved and uses the tissue paper to separate the layers.,C prefers to apply large amounts of paint and later use tissue paper to create abstract shapes by removing some paint.,"The artist uses variations in brush strokes, relies on tissue paper to smudge paint, and curates the overall composition.","C focuses on loading the brush with multiple colors to create a unique blend, with tissue paper to refine the brush strokes."
batch6_0,91926,In what ways does c ensure that the green vegetables are clean and free of dirt during the harvesting process? analyze his actions and explain the importance of these techniques.,C cleans green vegetables by dusting off dirt and shaking off the sand from the roots.,C ensures cleanliness by washing the green vegetables in water and drying them in the sun.,C uses a brush to remove all dirt before placing the vegetables in a container with a lid.,C washes each vegetable with soap and water and then rinses them thoroughly.,C carefully selects only the cleanest vegetables to pick and collects them in a bag.
batch6_0,48039,"Summarize the key actions and transitions that take place in the video, from beginning to end. focus on the high-level details and provide an overview of the video contents.","C retrieves a pen, transitions from one room to another, and engages primarily in writing activities.","C takes a pen from a bag, holds it with both hands, walks to another room, talks to a girl and writes multiple times on a desk.","C enters a room, picks up a pen, sits down, and interacts with multiple objects while focusing on writing activities and occasionally interacting with a girl.","C moves through rooms, interacts with items and a girl, focusing on pen usage and writing.","C retrieves a pen, moves a few items in a room, carries out numerous writing actions, and has a brief, yet significant interaction with a girl in the middle of the video."
batch6_1,56806,"Based on the variety of actions performed by c throughout the video, what would you say is the main goal they intended to achieve? justify your conclusion by compressing and summarizing the crucial actions carried out without listing them individually.",The main goal was to prepare and adjust the trousers for further alterations or potential repairs.,"C aimed to scrutinize the trousers' quality control, focusing on seams, leg tips, and threads.","The primary purpose was to establish a synchronized and dynamic workflow between c and the man, focusing on effective communication and multitasking.","C intended to educate the man on tailoring techniques, showing an array of actions like handling scissors, manipulating threads, and adjusting fabric on a sewing machine.",The dominant aim was to explore and experiment with unique sewing methods to achieve innovative design elements on the trousers.
batch6_0,7781,"What are the most important and critical actions performed in the video to achieve the desired outcome, and what roles do they play in the overall process?","Critical actions include measuring and cutting the wood, drilling holes, securing with screws and hammer, and positioning the structure.","Crucial steps involve precise cutting, intricate assembly, and expert fastening application for a sturdy, well-fitted final product.","Essential actions consist of the exact measuring and marking of dimensions, employing advanced cutting techniques, and the subsequent joining, assembling, and securing of various components.","The critical activities involve meticulous planning, execution of precise cutting processes, and the utilization of specialized tools that allow for seamless joining and securing of the wooden pieces.","The video highlights the importance of detail-oriented planning, strict adherence to measurements, masterful handling of an assortment of tools, and dexterity in assembling and finishing the structure."
batch6_0,4628,"Identify and discuss the two most significant actions, events, or elements of the video that reveal its overall purpose or theme.","Two significant elements are c's repeated stove maintenance and her ongoing conversation with the woman, highlighting domestic chores and interpersonal interactions.",The key themes of the video are fire safety education and establishing proper communication in a domestic environment.,The focus of the video lies in the art of breaking down wood pieces and using them for various domestic tasks.,"The video emphasizes the importance of cleanliness in a kitchen environment, specifically by disposing of dirt and wood particles.",The major themes of the video revolve around the presence of children in a kitchen setting and the associated risks.
batch6_0,5152,"Based on the character's actions, what progression of actions led to consuming a snack and preparing a hot beverage? summarize the essential steps the character took in order to achieve these objectives.","The character took a banana, peeled it off, ate it, and then prepared tea with a tea packet, hot water, and a cup.","The character found a ripe banana, consumed it, and proceeded to make tea using teabags, hot boiling water, and his favorite mug.","The individual made use of a food item found on the counter, ate it, and then prepared a warm drink by boiling water and steeping tea leaves in a delicate teacup.","The character had a fruit, engaged in household tasks, and later engaged in the preparation of a comforting hot beverage using tea leaves, boiling water, and a teapot.","The protagonist had a snack, then brewed tea to their preferred strength."
batch6_1,78362,"Describe the overall process that c conducts in the video, including the main components he works with and the tools used. consider summarizing and comparing longer parts of the video, rather than listing individual actions.","C performs a series of steps to fix a bolt in the acting cylinder, maintain a valve core by cleaning and lubricating, and finally replacing its seal ring.","C tightens a bolt in the acting cylinder, cleans a valve core, replaces a seal ring in the valve core, applies lubricant to his hands, and moves other objects on the workbench.","C carries out an assortment of tasks, like picking objects from the table, using a tweezer, and attaching a seal ring to a valve core in a lengthy process.","C meticulously interacts with multiple tools, bolts, and cylinders on a workbench, adjusting and maintaining the valve core as needed.","C works on an acting cylinder, valve stem, and valve core while utilizing various tools like lubricant, spray gun, and scriber to achieve his goal in an elaborate process."
batch6_1,2167,"Summarize the critical steps taken by c and the man to complete their tasks, and explain the overall purpose of these actions.","They prepared the wood pieces, interacted and delegated tasks, and fixed the wood flooring together.","The man measured, cut, polished, and placed wood flooring pieces in order.","They developed a detailed woodworking plan, consistently checked wood quality, and adjusted their strategies accordingly.","They collaborated by sharing their expert opinions, solving complex problems, and navigating through obstacles until the wood flooring was ready.","They worked in perfect harmony, assembling the jigsaw of wooden blocks and positioning them in a specific pattern."
batch6_0,5670,"What role does the man and the dog play in the video, and how do their appearances influence the narrative of the video?","The man and dog's role is minimal, serving as background events in the video, unrelated to the flatbread preparation.",The man and the dog provide color commentary on c's culinary skills while exploring the apartment layout together.,"The man with the dog is a vision of c's future, representing the ultimate goal of perfecting the dish and sharing it with loved ones.","C looks up to the man and dog as mentors, taking inspiration from them during the process of preparing the flatbreads.","The presence of the man and dog adds an element of urgency to the preparation, as c seeks to complete the dish before their arrival."
batch6_0,117610,"Based on c's actions and adjustments throughout the video, what problem was c most likely trying to solve with the lawnmower?",C tried to resolve a potential issue with the lawnmower's performance by adjusting the choke and providing proper protection to the drive belt using the drive belt guard.,"C was likely addressing a performance issue with the lawnmower by organizing his workspace, moving wrenches, and adjusting the drive belt guard with the help of an impact driver.","C focused on resolving the lawnmower's problems by securing the tank lid, removing the touch light from the tank, and walking towards a hose.","C likely aimed to improve the lawnmower's condition by pointing the touch light inside the tank, moving the grease gun, and adjusting the hose connector.","C possibly focused on solving lawnmower problems by manipulating various tools, changing positions around the lawnmower, and completing various tasks like picking up a rag and adjusting the choke."
batch6_1,4256,What possible reasons could there be for c's intermittent behavior and how might their actions be related to their overall goal?,C's intermittent behavior could suggest problem-solving or deliberation focused on the stones and ropes.,"C's erratic behavior in the video suggests a deeper cognitive analysis, deciphering the purpose and connection between stones and rope segments.",The discontinuous nature of c's actions might reveal an underlying thought process or contemplation that revolves around comprehending the mysterious connection between the seemingly unrelated stones and lengths of rope within their environment.,"C's episodic engagement with both stones and ropes suggests that their seemingly erratic behavior is driven by conscious reasoning, possibly aimed at deciphering the relevance or function of the objects within their surroundings.","The unpredictable manner in which c repeatedly engages with stones and ropes could be a manifestation of their analytical mindset, as they attempt to unlock the cryptic relationship between these two seemingly unrelated items."
batch6_0,50021,"How does the process of their collaboration, including c and the woman's actions, contribute to the overall objective of the task they are performing?","Their collaboration streamlines the cement application process, with c continuously working on the wall while the woman prepares and provides cement.","The collaboration enables them to quickly finish painting the wall, with both of them working in synchronization on different sections of it.","The teamwork allows them to divide the labor of stacking bricks in a time-efficient manner, sharing the responsibilities of arranging and securing each brick.","Working together helps them manage the assembly and disassembly of scaffolding efficiently, allowing them to progress seamlessly to different sections.","The collaboration minimizes the time taken during a renovation project, as c works on interior tasks, while the woman facilitates exterior work."
batch6_0,85985,"Considering the entire video, what primary task do you think c is trying to accomplish with the various objects they interact with, and why do you think that?","C is trying to assemble and adjust a wheel-related object, likely pertaining to a vehicle.","C is preoccupied with ensuring that all objects in the garage are neat and organized, which is evident in their constant handling of various items.",C is focused on locating a specific tool in the garage and is not engaged in any other task.,"C's goal is to sort a box's contents, identifying specific objects.",C is devoted to exploring the functions of each object in the room and their relationship while not aiming to complete any specific task.
batch6_1,96176,"Considering the overall narrative of the video, identify the most pivotal moment or action that c performs, and explain its significance in the context of the video as a whole.","The pivotal moment is when c drops a picture, possibly signifying a change or completion of the creative process.","The most crucial moment is when c stares at a book, which represents the beginning of their creative journey, leading to subsequent artistic exploration.","The most critical event occurs when c finally draws on a book after a series of pen drops on paint, signifying an intentional artistic breakthrough.",C dropping a pen on paint highlights the significance of variety and change in creativity.,"The most impactful moment happens when c stares at a picture for a long time, indicating the intense focus and concentration required in their artistry."
batch6_1,2804,"Identify the key actions carried out by c to ensure a proper painting job, and explain why they are significant in the context of this video.","Key actions include properly utilizing the paintbrush, dipping it into the paint bucket frequently, and focusing on corners and edges.","Major actions include using unique tools, trying unconventional techniques, and experimenting with paint application methods.","Key steps include constant brush cleaning, avoiding paint drips, and using different brushes for various wall sections.","Key actions are the adjustment of painting tools, constant monitoring of paint supply, and thorough brush cleaning for perfect strokes.","Key actions involve working on hard-to-reach areas, adjusting tool selection, and practicing precision with brush and roller movements."
batch6_1,5472,"What rationale might the person in the video have for their specific sequence of actions with the bamboo, and how do these actions contribute to achieving the goal of the video?",The actions sequence is intended to prepare and refine the bamboo pieces for later use.,"The action sequence strategically ensured optimal bamboo conditions for intended purposes, with each step aiding the overall goal.","The well-ordered steps of selecting, cutting, and peeling the bamboo were crucial to ensure the bamboo pieces were sufficiently prepared for their designated function.","The person in the video followed a purposeful order of actions to guarantee the bamboo was suitably prepared and refined, contributing to the accomplishment of the video's goal.","An intentional sequence of actions was utilized, leading to the preparation and refinement of the bamboo, aiding in the achievement of the main objective of the video."
batch6_1,10519,"Can you summarize the major process of the video, identifying the key stages the protagonist goes through and how do they contribute to the overall purpose?","The major process involves preparing the paintbrush, painting the board, and cleaning tools.","The protagonist first sets up their workspace, then concentrates on painting, and finally tidies up, all contributing to the artistic endeavor.",Key stages,"The video depicts the preparation of materials, the actual painting process, and subsequent cleanup to maintain an organized workspace.","The protagonist's major process consists of setting up materials, creating the artwork, and packing up tools after completing their work."
batch6_0,2368,"What is the primary action sequence of the video, and how does it demonstrate c’s ability to organize and execute a series of tasks efficiently?","The primary action sequence shows c's efficient kitchen workflow in preparing, seasoning, and cooking food.","The primary action sequence displays c's keen attention to detail with precise chopping, dicing, and mincing.","The primary action sequence illustrates c's expertise in time management, juggling simultaneous tasks to create a delicious meal.","The primary action sequence emphasizes c's artistic plating skills, transforming simple components into a visually stunning dish.","Primary action shows c's expertise in cooking techniques like sautéing, searing, and poaching."
batch5_set_3,44446,"Based on the sequence of activities, discuss the primary objective c was trying to achieve in the video and the steps they took to accomplish this goal.",C sought to cut and mark precise measurements on the wood.,C aimed to find the right tools and gather all the necessary materials for an upcoming project.,C mainly focused on perfecting their technique and getting comfortable with using various woodworking tools.,"C aimed to repurpose wood via accurate measurements, cuts, and sanding.",C concentrated on practicing different woodworking techniques in real-time to compare their efficiency and performance.
batch5_set_3,50745,"What were the primary tools and components involved in the process, and how were they used together to achieve the task in the video?","The primary tools were the multimeter, motherboard, and capacitor, and they were used to test and troubleshoot the motherboard.","The main tools involved were the multimeter, motherboard, capacitor, solder gun, and cable; they were used together to assemble, test, and repair the motherboard in a sequential manner.","Motherboard, capacitor, multimeter, and solder gun were used throughout the video to perform multiple tasks like assembling the motherboard, testing the capacitor, and soldering the components.","The primary tools were multimeter, motherboard, capacitor and test cable, and they were used in a synchronized manner for testing, examining, and making repairs to the motherboard.","Essential video components included motherboard, multimeter, capacitor, and solder gun for assessing functionality and performing repairs."
batch6_0,103594,"Based on the recurring activities in the video, what can you identify as the central theme of the video?",The central theme of the video is organizing and cleaning shoes.,The video is focused on c's efforts to repeatedly tie shoe laces.,The central theme is the consistent opening and closing of the door.,C's primary focus in the video is adjusting and attaching the vacuum cleaner.,Video mainly displays c's walking and picking actions.
batch6_0,6313,"Considering the entire video, what would you say was the ultimate goal of c's activities in relation to the cloth and clothes? identify the primary purpose behind the tasks performed.",The ultimate goal was to neatly store the cloth and clothes in the drawer.,"C's primary objective throughout the video was to learn and eventually master different techniques for handling, folding, and finally storing the cloth and clothes in the drawer.","The main purpose behind the tasks was for c to evolve from a novice to a proficient cloth and clothes handler, ultimately achieving efficient storage in the drawer.","C's goal was to explore organization and storage methods for cloth and clothes, ultimately achieving a successful drawer arrangement.","C's overarching goal in the video was to improve their organization skills and develop a systematic approach for effectively managing the cloth and clothes, eventually storing them in the drawer."
batch5_sample_4,112038,Identify and discuss the most crucial actions c took during the video to prepare the mixture in the bowl. how do these crucial actions contribute to the main goal of the video?,"The most crucial actions were adding eggs, milk, and #unsure to the bowl, as these formed the mixture central to the video's purpose.",The most important actions were mixing the ingredients and focusing on the efficient usage of kitchen tools.,The significant actions included breaking eggs accurately and skillfully mixing ingredients to create the final product.,"The main actions were revolving around food handling, ensuring hygiene, and maintaining a tidy kitchen environment.",The most essential actions were all those executed between opening the fridge and cleaning up after the preparation.
batch6_1,95427,Identify the moment when the interaction switched from the primary task to a secondary task. explain briefly what happened during this transition and why it might be meaningful.,The interaction switched to a secondary task when c picked up a pen and paper.,The woman's strategy changed as she aligned cards with both hands.,"The shift took place when the cards were flipped, changing the focus from the previous set of actions.",The moment of transition was when c and the woman began dividing the cards in a new manner.,The interaction changed when they started to play a secondary card game alongside the main one.
batch6_1,56704,"Identify key moments in the video where c interacts with the dough in particularly unique or important ways, and explain why these actions contribute to the goal.","Key interactions include flattening, flipping, and layering dough, which contribute to shaping and texturing the final product.","C interacts in critical ways like dropping the dough in the tray, picking it up with hands, flipping on the pan, and cutting it, which all help in achieving the ultimate structure and texture.","Essential steps like rolling, turning, and touching the dough impact its final shape, texture, and thickness.","Important moments involve c rubbing hands on the dough, adjusting its position in the bowl, moving the tray, hitting the dough, and using a combination of flipping and tossing each dough, adding to the end product.","C's unique interactions include using the rolling pin, moving the dough on the wood, flipping and layering dough on the pan, and picking dough from the tray, which ensures proper dough shaping and texturing."
batch6_0,36259,Which key steps contributed most to the shoe's completion and why do you think these were crucial to the overall process?,The key steps include fixing the shoe by pulling and securing threads and applying glue to the shoe and insoles.,"Pulling threads, touching nose and face, adjusting tools, cutting threads, and applying glue were the key steps in making the shoe.","The key steps included pulling threads, securing threads, picking up and using different tools to work on the shoe, and picking up the shoe.",Crucial steps,"The key steps consisted of pulling and fixing threads, holding the shoe, using tools like the awl and knife, and rubbing glue on the inner part of the shoe."
batch6_0,40973,"In what ways does the narrator's behavior and focus change throughout the video, and how do these changes highlight their priorities?","The narrator's focus shifts between the phone, surroundings, and the dog, highlighting a balance between maintaining control over the dog and situational awareness.","The narrator's behavior changes drastically as they keep switching between different objects of focus, suggesting an inability to concentrate.","The narrator's attention is predominantly on the phone, with occasional focus on the dog, suggesting their priority is staying connected to the digital world.","The narrator appears to prioritize the environment over the dog, spending more time observing their surroundings than the dog itself.","Despite some changes in focus, the narrator's priorities remain unclear as the actions don't show a significant shift in behavior during the video."
batch6_1,54008,"Identify the three most critical steps ""c"" took to complete their responsibilities in the video, and explain why you believe these particular steps were essential.","Key steps include disposing of waste, cleaning after food preparation, and sorting laundry between machines.","Essential steps involved kitchen knife use, cooker operation, and laundry organization.","Crucial actions were handling a cloth, opening a washing machine, and maintaining cleanliness in the kitchen and laundry areas.","Disposing of waste materials, washing hands after performing tasks, and utilizing washing machines effectively for sorting laundry.","Essential steps involved utilizing a knife, managing personal hygiene by washing hands, and organizing clothes among washing machines."
batch6_0,124692,"Based on the sequence of the activities, can you identify a pattern in the way c approached the task? please explain in a condensed manner.","C had a repetitive pattern of ironing the dress, adjusting its position, and stretching it.",C displayed a haphazard pattern that included wandering around the house and sporadically addressing the dress.,The video showcased an inconsistent pattern where c alternated between focusing on the dress and other unrelated tasks.,C organized items sequentially before focusing on the dress.,"Throughout the video, c seemed to follow a clear pattern of attending to items around the house before working on the dress."
batch6_1,6914,"What are the overall goals of the actions that c is performing throughout the video, and how do these actions relate to one another?",The overall goals are supporting and securing the plants using sisal fiber.,The main goal of c's actions is to organize the plants and teach them how to grow in a straight line.,The main objective is to prune the plants and help them grow uniformly using various techniques.,C's actions are focused on removing pests from the plants and preventing damage by tying them with sisal fiber.,C's actions aim to uniformly irrigate and direct plant growth.
