batch_name,video_id,question,correct_answer,wrong_answer_1,wrong_answer_2,wrong_answer_3,wrong_answer_4
batch6_1,1835,"Based on the actions performed in the video, what can you infer about c's strategy or priorities when washing different items in the kitchen?","C seems to prioritize cleaning glass cups first, followed by other utensils like a grater, and then focuses on larger items like a jar.","C appears to focus on washing lighter objects first, such as mugs and portable objects, and then moves on to heavier and larger items like pots and trays.","It is evident that c prioritizes washing items in alphabetical order, starting with containers and ending with utensils like spoons and spatulas.","C appears to have no distinct strategy, washing items haphazardly without any specific order or priorities in the cleaning process.","C seems to wash objects according to their dirtiness, starting with the least dirty and progressing to the dirtiest items in the kitchen."
batch6_0,2060,"Identify a key turning point in the video where c switches her method of cleaning the cloth, and discuss the potential reasons for this change in her approach.","The turning point was when c started to use her hands instead of a brush, likely for more thorough cleaning.","The turning point emerged when c began to pour water from the jar onto the cloth more frequently, providing a more efficient cleaning process.","The pivotal moment occurred when c decided to keep adjusting the cloth while only using the brush occasionally, leading to a cleaner cloth in the end.","The turning point came when c focused on constantly dropping and picking up the brush, which might have been a tactic to preserve energy.","A major shift occurred when c raised the cloth and immersed it in water, enhancing cleaning efficiency."
batch6_0,106180,"Identify the primary actions that c took in preparation or adjustment of the marble roller coaster, as well as the secondary actions that signaled a pause or shift in focus.","Primary actions were adjusting knobs and attaching pieces, while secondary actions involved adjusting glasses and handling scissors.","Primary actions involved establishing the foundation and outlining, with secondary actions being leaflet review and handling phone calls.","Main tasks involved sorting pieces and laying out the roller coaster track, while secondary actions included polishing pieces and cleaning the workspace.","Primary actions were painting and labeling components, while secondary activities consisted of designing the roller coaster's aesthetics and logo.","Core activities centered on building the roller coaster's main structure, while secondary tasks consisted of taking progress photos and recording assembly videos."
batch6_0,111752,"Based on the video, what seems to be the person's primary concern when interacting with the books and how do they address this concern?","The primary concern is keeping the books clean, addressed by using a cloth napkin for wiping.","C's main concern is the books' structural integrity, which is addressed by fixing any damaged parts.",C focuses on each book's readability by reading a paragraph from all.,C focuses on the categorization of books and addresses this by sorting them based on their subjects.,"C's primary concern is the value of the books, which is addressed by assessing them for rarity and monetary worth."
batch6_1,2332,"What were the key steps in preparing the salad, and how does this preparation differ from the handling and storage of the oven plates?","Key steps in preparing the salad include seasoning, shaking, and refrigerating, while oven plates are covered with foil and stacked.","Steps in preparing the salad are eating, arranging, and cutting, while oven plates are picked, carried and returned.","Salad making involves picking, cutting, and arranging ingredients while oven plates are spiced, shaken, and refrigerated.","In the video, the salad is prepared by pouring spices and cutting ingredients whereas the oven plates are assembled with tongs and foil.",The salad is prepared by opening and closing the fridge and the oven plates are stored by walking in the kitchen and picking items.
batch6_1,1829,"Identify the turning points in the video, where c shifts her focus from one set of items to another, and explain how they contributed to the overall completion of the cleaning process.","Turning points include shifting from rinsing to washing with a sponge, and transitioning between different types of items, like plates, cups, and covers.","C transitions between gloves, managing the tap, working with different kitchen items such as plates, cups, and utensils, returning to the tap, and closing the process by washing her hands.","Turning points in the video encompass shifting from cleaning items in the sink to placing them on the plate rack, then proceeding to wash items on the kitchen counter, and returning to the sink.","The video demonstrates initial and final rinsing, sponge washing, and water conservation for each kitchen item c manages.","Turning points involve alternating between rinsing different types of kitchen items, taking breaks to wash a few items in the meantime, and then returning to the initial rinsing process."
batch6_0,118127,What were the two main activities the man and c were engaged in throughout the video?,The main activities were building a stack of wood blocks and handling different objects.,"During the video, the man and c were mainly creating complex structures and eating.",The man and c were primarily sorting through various objects and placing them in strategic arrangements.,The main activities by the man and c involved handling different utensils and constructing a pyramid.,The man and c were focused on arranging items on a table and exchanging small objects between one another.
batch6_1,99947,What is the overall purpose of the tasks and actions performed by c throughout the video?,The overall purpose is to create bricks by molding mud and sand.,C is attempting to rearrange bricks on the floor.,The primary task is to prepare the mud and sand mixture for some construction work.,C is mainly interested in transporting bricks from one place to another.,The objective of the actions is to clean the pan using mud and sand.
batch6_1,6624,Analyze the girl's approach towards her meal in the video. what specific actions does she take during her eating process and why might she have made those decisions? provide an explanation that compresses her actions.,"The girl selectively eats noodles and chicken but occasionally disposes of the chicken, indicating a preference for noodles.","The girl is indecisive about which part of her meal she enjoys the most, so she changes her choices after starting and stopping several times.",The girl becomes increasingly irritated with her meal and begins throwing food around in a chaotic manner.,The girl shows exceptional table manners and careful etiquette throughout the meal and performs each action with great precision.,"The girl experiments with new ways of eating her meal, challenging traditional conventions and attempting to create new food trends."
batch6_1,13189,"Considering the sequence of events, what would you deduce is the main purpose of this video and why?",The main purpose of the video is to demonstrate how to replace a trimmer line on a grass trimmer.,"The video showcases various tools like pliers, trimmers, and tables utilized in a workshop setting.",The video intends to exhibit c's physical dexterity by showcasing multiple hand movements and actions.,The primary goal of this video is teaching viewers how to walk between different tasks with efficiency.,The video is meant to display the organization of tools and equipment in an outdoor environment.
batch6_0,2222,"Describe the overall creative process that c goes through in the video, focusing on key elements and the general flow of events.","The creative process involves sketching, erasing, adjusting, and assembling a final piece.","C begins picking up a pencil, erasing drawings, wiping the notebook, drawing, and tearing paper.","The video shows c repeatedly drawing, erasing, and tearing paper during their art journey.","C starts the creative process by picking a pencil, erasing a drawing, and repeatedly sketching until they are satisfied with the results.","The video sees them extensively drawing, erasing numerous times, walking around the house, finally working on a clean piece of paper."
batch6_0,55145,"Based on the cooperation and interactions observed between c and the man, provide a concise yet comprehensive description of their teamwork dynamics and how those dynamics contributed to the video's objective.",They assisted each other in the mortar application process while occasionally conversing.,C and the man worked together closely in a highly coordinated manner to apply mortar to the wall while also taking frequent breaks to communicate and discuss further project plans.,The teamwork dynamics were characterized by a high level of coordination and communication that allowed them to seamlessly carry out separate tasks while occasionally assisting each other.,"They collaborated and cooperated to create smooth workflow, switching roles and communicating clearly.","C and the man displayed a highly efficient and smooth teamwork dynamic that relied upon mutual understanding of their roles and objectives, leading to continuous progress through the wall construction process."
batch6_0,22288,"Identify and elaborate on the critical moments in the video that demonstrate c's behavior, and explain the significance of these moments in relation to his overall activity?","Critical moments include c's repetitive strawberry picking and placing them in a polythene bag, indicating c's primary activity, and his interactions with workers.",The video highlights c's observation of the farmland by walking around and his engagement in a conversation with workers about the growth of the strawberry plants.,The critical moments in the video include c's close inspection of the strawberry plants and his discussion with workers about the best methods for picking the strawberries.,"C's actions show careful polythene bag handling and examination after each strawberry collection, and discussing it with workers.","The video showcases c's meticulous attention to his clothing as he adjusts it, coupled with his keen interest in engaging with workers, shedding light on their farmland experiences."
batch5_set_3,49176,"Based on the video, how would you characterize c's decision-making process for selecting clothes? summarize their key considerations and behaviors.",C's decision-making process involves evaluating and comparing various clothing items while adjusting hangers and racks.,"C thoroughly inspects every clothing item in a sequential order, spending an equal amount of time weighing the pros and cons of each piece, before reaching a final decision.","In decision-making, c forms rules prioritizing fashion statements and seasonal factors for clothes selection.","C uses a trial-and-error method, focusing on assessing their emotional response to each clothing item in the store before deciding if it's worthy of a purchase.","C takes a relaxed approach and doesn't bother focusing on any specific criteria or steps, as they believe that the ultimate choice will come down to their gut feeling."
batch6_1,27129,What are the main steps involved in the repetitive process that c is performing throughout the video?,"C repeatedly picks up boards, runs them through a crate machine former, and places the egg crates into a cage.","C picks up boards, adjusts the crate machine, places egg crates into the cage, and climbs the cage.","C collects boards from the ground, runs them through the crate machine former multiple times, and places the finished egg crates into a stack on the wall.","C places boards under the crate machine former, removes them, and distributes egg crates into multiple cages.","C picks up the boards, inspects them, runs them through the crate machine former, and adjusts the egg crates in the cage with a hose."
batch6_0,105961,Discuss the significance of c's actions adjusting the fabric on the table in relation to the main action performed in the video.,Adjusting the fabric ensured it was smooth and properly ironed.,Testing iron temperature involved adjusting the fabric.,The main purpose of adjusting the fabric was to present various angles for easy camera recording.,C adjusted the fabric multiple times to find the position that provides the best ironing results.,Adjusting the fabric was a way of cooling it down after applying heat from the electric iron.
batch5_set_3,120974,Analyze the sequence of tasks in the video and determine if there is a central action or dominating theme that recurs throughout the process. provide a concise summary highlighting this theme.,The dominant theme is onion preparation for cooking.,The perpetual focus of the video lies in maintaining cleanliness and order in the kitchen.,The central element of the video involves extracting maximum flavor from various ingredients.,The main theme addresses human-object interaction complexities in crowded areas.,"The dominant narrative is one of constant motion, specifically exploring diverse ways to handle objects within the kitchen."
batch6_0,8176,"Identify any key objects or tools utilized by the individual in the video, and explain their significance in relation to the main activity being performed.","Key tools utilized include a marker for marking wooden pieces, a pipe wrench, and an adjustable clamp.","Several objects are used, such as a pencil, a glue gun, a white box, a pipe wrench, and an adjustable clamp, which enable the individual to complete various tasks.","The individual makes use of a marker, keys, a glue gun pipe, a pipe wrench, and an adjustable clamp throughout the video, each serving different purposes.","Main activity relies on tools such as pencil, marker, wooden planks, pipe wrench, and adjustable clamp for task completion.","The individual employs various tools such as a marker, a set of keys, wooden planks, a pipe wrench, and an adjustable clamp to accomplish individual steps of the overall activity."
batch6_0,78208,What was the general sequence of actions performed by c while cleaning various kitchen items?,"C cleaned various kitchen items in a systematic sequence of cleaning, rinsing, and placing items on the sink top.","C started by applying soap to the sponge, then scrubbing the items, shaking excess water, and placing them in a drying rack.","C applied soap, washed the dishes one by one, shaked off water, and air-dried the items on a drying mat.","C started by sorting all kitchen items, washed them with soapy water, rinsed the items, and stacked them on the counter.","C first soaked the items, scrubbed them using soapy water, washed off the soap, and let the items dry on their own."
batch6_1,127027,What are the key steps c took to manipulate the materials in the video to achieve their goal?,"Key steps were transferring the needle, cutting and straightening threads, holding and stitching cloth, and tying the roll of thread.","They unwrapped a new sewing machine, selected the appropriate stitch settings, and adjusted the fabric holder for accurate sewing.","The primary actions were threading a loom, weaving fabric, and cutting the final product when finished.","Important steps included spinning yarn from raw materials, measuring and cutting fabric, and then using a sewing machine to create seams.","They primarily focused on choosing the right color combination, picking the perfect pattern, and using a crochet hook to create the design."
batch6_1,5729,Analyze and address any overarching theme for repetitive actions in the video and identify the critical steps that contributed to the success of c's overall goal.,"The overarching theme is the repetitive process of dipping, scooping, and painting; adjusting the plank and turning it over were critical steps.",The key theme is repetition in the painting process; critical steps for c's purpose were adjusting the plank and ensuring proper paint consistency.,The overarching theme involved facing and overcoming challenges; turning the plank and learning different bowl-holding techniques were critical steps.,"The main theme is adapting to various painting techniques; adjusting the plank, switching hands, and maintaining focus were critical steps.","The overall theme is experimentation in painting methodology; adjusting the plank, dipping, and scooping were crucial in reaching c's goal."
batch6_1,1841,"Describe the process of c cleaning an individual item, focusing on the key steps, and compare this process when she cleans cups, dishes, and the variety of kitchen utensils.","C picks up an item, rinses it with both hands, and then places it in the appropriate location after cleaning.","C rinses, soaps, washes, and dries an item with one hand.","The cleaning process involves c picking up an item, rinsing it with both hands, and constantly waving it in the air until it dries before placing it in the right location.","C picks up an item, rinses it with water for an extended period, adds soap, scrubs it thoroughly, and then rinses it again before placing it in its location.","C's cleaning process involves using a cloth, soap, and water to scrub each item before rinsing and placing it in the designated location."
batch6_1,78256,"Summarize the sequence of c's actions in the kitchen involving the use of kitchen napkins, and compare the use of kitchen napkins with tissue papers while performing cleaning tasks in the video.",C uses kitchen napkins for hanging and tissue papers for cleaning various surfaces in the kitchen.,C mostly uses kitchen napkins for cleaning and tissue papers for hanging.,"C exclusively uses tissue papers throughout the whole video when cleaning the kitchen, while ignoring the existence of kitchen napkins.","C cannot distinguish between tissue papers and kitchen napkins, inappropriately using them interchangeably.",C initially uses kitchen napkins but later replaces them with tissue papers for the cleaning of different surfaces in the kitchen.
batch6_1,3548,Can you analyze c's behavior throughout the video to identify moments of multi-tasking or careful planning? explain why these instances reflect the ability to manage time and resources efficiently.,"C demonstrates efficient multitasking when preparing dough and making coffee, adjusting the camera along the way.",C shows time management by stirring and checking the oven while organizing the kitchen.,"C manages tasks by chopping vegetables and setting the table, then cleaning up as food is cooking.","C efficiently prepares ingredients, portions them out, and stores leftovers for future use.","C highlights organization as they prep, cook, and complete tasks in a specific order to save time."
batch6_1,7795,Analyze the overall cooking process and identify key moments in the video where 'c' made decisions that influenced the outcome of the dish.,"Key moments include washing and rinsing ingredients, arranging items in the frying pan, and managing cooking appliances.","Key moments include discussing different recipes, selecting the right ingredients, and adjusting frying pan placement.","Critical decisions involved experimenting with seasonings, changing cooking equipment midway, and arranging ingredients in a specific order.","The primary moments were choosing a cooking method, conducting taste tests, and modifying recipes infused by different cuisines.","Influential decisions were to prepare multiple dishes simultaneously, frequently check on the cooking, and alter the final presentation."
batch6_1,117213,Analyze the significance of c switching between her left and right hands while handling the collard green vegetables throughout the video.,C switches between her hands to efficiently transfer and plant the collard green vegetables.,C's switching hands is purely a random habit without any clear purpose.,C switches between hands to showcase her ambidexterity rather than maximizing efficiency.,C switches hands frequently because she gets tired and needs to rest one hand while using the other.,The alternating between hands is meant to confuse viewers about c's planting technique and intentions.
batch6_0,34594,"Determine the main purpose of c's actions with regards to how they interact with the books, and explain how this is demonstrated throughout the video.",The main purpose of c's actions is to organize the books on the shelf.,"C's main goal is to explore different books, and they arrange them on the shelf to facilitate browsing.",C's main goal is to choose favorite books and organize them effectively on the shelf.,"C's actions focus on evaluating, reading, and organizing books in order to create a curated collection.","C aims to find books for a specific reason, arranging them on the shelf in a particular order to recall their content."
batch6_1,7446,How does c's interaction with the tissue and disinfectant evolve from the beginning to the end of the video? analyze the change in techniques and the reasons behind them.,C's interaction evolved from wiping surfaces to using more disinfectant and focusing on the boot.,C used more tissues and less disinfectant as the video progressed.,C's focus went from the boot to cleaning the car windows.,C began to clean the windows and gradually moved to the doors.,C started spraying the disinfectant directly onto the car instead of on the tissue.
batch6_0,117043,"Identify the three most important components of the video in terms of actions, interactions, and outcomes. explain their significance and how they further the narrative of the video.","The three important components are the conversations between c and the woman, the introduction of the man, and the final interaction with the coffee machine.","The most significant aspects include the interactions between c and the woman, the arrival of another character, and the final involvement with a cell phone.","The critical components feature the conversations between c and the woman, the introduction of a map, and the duo collaborating to discover a location.","The essential elements involve the dialogue between c and the woman, the introduction of a travel agent, and the final decision about a vacation destination.","The vital parts encompass c's communication with the woman, the entrance of another character, and the conclusion with a discussion centered on a sports event."
batch6_0,36130,"Based on the high-level events depicted in the video, what would you say is the central goal for both c and the man, and how do they work towards achieving this goal?",Both c and the man aim to sort and organize bags in the cabinet.,Both c and the man have the central goal of configuring electronic devices and tend to connecting wires and setting up speakers.,The central goal of c and the man is to prepare delicious meals by carefully selecting ingredients and using various cooking techniques.,"C and the man are focused on sewing shoes, working together by sharing needles, threads, and spools.",The goal
batch6_0,6840,"Based on the sequence of events, how would you interpret c's primary objective throughout the video?",C's primary objective is organizing and packing clothes.,C's primary objective is adjusting her hair.,C's primary objective is picking different objects from the room.,C's primary objective is to move around the room and interact with various items.,C's primary objective is to perform random household tasks.
batch6_0,35134,"Based on the recurring actions and the video's progression, which steps can be considered the most crucial for c in his task?","The most crucial steps for c were adjusting, cutting, and inspecting the mask to achieve the desired result.",Primary steps for c's task,"It is evident that c's main focus was on selecting materials, sketching the plan, and configuring the final design.","The most essential steps included ensuring the correct composition, modification, and decoration of the mask.","The most important steps for c were placing the mask on the table, handling it, and using various instruments."
batch6_0,106535,"While considering the various actions c performed in the video, identify the overarching tasks present and how these tasks relate to each other.","The overarching tasks are managing laundry, organizing the living space, and cleaning dishes; they contribute to maintaining a clean and orderly home.","The primary tasks involve interacting with objects, turning off switches, and disposing of a polythene bag; they are linked through c's consistent engagement with her surroundings.","The main tasks in the video are laundry management, hanging socks on wooden hangers, adjusting various objects, and cleaning dishes; they are all connected through c's desire for a tidy and clean apartment.","Tasks involve organizing items, operating switches, and navigating the apartment to maintain a clean, pleasing environment through c's efforts.","In the video, c focuses on managing laundry, rearranging objects, and regularly walking between rooms; these tasks are combined through her intention to establish an orderly and structured living space."
