video_id,video_url,question,correct_answer,wrong_answer_1,wrong_answer_2,wrong_answer_3,wrong_answer_4
111447,,"From the actions observed in the video, what do you think is the primary setting and purpose of the scene? explain your reasoning without listing individual actions.?","A domestic space during mealtime, as they prepare and consume food together.","C collects ingredients, prepares and cooks, multitasking with her phone.",Preparing food with attention to tidiness and efficiency,"Primary actions are eating and drinking; supporting actions involve handling plates and glasses, and using the fridge.",Preparing a meal and setting up the table for guests.
104742,,Can you describe the main process c performs in the video? please summarize and compare the different stages of the process.?,C repetitively prepares dough by flattening and flipping it using a rolling pin.,"C is making bread, using the dough roller to knead the dough and the cooker to ferment it before baking.","C primarily prepares and rolls the dough, while the woman focuses on cooking and adjusting the camera.","Primarily washing wine glasses, with differences in sponge usage and holding glasses with the left hand","The actions with the ingredients and utensils demonstrate c's process of combining, mixing, and cooking the ingredients in the saucepan."
77731,,"Considering the entirety of the video, which part of the process do you believe was the most difficult or time-consuming task for c and why? please provide a reason based on their actions.?","The most difficult task was removing and adjusting bolts, as c spent considerable time with various tools like screwdrivers and spanners.",Assembling and adjusting components,C is focused on adjusting and removing bolts,C repetitively prepares dough by flattening and flipping it using a rolling pin.,Increased focus and concentration
117534,,"What are the primary artistic activities that c engages in throughout the video, and how do these activities relate to each other in the overall process?","C primarily paints and measures pictures, with painting being an expression stage and measuring ensuring structural precision.","C cut and measured planks, arranged them on the frame, and adjusted the position","Preparing and cooking vegetables, with stages: cutting and peeling onions, slicing and bagging tomatoes, chopping lettuce, and cooking onions in a pot","C lubricates her hand, cuts, squeezes, and forms dough balls, and dips them in oil","C prepared paint and filler using cans, brushes, and spatulas, then applied them on walls and objects"
38134,,"If you were to give a title to this video that captures the main activities of c and the boy, what would it be and why?","""indoor-outdoor chores""","C mainly focuses on uprooting weeds and disposing them, using his hands, a pair of scissors, and a dustbin.",Consistent focus on cleaning and organizing the kitchen,C is primarily focused on cleaning the garage by sweeping the floor using a dustpan and brush and organizing the tools.,"The main activity featured was arranging garments, including the use of a pressing board, clips, and round necks."
111467,,"Evaluate the significance of c's shifting between different activities, particularly focusing on the relationship between reading the paper and using the phone. what might this reveal about c's primary objective in the video?",C's alternating between reading the paper and using the phone may suggest a need to cross-reference information or a desire to verify the accuracy of the information obtained.,C's main objective is organizing ingredients from cabinets and fridge,"The main objective was to create dough-wrapped sausages, with visible differences being the addition of red pepper and oil in some preparations.","In the kitchen, mainly participating in activities related to cooking and food preparation",The objective is to create a mask with elastic threads; key stages are sewing the mask and attaching the elastic threads.
104017,,"Taking into consideration the primary tasks completed by c, can you provide a succinct summary of the intended goal of these actions without enumerating each specific task?",The main goal is tidying up by folding clothes.,"The actions with the ingredients and utensils demonstrate c's process of combining, mixing, and cooking the ingredients in the saucepan.",C repeatedly twists thread with the needle and operates the handloom to create fabric.,C's primary goal is to prepare celery by consistently cutting and chopping it.,Adjusting and straightening the cloth pieces
83719,,What were the two main activities the man and c were engaged in throughout the video?,Handling cards and eating,"C is cooking pasta, rolling and cutting dough using the dough roller and then boiling the pasta on the cooker.","C mixed paint and filler, then applied them on surfaces",Both were engaged in a card game.,Preparing and shaping the dough for baking
91080,,Summarize the development and progress of the board game-related activities demonstrated in the video.?,Progressed from examining the game to assembling and covering the box,Exchanging cards and adjusting their strategies,Competent and detail-oriented,C appears exploratory and purposeful,"The actions with the ingredients and utensils demonstrate c's process of combining, mixing, and cooking the ingredients in the saucepan."
79411,,"By evaluating c's actions, identify which sequences signify crucial turning points, and explain their significance in the overall process carried out by c.?",Manipulating the plastic cylinder and attaching it signified crucial progress in the overall process.,"C persistently uses the needle to knit, sew buttons, and thread through eyelets fabric in the making.","They seem to cooperate in different tasks, possibly working together to clean and organize the space.","C's overall purpose is to clean an object, with actions like washing, scrubbing, and drying contributing to this goal.","The character's involvement with paper, pen, and computer indicate he's focused on a task"
81661,,What is the overarching task that c is performing throughout the video and how does the lady's brief appearance contribute to this process?,"C is sewing, and the lady brings an additional cloth.","C mainly focuses on uprooting weeds and disposing them, using his hands, a pair of scissors, and a dustbin.","C is baking cookies, using the dough roller to fold and mix the dough and the cooker to bake it directly on the countertop.","C lubricates her hand, cuts, squeezes, and forms dough balls, and dips them in oil","Preparing and cooking vegetables, with stages: cutting and peeling onions, slicing and bagging tomatoes, chopping lettuce, and cooking onions in a pot"
21046,,"Considering the main activities in the video, briefly explain the overall process and purpose behind those actions.?",Preparing and cleaning ingredients for cooking,Preparing the dough with a roller and using tongs to flip it periodically,"The main objective was to create dough-wrapped sausages, with visible differences being the addition of red pepper and oil in some preparations.","C is making bread, using the dough roller to knead the dough and the cooker to ferment it before baking.","In the kitchen, mainly participating in activities related to cooking and food preparation"
52079,,How would you describe the primary goal or process that c and the woman are engaged in as they interact with the onions and potatoes within the video?,Preparing ingredients for a meal,Preparing food with attention to tidiness and efficiency,"C focused on the preparation of onions, potatoes, and bell peppers; onions were chopped, potatoes were peeled and sliced, and bell peppers were diced.","C initially preps onions and tomatoes by peeling, cleaning, and chopping.",C repetitively prepares dough by flattening and flipping it using a rolling pin.
14875,,"In the context of the main tasks performed by c and the woman in this video, describe the division of labor and the responsibilities of each individual.?","C applies mortar on the wall, while the woman mixes and provides mortar for c.","Cutting cloth, adjusting it, and using the sewing machine for stitching","Measuring, cutting, stitching with the sewing machine, and ironing the cloth","Stitching, folding, draping, and using adhesive to create a cohesive piece.","Measuring, cutting, ironing, and assembling the fabric with various threads and bindings."
66356,,"Identify the key moments in the video where c transitions from one type of activity to another, and explain the significance of these transitions in the context of the video's main goal.?","C switches between painting and applying sawdust, demonstrating the layering process for the desired finish.",C appears exploratory and purposeful,"C cut and measured planks, arranged them on the frame, and adjusted the position","C is making bread, using the dough roller to knead the dough and the cooker to ferment it before baking.","In the kitchen, mainly participating in activities related to cooking and food preparation"
110158,,Describe the pattern of actions taken by c in relation to the shopping items and how their actions changed over time.?,"C initially struggled with handling the vegetables, but ultimately helped the lady with shopping items, lifting and dropping them.","C's objective was preparing potatoes for further use, consistently peeling and turning them.",Persistent and detail-oriented,"C frequently dips the brush, drains excess paint, and paints the wall.","C is cooking pasta, rolling and cutting dough using the dough roller and then boiling the pasta on the cooker."
45896,,"Provide a brief summary of the video, focusing on the main goal of the man and how he adapts to the various changes in his environment.?","Man does laundry, interacts with c, and later converses outside with a dog","In the kitchen, mainly participating in activities related to cooking and food preparation","Primarily washing wine glasses, with differences in sponge usage and holding glasses with the left hand",C spends the video primarily focused on cleaning up the garden by picking up and disposing of grass pieces.,"C mainly focuses on uprooting weeds and disposing them, using his hands, a pair of scissors, and a dustbin."
126304,,"What is the central theme of the video, and how do the interactions between c and the man evolve in terms of their cooperation throughout the video?",Cooperation in arranging wooden blocks,"C prepared paint and filler using cans, brushes, and spatulas, then applied them on walls and objects","In the kitchen, mainly participating in activities related to cooking and food preparation","C is preparing dough, rolling and cutting it, and then cooking it, using the dough roller to flatten the dough and the cooker to heat the pan.","C connected wood pieces, drilled holes, measured, and assembled using a hole-puncher, hammer, measuring tape, and nails."
81383,,"What is the main recurring sequence of actions performed by c to prepare the spinach for bundling, and what tool does she use for cutting the spinach?","C cuts the spinach with the sickle, drops it, uses a rubber band to bundle it, and then adds it to a pile.",C binds spinach using rubber bands and cuts the stem with a sickle.,"C readies spinach by banding, trimming stems, and stacking for storage.","C cuts, binds, and drops spinach leaves using a sickle and rubber bands.","C alternates between adjusting and sewing the fabric, and uses scissors to cut threads and a needle to thread the needle bar."
43206,,"What is the overall goal of c's actions in the video, and how does the woman interact in relation to c's actions?",C's goal is to apply relaxer to the woman's hair while the woman uses her phone.,"C is making bread, using the dough roller to knead the dough and the cooker to ferment it before baking.","C shapes and manipulates dough with repetitive compression, kneading, and rolling, transitioning between the chopping board and aluminum plate.","Preparing and cooking vegetables, with stages: cutting and peeling onions, slicing and bagging tomatoes, chopping lettuce, and cooking onions in a pot",C's main purpose is maintaining cleanliness and organization in the kitchen
83243,,Can you identify any major turning points in the video that alter c's approach to working with the straw grass and rope? explain your reasoning.?,The man dropping the straw grass close to c introduces a slight change in c's approach and intensity.,"C flips and presses the dough, contrasting with earlier focus on cutting, holding, and wiping the table.","C cut and measured planks, arranged them on the frame, and adjusted the position",C appears exploratory and purposeful,"C prepares a bed by arranging the pillow, bedsheet, and mattress."
40066,,"What factors influenced c's choice for handling, folding, and placing different face towels throughout the video? discuss the significance of these decisions.?","C consistently handled, folded, and placed towels in a manner that promoted neatness, organization, and visual appeal.",C is engaged in a cutting and measuring process.,C appears exploratory and purposeful,"C's interactions with the bowl and glass involve cleaning and reorganizing, suggesting routine housekeeping tasks.",Competent and detail-oriented
42359,,"Given the interactions with various items like a bottle, cloth, and hose, identify the underlying importance of these non-tool objects and explain how they contribute to the accomplishment of the video's intent.?",Non-tool objects assist in cleaning and maintaining the workspace,"Sketching the design, cutting, adjusting, sewing, and straightening the fabric","The bottle, cloth, and hose are instrumental in preserving a tidy workspace and maintaining cleanliness for the caliper's maintenance",Competent and detail-oriented,C's main objective is to maintain and operate the mat weaving machine.
118627,,"Considering the entire video, identify the primary purpose behind the majority of the actions pertaining to the engine. what can be concluded about the main goal of both c and the man throughout the video?",The primary purpose of the actions is engine maintenance and fan blade adjustment by both c and the man.,C is mainly working on the scooter's engine,"C primarily uses a trowel to repeatedly apply and press concrete on bricks, aiming to create a solid structure.","C's primary objective is to clean #unsure, achieved by fetching water, soaking #unsure in water, and washing #unsure.",C's primary goal is to prepare celery by consistently cutting and chopping it.
91080,,"Based on the video, what was the primary focus of interaction between c and the woman, and how did this focus change throughout?",Discussing a board game and its setup,"Primary focus on conversation, secondary focus on observing the room","The primary focus was on ironing clothes, with interactions involving round neck tops and an electric iron.","Knitting, cutting, and tying thread","The main focus was on folding clothes while dealing with a pressing board, cloth, and round neck tops."
101145,,How can you describe the main intention and actions taken by the character 'c' in the video without providing a list of individual actions?,'c' primarily focused on leveling soil and occasionally adjusted sprinklers.,"C is baking cookies, using the dough roller to fold and mix the dough and the cooker to bake it directly on the countertop.","C mainly applies putty on the wall, taking breaks to engage with the environment.","C used a rag and screwdriver to clean the bottle, also inspecting and shaking the bottle","In the kitchen, mainly participating in activities related to cooking and food preparation"
109337,,"Considering the entire video, what would be rated as the top priority based on the time and effort put into different tasks? explain the significance of these tasks in the context of the video.?","Cleaning and maintaining the books were top priorities, as they received the most time and effort, indicating a focus on preservation.","Cut wood, drilled holes, fit deck balusters, and glued into place","Preparing and cooking vegetables, with stages: cutting and peeling onions, slicing and bagging tomatoes, chopping lettuce, and cooking onions in a pot",Nailed deck balusters to wood using a hammer and secured wood to the balusters,"C is cooking pasta, rolling and cutting dough using the dough roller and then boiling the pasta on the cooker."
56164,,"Describe the process c follows in creating and refining the pottery artwork, summarizing the key tools and techniques he uses throughout the video.?",C creates and refines the pottery artwork by carving using a clay carving tool and smoothing the clay with his hands.,C is engaged in a cutting and measuring process.,"The actions with the ingredients and utensils demonstrate c's process of combining, mixing, and cooking the ingredients in the saucepan.",Competent and detail-oriented,Persistent and detail-oriented
109430,,"What were the two different types of knives used in the video, and how were they utilized in preparing the tomatoes?","Black-handled knife for slicing and dicing, metal-handled knife for slicing.",Preparing vegetables by cutting and peeling,Preparing and cleaning ingredients for cooking,"Black-handled knife for slicing, metal-handled knife for dicing and sorting.","Picking, peeling, cutting, and arranging vegetables on a tray"
97917,,"Can you identify three pivotal actions in the video that were most crucial to c's progress in the workshop, and explain why you chose those specific actions?","Cleaning the steel rod, handling various tools, and arranging items in the workshop demonstrate c's ability to maintain and navigate a functional workspace.","C consistently picks, cuts, and drops sticks from the barb wire","Sketching the design, cutting, adjusting, sewing, and straightening the fabric","C mainly focuses on uprooting weeds and disposing them, using his hands, a pair of scissors, and a dustbin.",Competent and detail-oriented
81350,,"What was the primary repetitive process that c executed throughout the video, and why would this task be important in the context of the video?",Binding vegetables with small rubbers,C is engaged in a cutting and measuring process.,"C primarily uses a trowel to repeatedly apply and press concrete on bricks, aiming to create a solid structure.",C's primary activity is trimming and cutting plants.,"C repetitively scoops, applies, and scrapes off excess wall putty."
114476,,What can be inferred about the final purpose of c's actions in the video from observing and summarizing the various tasks they perform throughout the video?,Preparing a meal,"C cut and measured planks, arranged them on the frame, and adjusted the position","C mainly focuses on uprooting weeds and disposing them, using his hands, a pair of scissors, and a dustbin.",C repeatedly twists thread with the needle and operates the handloom to create fabric.,"C collects ingredients, prepares and cooks, multitasking with her phone."
114476,,"Based on the various activities executed by c, what is the overarching task being performed in the video, and how do different elements of this task come together to achieve the desired outcome?","Cooking breakfast by gathering ingredients, preparing the pan, and cooking the food","The actions with the ingredients and utensils demonstrate c's process of combining, mixing, and cooking the ingredients in the saucepan.","Preparing and cooking vegetables, with stages: cutting and peeling onions, slicing and bagging tomatoes, chopping lettuce, and cooking onions in a pot","C mainly focuses on uprooting weeds and disposing them, using his hands, a pair of scissors, and a dustbin.",C performed a painting task which transitioned into cleaning and organizing painting tools.
83749,,"By analyzing the video, can you point out the most significant moment, in terms of the narrative or action development, and explain what makes that particular moment stand out?","The most significant moment is when the man starts shuffling cards, progressing the gameplay.","Precise measuring, marking, and cutting","C engages in drilling, hole making, and uses thread cutting oil.","Install a bulb holder; uses an impact wrench, screws, and a set square.",C is engaged in a cutting and measuring process.
125781,,"From the series of actions, what can be concluded about the condition of the books before they were placed on the shelf, and the steps c took to address it?","The books were dusty, and c used a rag to clean them before shelving",Adjusting and straightening the cloth pieces,"Wiping with cloth, dusting cloth, and folding cloth","Picking, arranging, and wiping leaves for cleanliness and organization",The rag is used to clean books before placing them on the shelf
113448,,What are the primary interactions between c's hands as she works with the embroidery floss and fabric throughout the video?,"C's hands work together to hold and adjust the floss, insert it into the needle, hold the fabric, and cut the floss when needed.",Adjusting and straightening the cloth pieces,"Knitting, cutting, and tying thread",Assembling and adjusting components,"Aligning edges, adjusting the fabric, pinning, and sewing."
110153,,"Based on the video, identify and discuss the main theme or overall purpose of c's actions throughout the video.?",Grocery shopping with a focus on chobani,"The actions with the ingredients and utensils demonstrate c's process of combining, mixing, and cooking the ingredients in the saucepan.","Measuring, cutting, stitching with the sewing machine, and ironing the cloth",C repeatedly twists thread with the needle and operates the handloom to create fabric.,"In the kitchen, mainly participating in activities related to cooking and food preparation"
29461,,"Considering the various sections of the store that c visited, which sections were visited most often and how were these sections explored differently?","Visited shelves and store sections most often, exploring by looking around and bending.","Frequently returned to the vegetable section, examining by touching and smelling the items.","Processing ingredients, packaging and storing them, and preparing the cooking station.",C appears exploratory and purposeful,Preparing vegetables by cutting and peeling
45911,,What is the main objective of the actions performed by c in the video?,C is engaged in a cutting and measuring process.,"C engages in drilling, hole making, and uses thread cutting oil.","C is baking cookies, using the dough roller to fold and mix the dough and the cooker to bake it directly on the countertop.","C mainly focuses on uprooting weeds and disposing them, using his hands, a pair of scissors, and a dustbin.","The main objective was to create dough-wrapped sausages, with visible differences being the addition of red pepper and oil in some preparations."
70414,,"Based on the series of actions and behaviors exhibited by c in the video, what might be her role or main responsibility in the kitchen?",C's main role is managing cooking and organizational tasks.,"C is cooking pasta, rolling and cutting dough using the dough roller and then boiling the pasta on the cooker.","Measuring, cutting, stitching with the sewing machine, and ironing the cloth","Primarily washing wine glasses, with differences in sponge usage and holding glasses with the left hand","C is making bread, using the dough roller to knead the dough and the cooker to ferment it before baking."
116245,,"How does the way c utilizes various tools evolve throughout the video, and what might be the goal or outcome c is trying to achieve?","C moves from hands to pliers to ratchet socket wrench, aiming to secure an object with bolts and nuts.","The actions with the ingredients and utensils demonstrate c's process of combining, mixing, and cooking the ingredients in the saucepan.","C mainly focuses on uprooting weeds and disposing them, using his hands, a pair of scissors, and a dustbin.","C is making bread, using the dough roller to knead the dough and the cooker to ferment it before baking.",Character c is likely focusing on some mechanical work involving wheels and related equipment
87177,,"Reflecting on the entire process, identify the most central items c interacted with during the video and explain their importance in relation to c's actions.?","The sponge and soap are central, as they are essential for cleaning each item.","The character's involvement with paper, pen, and computer indicate he's focused on a task",Both c and the man were primarily focused on washing dishes and putting them away.,C is engaged in a cutting and measuring process.,"C cut and measured planks, arranged them on the frame, and adjusted the position"
31318,,Summarize the primary activities the man and c engage in and compare their actions throughout the video.?,"The man and c primarily eat food with forks, but the man also interacts with the servet.","In the kitchen, mainly participating in activities related to cooking and food preparation",Preparing ingredients for a meal,"The key elements involve observation of the picture, painting, and brush management (dipping in water, wiping, and touching watercolor).","Primary actions include applying mortar, handling and placing rods, and using water; applying mortar is crucial and frequent."
81284,,"Considering the high-level details of the video, identify the most significant and defining aspect of c's harvesting technique. explain why it stands out.?","C uses a meticulous, repetitive process to ensure a consistent and quality harvest.",C is engaged in a cutting and measuring process.,Persistent and detail-oriented,Preparing vegetables by cutting and peeling,Competent and detail-oriented
