video_id,video_url,question,correct_answer,wrong_answer_1,wrong_answer_2,wrong_answer_3,wrong_answer_4
19855,,"In this video, what is the primary activity of the man and how does it compare to c's primary activity?",The man primarily operates the phone while c mostly watches television.,"Primarily washing wine glasses, with differences in sponge usage and holding glasses with the left hand","The man primarily eats, highlighting a contrast with c's focus on remote controls.","Food preparation is performed by the man, while character c is engaged with electronic devices.","Primary actions are eating and drinking; supporting actions involve handling plates and glasses, and using the fridge."
52067,,"Considering the various actions performed by c, determine the three most essential steps in the process shown in the video. justify your choices.?","Picking up peppers, chopping, and placing in a bowl.","C mainly focuses on uprooting weeds and disposing them, using his hands, a pair of scissors, and a dustbin.","C repetitively scoops, applies, and scrapes off excess wall putty.","C consistently picks, cuts, and drops sticks from the barb wire","The actions with the ingredients and utensils demonstrate c's process of combining, mixing, and cooking the ingredients in the saucepan."
23932,,"Apart from ""c,"" another person is involved in the video. identify their role within the process and explain how their actions contributed to the overall task.?","The other person kneads the dough in a tray and pours oil, assisting in the dough preparation process.",Assembling and adjusting components,Primarily chopping and arranging carrots while maintaining cleanliness.,A man assists c in arranging the broom,A man helps c mix sand and cement
44750,,What would you consider to be the most crucial aspect(s) of c's painting process which contributes to the successful completion of the artwork?,Frequent brush dipping and reference checks on the laptop.,Increased focus and concentration,Continuous paint application with intermittent brush dipping and palette reloading.,C frequently dips the brush into the paint container and adjusts the craft's position to ensure proper paint application.,Transfer and mix liquids accurately
70399,,"In the process of adjusting and working with ingredients, what roles did interpersonal interactions and assistance play in the video, and what impact did they have on the progression of events?",Assistance played a minor role when another woman fetched an ingredient from the fridge.,Collaborative partners with a shared task,Weighing vegetables and conversing with the person,"Measuring, aligning materials, drilling, and cutting",Increased focus and concentration
33608,,Summarize the primary focus of the subject (c) in the video and explain the key steps he took to achieve his goal.?,Handling and arranging leaves in a cup,"The actions with the ingredients and utensils demonstrate c's process of combining, mixing, and cooking the ingredients in the saucepan.","C was primarily engaged in organizing and aligning products on the shelves, with occasional breaks to observe the woman.","C's primary focus is chopping vegetables, while the woman's laptop usage and kitchen presence offer variety in the scene, balancing its dynamics.","C primarily prepares and rolls the dough, while the woman focuses on cooking and adjusting the camera."
43201,,What was the primary purpose of using aluminum foil in the actions performed on the woman's hair by c?,To apply and secure hair cream.,C used aluminum foil for solely combing and parting the woman's hair.,C is engaged in a cutting and measuring process.,Aluminum foil's main purpose was hair straightening.,Aluminum foil was used mainly for the purpose of holding and manipulating the hair.
55100,,"Describe the key preparatory and finishing actions performed in the video, highlighting their importance and relevance to the process.?","Oiling dough, washing hands, and cleaning the table, which help establish a clean and orderly environment.",Preparing and shaping the dough for baking,Sifting soil through a sieve and leveling it with a leveling tool,Molding veggie dough and using oil for lubrication are crucial actions.,Preparing the dough with a roller and using tongs to flip it periodically
45957,,"Based on the events portrayed in the video, can you concisely explain the main goal of character c throughout the video?",C's main goal is to arrange bricks.,C's main purpose is to maintain the garden by trimming shrubs while the other character assists by disposing of the clippings.,"C cut and measured planks, arranged them on the frame, and adjusted the position","C efficiently transferred, adjusted, and documented substances using tools like pipettes and writing instruments.","The main objective was to create dough-wrapped sausages, with visible differences being the addition of red pepper and oil in some preparations."
14872,,What were the two primary tasks c performed repeatedly throughout the video involving the wall?,Smoothening the wall and pouring mortar paste into a pan,"C is cooking pasta, rolling and cutting dough using the dough roller and then boiling the pasta on the cooker.",C is engaged in a cutting and measuring process.,"C is baking cookies, using the dough roller to fold and mix the dough and the cooker to bake it directly on the countertop.","C primarily uses a trowel to repeatedly apply and press concrete on bricks, aiming to create a solid structure."
29528,,"Based on your understanding of the video, identify a recurring pattern in the actions of the man and c. explain how this pattern contributes to the overall narrative of the video.?","The main pattern consists of picking up, dropping, and rearranging cards –likely part of a game or collaboration.","C carefully and methodically manipulates the fabric and thread by sewing, adjusting, and utilizing various tools like scissors and a needle.","C's hands work together to hold and adjust the floss, insert it into the needle, hold the fabric, and cut the floss when needed.","Male and c repeatedly converse and interact with cards, which implies the main purpose is related to card activities.","C cut and measured planks, arranged them on the frame, and adjusted the position"
56152,,How does c utilize both his right and left hands throughout the video? discuss how these actions demonstrate flexibility and adaptability in his technique.?,"C showcased ambidextrous skill by frequently transitioning between right and left hands for tasks like carving, brushing, and holding tools.","Picking, peeling, cutting, and arranging vegetables on a tray","Knitting, cutting, and tying thread",C repeatedly twists thread with the needle and operates the handloom to create fabric.,"C's hands work together to hold and adjust the floss, insert it into the needle, hold the fabric, and cut the floss when needed."
45953,,"Based on the video, what could be c's primary objective, and what sequence of actions did c perform to achieve that objective? elaborate on the importance of these actions.?","C's primary objective is to clean #unsure, achieved by fetching water, soaking #unsure in water, and washing #unsure.","C mainly focuses on uprooting weeds and disposing them, using his hands, a pair of scissors, and a dustbin.","The actions with the ingredients and utensils demonstrate c's process of combining, mixing, and cooking the ingredients in the saucepan.","Primarily washing wine glasses, with differences in sponge usage and holding glasses with the left hand",Prioritizing sanitation and cleanliness
9728,,Summarize the main goal of the actions performed by c throughout the video. pay particular attention to the tools used and the outcomes achieved.?,"C prepared a network cable using a wire cutter, crimping tool, and network cable tester.","C was in the kitchen to clean and organize items, with less emphasis on preparing hot beverages.","C is baking cookies, using the dough roller to fold and mix the dough and the cooker to bake it directly on the countertop.","Sketching the design, cutting, adjusting, sewing, and straightening the fabric","The main objective was to create dough-wrapped sausages, with visible differences being the addition of red pepper and oil in some preparations."
70403,,Explain the significance of c's hair-adjusting actions throughout the video and how it might be related to the overall cooking process.?,The hair adjustments highlight potential hygiene concerns during the cooking process.,Preparing and shaping the dough for baking,To apply and secure hair cream.,"The actions with the ingredients and utensils demonstrate c's process of combining, mixing, and cooking the ingredients in the saucepan.",C cut and roasted potato fries and sweet potato cubes.
44744,,"Based on the information provided, identify the crucial elements of the painter's artistic process and describe their importance in achieving the desired outcome.?","Crucial elements include referencing, palette mixing, and iterative painting.","Measuring, cutting, ironing, and assembling the fabric with various threads and bindings.",The objective is to create a mask with elastic threads; key stages are sewing the mask and attaching the elastic threads.,"The actions with the ingredients and utensils demonstrate c's process of combining, mixing, and cooking the ingredients in the saucepan.","Stitching, folding, draping, and using adhesive to create a cohesive piece."
16798,,Describe in a few sentences how the communication and behavior of the characters gradually evolved towards the resolution of a certain task or situation throughout the video.?,Their communication intensifies as c listens more and finishes their task of writing on the paper pad,C's main objective is organizing ingredients from cabinets and fridge,The objective is to create a mask with elastic threads; key stages are sewing the mask and attaching the elastic threads.,"C cut and measured planks, arranged them on the frame, and adjusted the position","Folding the cloth, measuring, cutting, using the sewing machine, and trimming the edges"
5426,,Identify key moments in the video where c's behavior may suggest a change in tasks or focus. explain why you think these moments are important.?,Shifts between typing and scrolling,"Shifts between typing, scrolling, and looking",Increased focus and concentration,"C lubricates her hand, cuts, squeezes, and forms dough balls, and dips them in oil",C's key actions include attaching pins to cloth and hammering them into the craft bag.
12728,,"In the context of preparing or maintaining a car, which specific actions, techniques, or tools used by c have the most impact on the overall outcome?","Applying grease, tightening wheel studs and bolts, and ensuring proper alignment of the wheel and related components.","C engages in drilling, hole making, and uses thread cutting oil.",Competent and detail-oriented,Nailed deck balusters to wood using a hammer and secured wood to the balusters,C is focused on adjusting and removing bolts
122998,,"Analyzing the video as a whole, what can be deduced about c's ultimate goal in the store? describe the significance of their interactions with different items.?",Making careful choices for a personal selection,"C is primarily focused on laundering cloths, repeating actions for thorough cleaning.","The crucial objects are the peeler, knife, and pan, which aid in preparing and cooking the carrots.","Folding the cloth, measuring, cutting, using the sewing machine, and trimming the edges","Sketching the design, cutting, adjusting, sewing, and straightening the fabric"
97907,,Identify two significant patterns in c's actions during the video and discuss their importance in the context of c's overall goal.?,"C consistently lifts rods and grinders with separate hands, and repositions rods; these patterns streamline the process and maintain focus on shaping the rod.","C engages in drilling, hole making, and uses thread cutting oil.",Persistent and detail-oriented,Repeatedly manipulating liquids with pipettes and controlling their temperature using ice cubes,"C used a rag and screwdriver to clean the bottle, also inspecting and shaking the bottle"
92195,,Describe the role of the mobile phone throughout the video and how it affected the man and woman's interaction during the game they were playing.?,"The mobile phone served as a supplementary tool, occasionally used by the man, but didn't significantly disrupt the interaction.",Communication occasionally occurs but does not significantly impact the main activity.,"C collects ingredients, prepares and cooks, multitasking with her phone.","C and the man participate in a card game, exchanging and organizing cards.","Measuring, aligning materials, drilling, and cutting"
66118,,Identify and analyze the key turning points in the video that led to the successful completion of the task.?,Applying glue and securing the wheel with hex key screwdriver,"Measuring, aligning materials, drilling, and cutting",Increased focus and concentration,Assembling and adjusting components,Competent and detail-oriented
68583,,"Despite some distractions in the video, what is the main household interaction and how does it impact the protagonist's actions throughout the video?","Interaction with dog, momentarily interrupting cooking","Picking, peeling, cutting, and arranging vegetables on a tray","In the kitchen, mainly participating in activities related to cooking and food preparation",Increased focus and concentration,Preparing and shaping the dough for baking
43552,,How can you describe the main actions and their purpose during the time c and the man are inside the car?,Engaging in casual conversation and sharing refreshments,"C shapes and manipulates dough with repetitive compression, kneading, and rolling, transitioning between the chopping board and aluminum plate.","C is cooking pasta, rolling and cutting dough using the dough roller and then boiling the pasta on the cooker.","Sketching the design, cutting, adjusting, sewing, and straightening the fabric","C worked with onions, peppers, and carrots; onions were peeled and diced, peppers were chopped, and carrots were grated."
17022,,"Identify two key moments in the video that demonstrate c's skill in sewing, and explain why these moments are considered crucial to the overall activity.?",Successfully threading the needle and skillfully knotting the thread are crucial moments as they enable efficient sewing.,Increased focus and concentration,Assembling and adjusting components,C is engaged in a cutting and measuring process.,Adjusting and straightening the cloth pieces
84938,,"In this video, there are repeated actions involving the leaves. identify the key, repeated actions and explain their significance in the context of the video.?","Picking, arranging, and wiping leaves for cleanliness and organization",C is engaged in a cutting and measuring process.,"In the kitchen, mainly participating in activities related to cooking and food preparation",Primarily chopping and arranging carrots while maintaining cleanliness.,Handling and arranging leaves in a cup
85309,,"Summarize the key techniques and tools that c employs to accomplish the sewing task, reflecting on their importance in the overall process.?","C uses needle and thread for stitching, scissors for cutting, and hook and eye for fastening, all vital for a secure and neat outcome.",C is engaged in a cutting and measuring process.,"Cutting cloth, adjusting it, and using the sewing machine for stitching","C uses cutting, adjusting, and flipping techniques to prepare and assemble materials accurately.","Folding the cloth, measuring, cutting, using the sewing machine, and trimming the edges"
84968,,Can you provide a concise summary of the primary purpose of the actions performed by 'c' throughout the video?,"C prepares a bed by arranging the pillow, bedsheet, and mattress.",C's primary goal is to prepare celery by consistently cutting and chopping it.,"C used a rag and screwdriver to clean the bottle, also inspecting and shaking the bottle","C is baking cookies, using the dough roller to fold and mix the dough and the cooker to bake it directly on the countertop.","In the kitchen, mainly participating in activities related to cooking and food preparation"
126880,,"What activities would you consider to be the key themes of this video, and how do they relate to one another?","Organizing a table, browsing a book, and moving items around","The character's involvement with paper, pen, and computer indicate he's focused on a task","In the kitchen, mainly participating in activities related to cooking and food preparation","Sketching the design, cutting, adjusting, sewing, and straightening the fabric",The primary activity for both c and the man is having a meal together at a table full of dishes.
18680,,Analyze the role and significance of the dog entering the scene and how it affects c's actions.?,"The dog's entry doesn't change c's main goal, but c briefly stops to pet and interact with the dog while tucking the bed sheets.","The character's involvement with paper, pen, and computer indicate he's focused on a task",Primarily chopping and arranging carrots while maintaining cleanliness.,"Primary actions are eating and drinking; supporting actions involve handling plates and glasses, and using the fridge.","They seem to cooperate in different tasks, possibly working together to clean and organize the space."
123088,,"Considering the recurring activities in the video, what could be a primary purpose of c's actions in the room?",Organizing the room,"In the kitchen, mainly participating in activities related to cooking and food preparation","Sketching the design, cutting, adjusting, sewing, and straightening the fabric","Measuring, cutting, stitching with the sewing machine, and ironing the cloth",C repeatedly twists thread with the needle and operates the handloom to create fabric.
66451,,Identify and elaborate on the key events in the video that contributed to c successfully addressing the car issues.?,"Key events included c's assessment and manipulation of brake components, culminating in the successful removal and replacement of parts.","Sketching the design, cutting, adjusting, sewing, and straightening the fabric","The key events centered on c's work on the car's engine and transmission, leading to improved vehicle performance.",C is focused on adjusting and removing bolts,"C engages in drilling, hole making, and uses thread cutting oil."
13489,,Identify the most critical interaction between characters and explain its relevance to the video's main action. what purpose does this interaction serve in the broader context?,Discussion of the painting work,Increased focus and concentration,Competent and detail-oriented,"C assists the other woman by applying hair cream, working together to ensure the woman's hair is properly moisturized.","The other person kneads the dough in a tray and pours oil, assisting in the dough preparation process."
122210,,"Can you summarize the main interactions throughout the video between c and their environment, and identify any apparent patterns in their actions?","C repetitively scoops, applies, and scrapes off excess wall putty.","Preparing and cooking vegetables, with stages: cutting and peeling onions, slicing and bagging tomatoes, chopping lettuce, and cooking onions in a pot","C and the man perform tasks like slicing, touching, holding, and disposing potato skins and dough, suggesting different goals.","C is making bread, using the dough roller to knead the dough and the cooker to ferment it before baking.","In the kitchen, mainly participating in activities related to cooking and food preparation"
124082,,"In your opinion, what were the three most crucial moments or actions during the video, and why do you think they significantly impacted the outcome of the woodwork project?","Gluing the wooden components, cutting off excess glue, and sanding the wood were crucial for the project's aesthetic and structural success.",Competent and detail-oriented,"The key elements involve observation of the picture, painting, and brush management (dipping in water, wiping, and touching watercolor).","C efficiently transferred, adjusted, and documented substances using tools like pipettes and writing instruments.","The character's involvement with paper, pen, and computer indicate he's focused on a task"
103941,,Identify the primary action that occurs repeatedly throughout the video and explain its significance in the overall narrative.?,"C checks their phone repeatedly, showcasing their connection and reliance on the device.","C primarily prepares and rolls the dough, while the woman focuses on cooking and adjusting the camera.","Measuring, cutting, stitching with the sewing machine, and ironing the cloth",Opening and closing kitchen cabinets repeatedly,Preparing and shaping the dough for baking
89154,,"Based on the techniques and tools used by c, what would you identify as the two most crucial stages of the process, and why do these steps hold more significance than the others?",The two most crucial stages are assembling with the electric screwdriver and smoothening with sandpaper; these steps ensure stable construction and a polished finish.,C is focused on adjusting and removing bolts,Power drill for creating holes and screwdriver for tightening screws,"Applying glue and teflon tape, tightening pipes together",Shaping the sculpture and removing excess clay with sculpting tools
102692,,"Based on their actions, what could you deduce about the relationship between the two individuals in the video, and what might be their purpose in participating in this scene?","They seem to cooperate in different tasks, possibly working together to clean and organize the space.","Measuring, aligning materials, drilling, and cutting","The main pattern consists of picking up, dropping, and rearranging cards –likely part of a game or collaboration.","Measuring, cutting, stitching with the sewing machine, and ironing the cloth","In the kitchen, mainly participating in activities related to cooking and food preparation"
114476,,"Considering the various actions performed by c in the video, what do you think is the overarching theme or objective of the video, and how are these individual actions related to that objective?",Preparing a meal,"In the kitchen, mainly participating in activities related to cooking and food preparation","C focuses mainly on painting while occasionally looking around, shaking the paint, and dropping samples in intervals.","Primarily washing wine glasses, with differences in sponge usage and holding glasses with the left hand",C's main purpose is to maintain the garden by trimming shrubs while the other character assists by disposing of the clippings.
13495,,"Given the actions c performs throughout the video, what conclusion can you draw about the overall goal of their actions and the importance of the objects they interact with?",Maintenance and upkeep of objects,Both c and the man were primarily focused on washing dishes and putting them away.,"The bottle, cloth, and hose are instrumental in preserving a tidy workspace and maintaining cleanliness for the caliper's maintenance","In the kitchen, mainly participating in activities related to cooking and food preparation","C focuses mainly on painting while occasionally looking around, shaking the paint, and dropping samples in intervals."
101222,,Identify the most crucial moments in the video that demonstrate c's ability to maintain continuity and efficiency while crocheting the cloth.?,Crucial moments consist of c adjusting her grip on the cloth and switching the crochet hook between hands,"C consumes food and drinks, mainly using a fork for food and hands for cups; eating food and drinking tea are most frequent.",Successfully threading the needle and skillfully knotting the thread are crucial moments as they enable efficient sewing.,"C prepares a bed by arranging the pillow, bedsheet, and mattress.","Turning the pages and wiping the book cover are key actions, as they represent c's consistent focus on browsing and maintaining the books."
29726,,"Based on the video, discuss how cleaning tasks seem to be prioritized by the main character in a concise manner, without listing every action.?",Prioritizing cooker and socket areas,Cutting the apple and cleaning the counter facilitated progression in the cooking process.,"C's interactions with the bowl and glass involve cleaning and reorganizing, suggesting routine housekeeping tasks.",Prioritizing sanitation and cleanliness,"Primarily washing wine glasses, with differences in sponge usage and holding glasses with the left hand"
31956,,"What can you infer about c's expertise in woodworking based on the actions in the video after considering the overall level of detail, the pace of work, and the methodology?",Proficient and efficient worker,"C secured the chainsaw, adjusted the grip, and skillfully used the tools for task completion.",C prepared and transferred liquid substances using a pipette and micropipette methodically.,"Folding the cloth, measuring, cutting, using the sewing machine, and trimming the edges","C carefully and methodically manipulates the fabric and thread by sewing, adjusting, and utilizing various tools like scissors and a needle."
61165,,Analyze and describe the progression of c's interactions with the sticks and the barbed wire. what pattern can you identify regarding how he deals with the sticks?,"C consistently picks, cuts, and drops sticks from the barb wire",C appears exploratory and purposeful,C is focused on adjusting and removing bolts,C is engaged in a cutting and measuring process.,C's primary activity is trimming and cutting plants.
