video_id,video_url,question,correct_answer,wrong_answer_1,wrong_answer_2,wrong_answer_3,wrong_answer_4
38615,,"What is the primary activity that occurs multiple times in the video, and how does it relate to the overall context?","Playing tennis with a man is the primary activity, contributing to the video's focus on a tennis court setting.","Primary actions are eating and drinking; supporting actions involve handling plates and glasses, and using the fridge.","The primary activity that occurs multiple times is c and a man dribbling the tennis ball, which could be associated with them practicing or warming up.",C repeatedly twists thread with the needle and operates the handloom to create fabric.,"C primarily uses a trowel to repeatedly apply and press concrete on bricks, aiming to create a solid structure."
969,,"Which key sequence of actions can be inferred as the most critical in the video, based on the way various items are organized or processed before being put away?","The most critical sequence involved organizing papers, placing them in appropriate containers, and storing them in the cupboard.","C is preparing dough, rolling and cutting it, and then cooking it, using the dough roller to flatten the dough and the cooker to heat the pan.","C mainly focuses on uprooting weeds and disposing them, using his hands, a pair of scissors, and a dustbin.","C repeatedly dipped the brush into the paint bucket and painted the door, eventually switched hands, and used his left hand to hold the knob while painting.","Primary actions are eating and drinking; supporting actions involve handling plates and glasses, and using the fridge."
31261,,Identify at least two key turning points in the video and explain why they are significant in the context of the video's events.?,"The man moving the ball sleeve and walking on the field, which shows his passive involvement in the activity.","The character's involvement with paper, pen, and computer indicate he's focused on a task","C briefly handles a screwdriver and a measuring tape, implying her focus switches to more technical tasks.",Increased focus and concentration,Competent and detail-oriented
16696,,"In a concise manner, describe the main objective c achieved in this video by carrying out the various actions.?",C prepared and transferred liquid substances using a pipette and micropipette methodically.,"The main objective was to create dough-wrapped sausages, with visible differences being the addition of red pepper and oil in some preparations.","C mainly focuses on uprooting weeds and disposing them, using his hands, a pair of scissors, and a dustbin.","C is making bread, using the dough roller to knead the dough and the cooker to ferment it before baking.","C primarily uses a trowel to repeatedly apply and press concrete on bricks, aiming to create a solid structure."
85049,,Analyze the video and determine the key moments where c seems to make decisions or change their approach. discuss the most important parts considering their relevance to the final outcome.?,"Key moments include transitioning from rulers to tape measure, and when c interacts with another person.","C consistently picks, cuts, and drops sticks from the barb wire",Competent and detail-oriented,"C lubricates her hand, cuts, squeezes, and forms dough balls, and dips them in oil",Persistent and detail-oriented
31267,,Identify three defining moments in the video that reflect the person's skill level and understanding of golf techniques. explain why these moments are significant.?,"First successful hit, adapting grip, assisting man in swing","Gathering tools, measuring, and marking the box were key accomplishments.",They exhibit collaborative gameplay focused on turn-taking and adhering to game rules.,"The significant steps include placing the rod, working with mortar, and final touchups; the most frequent and vital is the rod placement to shape the wall.","C removes and reattaches wheels, tightens bolts with a spanner, and adjusts parts, ensuring proper scooter assembly and functionality."
21440,,"Based on the players' actions with the pool cue and their movements around the table, what can you infer about the dynamic between c and the woman and their respective gameplay strategies?",A casual and friendly game with emphasis on enjoyment.,Increased focus and concentration,Collaborative partners with a shared task,C appears exploratory and purposeful,Exchanging and placing cards strategically to advance in the game
9313,,What was the main purpose behind c moving his/her right hand frequently and interacting with various objects throughout the video?,"The primary purpose was to facilitate the drawing process by using the fineliner pen, adjusting filters, and examining the sketch.","C secures fabric in the basket using pins and hammer, driven by the goal of attaching it to the basket.","C's objective was preparing potatoes for further use, consistently peeling and turning them.","C is cooking pasta, rolling and cutting dough using the dough roller and then boiling the pasta on the cooker.","C is preparing dough, rolling and cutting it, and then cooking it, using the dough roller to flatten the dough and the cooker to heat the pan."
9231,,"By observing the main actions in the video, what can you conclude is the primary goal that c is trying to achieve?",Gardening by planting multiple plants in a bucket,"C is making bread, using the dough roller to knead the dough and the cooker to ferment it before baking.","C repetitively scoops, applies, and scrapes off excess wall putty.",C's primary goal is to prepare celery by consistently cutting and chopping it.,C's main goal is to arrange bricks.
51778,,"In the context of the video, which actions carried the most significance for c's experience? provide a concise analysis to support your conclusion.?","Eating noodles and watching the movie were most significant, as they formed the basis for c's cyclical behavior pattern.",They exhibit collaborative gameplay focused on turn-taking and adhering to game rules.,C prepared and transferred liquid substances using a pipette and micropipette methodically.,"The bottle, cloth, and hose are instrumental in preserving a tidy workspace and maintaining cleanliness for the caliper's maintenance","C and the man exchange cards and align them, showcasing their engagement in a card game."
927,,Identify the key moments in the video where c demonstrates effective paint application techniques and substantial completion of painting tasks in the given environment.?,"Painting the gate, swing chair, and clean-up",C frequently dips the brush into the paint container and adjusts the craft's position to ensure proper paint application.,"C efficiently handles paint tubes, brush, palette, scissors, and paper while managing her workspace.","C repeatedly dipped the brush into the paint bucket and painted the door, eventually switched hands, and used his left hand to hold the knob while painting.","C prepared paint and filler using cans, brushes, and spatulas, then applied them on walls and objects"
114436,,"Summarize the interaction between c and the man, while also explaining its relevance to the main tasks c is performing in the video.?",Brief conversations with the man occur but do not affect c's main tasks of working with the hoe.,"The character's involvement with paper, pen, and computer indicate he's focused on a task","C mainly focuses on uprooting weeds and disposing them, using his hands, a pair of scissors, and a dustbin.","In the kitchen, mainly participating in activities related to cooking and food preparation",Competent and detail-oriented
56047,,"What crucial actions do c perform throughout the video, and how do these actions relate to the overall objective of the video?",C grinds and smoothens metal while taking breaks to discuss and drink coffee.,"C mainly focuses on uprooting weeds and disposing them, using his hands, a pair of scissors, and a dustbin.","C's crucial project moments involved holding the tube and pulling up sleeves, ensuring a firm grip and easy mobility.","C's primary activity is maintaining and adjusting a wheel, using various tools like a drill machine, bolts, and tire adjustments.","C primarily prepares and rolls the dough, while the woman focuses on cooking and adjusting the camera."
63030,,"In the context of lab safety and cleanliness, what was the predominant theme of c's actions throughout the video?",Prioritizing sanitation and cleanliness,"C persistently uses the needle to knit, sew buttons, and thread through eyelets fabric in the making.",C's primary activity is trimming and cutting plants.,"C primarily prepares and rolls the dough, while the woman focuses on cooking and adjusting the camera.",C is mainly working on the scooter's engine
9319,,"Summarize the two main stages of the overall artistic process in this video, and explain how each stage contributes to the final result.?","The two main stages were sketching with the fineliner pen and adding decorative glitters; sketching laid the foundation, while the glitters enhanced the final piece.",Main phases include folding brown materials and gluing paper objects.,Scissors for cutting and the sewing machine for stitching to create the final cloth piece,Cleaning and scraping the wood ensure a smooth surface and proper fit when attaching pieces to furniture.,Preparing vegetables by cutting and peeling
296,,"What is the main objective of the repetitive actions performed with the nail and the napkin, and how does it contribute to the overall goal of the video?",The repetitive actions ensure precision and cleanliness while achieving the desired ink pattern on the board.,The objective is to create a mask with elastic threads; key stages are sewing the mask and attaching the elastic threads.,Competent and detail-oriented,"C primarily uses a trowel to repeatedly apply and press concrete on bricks, aiming to create a solid structure.","C repetitively scoops, applies, and scrapes off excess wall putty."
111257,,"Describe the main steps of c's process for maintaining the lawn mower, focusing especially on the application and organization of the grease gun.?","C greases multiple parts, cleans the lawn mower, replaces the grease cartridge, and reassembles the lawn mower.","C fastened nuts, greased parts, and checked the oil tank.",Protecting and maintaining the metal using oil application.,"Applying grease, tightening wheel studs and bolts, and ensuring proper alignment of the wheel and related components.","C removes and reattaches wheels, tightens bolts with a spanner, and adjusts parts, ensuring proper scooter assembly and functionality."
56047,,Explain the role of the conversation between c and the person and its impact on the video's progression.?,"The conversation serves as intermittent breaks from work, adding a social aspect to the video.",C's main objective is to maintain and operate the mat weaving machine.,"C assists the other woman by applying hair cream, working together to ensure the woman's hair is properly moisturized.","The character's involvement with paper, pen, and computer indicate he's focused on a task",Primarily chopping and arranging carrots while maintaining cleanliness.
107915,,"What is the main objective or task c appears to be engaged in during the video, and how did this change over time?",C's main objective shifted from playing games to exploring the house and eventually putting on a jacket and hat.,"Measuring, cutting, stitching with the sewing machine, and ironing the cloth","In the kitchen, mainly participating in activities related to cooking and food preparation","C is making bread, using the dough roller to knead the dough and the cooker to ferment it before baking.","Sketching the design, cutting, adjusting, sewing, and straightening the fabric"
109930,,Which tasks performed by c throughout the video were the most crucial and why?,"Securing tools, wearing knee pads, and placing plywood laid the foundation for the upcoming project.",Competent and detail-oriented,"C persistently uses the needle to knit, sew buttons, and thread through eyelets fabric in the making.",C is focused on adjusting and removing bolts,C's key actions include attaching pins to cloth and hammering them into the craft bag.
82725,,"In terms of process, how did c progress from handling individual wooden planks to having them arranged on a rectangular frame? focus on the key steps taken rather than listing every action.?","C cut and measured planks, arranged them on the frame, and adjusted the position","The actions with the ingredients and utensils demonstrate c's process of combining, mixing, and cooking the ingredients in the saucepan.","Sketching the design, cutting, adjusting, sewing, and straightening the fabric","C engages in drilling, hole making, and uses thread cutting oil.","Precise measuring, marking, and cutting"
60898,,"In the context of the video, can you summarize the process and main purpose of c working with various tools and wires? analyze the strategy and methods used by c throughout the video.?","Repairing cables, trial and error with tools","In the kitchen, mainly participating in activities related to cooking and food preparation","C is making pizza, using the dough roller to stretch and shape the dough and then directly placing it in the cooker for baking.","C is baking cookies, using the dough roller to fold and mix the dough and the cooker to bake it directly on the countertop.","C focuses on trimming, cutting, and arranging materials on the table, adjusting the sewing machine, and occasional flipping of materials for better view."
12374,,"Can you describe in detail the main sequence of actions performed by c throughout the video, and highlight the overarching goal of these actions?","C primarily uses a trowel to repeatedly apply and press concrete on bricks, aiming to create a solid structure.","The key elements involve observation of the picture, painting, and brush management (dipping in water, wiping, and touching watercolor).","C is making bread, using the dough roller to knead the dough and the cooker to ferment it before baking.",C is primarily focused on cleaning the garage by sweeping the floor using a dustpan and brush and organizing the tools.,"C is baking cookies, using the dough roller to fold and mix the dough and the cooker to bake it directly on the countertop."
63994,,"Based on the video, what could you infer about the purpose of the glue container in the assembly process, and how it contributes to the success of constructing the wooden mechanical model?","The glue container is crucial for securely attaching the wooden pieces, contributing to the model's successful assembly.","Applying glue and teflon tape, tightening pipes together","Stitching, folding, draping, and using adhesive to create a cohesive piece.",Application of glue and paste on a wooden door using a scraper and a metal bar.,Applying glue and securing the wheel with hex key screwdriver
1247,,"Can you outline the overall sequence of steps c takes while working with the clay mould, highlighting any key techniques or strategies?","C packs clay into a mould, manipulates both clay and sand, and repeats the process to shape the final product.",Increased focus and concentration,C is engaged in a cutting and measuring process.,C appears exploratory and purposeful,"C repeatedly stirred the mixture with a fork spoon, blended it multiple times, and tasted it to ensure readiness."
91852,,"Identify which types of tools and their purpose were used throughout the video, and how they assisted in accomplishing the overarching goal.?",Scissors for cutting and the sewing machine for stitching to create the final cloth piece,"The paper is marked, cut, folded, and pinned.","Sketching the design, cutting, adjusting, sewing, and straightening the fabric","Folding the cloth, measuring, cutting, using the sewing machine, and trimming the edges","Measuring, aligning materials, drilling, and cutting"
1116,,Can you identify a pattern in c's actions with the concrete block and the axe that highlights the most important parts of his process?,Repeatedly hitting and adjusting the concrete block,"C shapes and manipulates dough with repetitive compression, kneading, and rolling, transitioning between the chopping board and aluminum plate.",C peels and precisely cuts the celery.,Persistent and detail-oriented,Onions and potatoes are both cut and sliced; onions are put into a sieve and potatoes are cooked in a pan.
88101,,"Based on c's actions and behavior, provide a concise overview of her primary objective and any secondary goals she has throughout the video.?",C's primary objective is processing cassavas; a secondary goal is maintaining cleanliness by wiping fingers.,"C is making bread, using the dough roller to knead the dough and the cooker to ferment it before baking.","C collects ingredients, prepares and cooks, multitasking with her phone.",C is primarily focused on cleaning the garage by sweeping the floor using a dustpan and brush and organizing the tools.,"C primarily removed twigs from the barb wire, progressively using both hands and adjusting the wire."
106970,,"What is the overall objective of the actions performed by 'c' in the video, and how did their actions progress toward that objective?",Preparing and flavoring a celery dish,C was primarily responsible for making and serving tea,The objective is to create a mask with elastic threads; key stages are sewing the mask and attaching the elastic threads.,C repeatedly twists thread with the needle and operates the handloom to create fabric.,"C primarily uses a trowel to repeatedly apply and press concrete on bricks, aiming to create a solid structure."
50490,,Analyze c's actions in the video and provide a concise explanation of their decision-making process as they assess different items.?,"C assesses items non-sequentially, relies on visual examination, and shows indecisiveness.",Persistent and detail-oriented,"The actions with the ingredients and utensils demonstrate c's process of combining, mixing, and cooking the ingredients in the saucepan.","C secures fabric in the basket using pins and hammer, driven by the goal of attaching it to the basket.",C is engaged in a cutting and measuring process.
85869,,"Describe the overall progression of interactions between character c, the woman, and the man, and how their focus changes throughout the video.?","Character c begins with interacting with the woman, moves on to the man, and finally engages with the woman again while their focus shifts from physical contact to various tasks.","C connected wood pieces, drilled holes, measured, and assembled using a hole-puncher, hammer, measuring tape, and nails.","C focuses on trimming, cutting, and arranging materials on the table, adjusting the sewing machine, and occasional flipping of materials for better view.","Sanding, dusting, cutting sandpaper, and gluing to smoothen and attach the wood to the woodwork","C cut and measured planks, arranged them on the frame, and adjusted the position"
9231,,Identify and briefly explain two different techniques used by c to handle and manipulate the soil throughout the video.?,Knocking soil with a trowel and spreading soil with hands,Garden trowel for digging and planting; plier for adjusting objects,Soil preparation and thorn removal,C uses the spoon to adjust and transfer mixtures.,"Pushing and pulling soil with a rake, and rotating the soil with a screwdriver"
71443,,Compare the different stages in the video and identify the main sequence of actions performed with onions and tomatoes.?,"Onions are prepped by cutting, peeling, and chopping, while tomatoes are washed and chopped.","C shapes and manipulates dough with repetitive compression, kneading, and rolling, transitioning between the chopping board and aluminum plate.",Preparing and cooking a vegetable dish,C is engaged in a cutting and measuring process.,Preparing and cleaning ingredients for cooking
15592,,"Considering the video's key elements, what might be the broader goal of c's actions, and how do these actions contribute to that goal?","Preparing dough for baking by mixing, kneading, and organizing the ingredients.",Aluminum foil was used mainly for the purpose of holding and manipulating the hair.,"C repetitively scoops, applies, and scrapes off excess wall putty.","Sketching the design, cutting, adjusting, sewing, and straightening the fabric","C's main objective was to clean and remove paint from the shoes, which they progressively achieved by washing, knocking, and using a screwdriver."
12374,,"Discuss any potential reasons why c might have repeated certain actions multiple times in the video, and how this might contribute to the overall objective of the activity.?","C repeats actions for consistency, ensuring even concrete application between bricks, which is crucial in creating a stable structure.",Repeatedly manipulating liquids with pipettes and controlling their temperature using ice cubes,"The primary activity that occurs multiple times is c and a man dribbling the tennis ball, which could be associated with them practicing or warming up.",Cutting the apple and cleaning the counter facilitated progression in the cooking process.,"Sketching the design, cutting, adjusting, sewing, and straightening the fabric"
47611,,"After observing the video, what can you infer about c's priorities based on the actions performed and any interactions with others?","C's main priority was working with mortar, while also maintaining social interactions and attending to personal habits.","C cut and measured planks, arranged them on the frame, and adjusted the position","C is making bread, using the dough roller to knead the dough and the cooker to ferment it before baking.","Preparing and cooking vegetables, with stages: cutting and peeling onions, slicing and bagging tomatoes, chopping lettuce, and cooking onions in a pot","C faced issues with the stator and bolts, which he addressed using wrenches and screwdrivers."
15592,,"From the various actions c performed during the video, identify the three most vital steps that indicate c is engaged in baking-related activities.?","Scooping flour, pouring sugar into the mixer, and operating the dough machine.","The actions with the ingredients and utensils demonstrate c's process of combining, mixing, and cooking the ingredients in the saucepan.",C is engaged in a cutting and measuring process.,Primarily chopping and arranging carrots while maintaining cleanliness.,"C shapes and manipulates dough with repetitive compression, kneading, and rolling, transitioning between the chopping board and aluminum plate."
30464,,"Based on the pattern of actions, what could be concluded about c's primary goal in the video?",To arrange cards on the carpet in a particular manner.,C's primary goal is to prepare celery by consistently cutting and chopping it.,"C's primary focus is chopping vegetables, while the woman's laptop usage and kitchen presence offer variety in the scene, balancing its dynamics.","C's main objective was to clean and remove paint from the shoes, which they progressively achieved by washing, knocking, and using a screwdriver.","C's primary goal is making a smoothie, with the critical actions being blending and shaking the mixture."
104350,,"Describe the overall process and transformation of the paper during the video, prioritizing what you find to be the most important parts.?","The paper is marked, cut, folded, and pinned.","Measure, cut, and modify concrete elements","Loosening, removing, and adjusting bolts","The main character primarily uses a ruler to measure, mark, and manipulate the paper, with a gradual increase in precision.",Competent and detail-oriented
76818,,"Based on c's actions, what can you infer about his method of measurement and ensuring the wood pieces fit together correctly?","Precise measuring, marking, and cutting",C is engaged in a cutting and measuring process.,Cleaning and scraping the wood ensure a smooth surface and proper fit when attaching pieces to furniture.,Measuring tape for measurements and plane for smoothing surfaces,"C uses cutting, adjusting, and flipping techniques to prepare and assemble materials accurately."
71449,,Analyze the order and organization of c's actions in the video. explain how this allows them to efficiently complete the task at hand without repeating or backtracking too much.?,"C sequentially chops ingredients, discards waste, and stores unused items in the fridge to maintain a clean workspace.",C is engaged in a cutting and measuring process.,Preparing and shaping the dough for baking,"C is cooking pasta, rolling and cutting dough using the dough roller and then boiling the pasta on the cooker.","Chopping and placing mango pieces in the pot, ensuring proper size and even cooking."
24193,,"Analyzing the overall video, which stage do you believe was the most crucial for the completion of the project, and why?","The cable adjustment stage was most crucial, as it likely ensured proper functionality of the mechanical object.",Power drill for creating holes and screwdriver for tightening screws,Preparing vegetables by cutting and peeling,Assembling and adjusting components,Cutting and preparing pieces of timber
1128,,"What key interactions does c have with another person in the video, and how does this event relate to the overall process being carried out by c?",Interacts with a man who carries concrete,"C pouring water and conversing with the boy, highlighting routine and communication",A man helps c mix sand and cement,"The other person kneads the dough in a tray and pours oil, assisting in the dough preparation process.","C assists the other woman by applying hair cream, working together to ensure the woman's hair is properly moisturized."
