video_id,video_url,question,correct_answer,wrong_answer_1,wrong_answer_2,wrong_answer_3,wrong_answer_4
10202,,How does the woman's conversation with c during the video impact the main progression of c's actions? describe the significance of this interaction.?,The conversation has no significant impact on the progression of c's actions.,"C primarily removed twigs from the barb wire, progressively using both hands and adjusting the wire.",The interaction involves sharing task-related information and c receiving a stack of dried grass straws to add to the collection.,"C cut and measured planks, arranged them on the frame, and adjusted the position",C and the woman participated in a discussion regarding the cards on the table.
45161,,"Evaluate the significance of the flower pot preparation process, including both the ordering and the methods employed by c.?","The flower pot preparation involves sticking plant stems, adding soil in increments, and firmly adjusting the stems and soil for stability.",Competent and detail-oriented,C is focused on adjusting and removing bolts,C's primary activity is trimming and cutting plants.,"C spent a significant amount of time mixing and applying paint and filler, along with other peripheral tasks"
86015,,"Considering the various activities and interactions taking place, what key action or event appears to be the primary focus of the video?",C's leg shuddering,"The primary focus was on ironing clothes, with interactions involving round neck tops and an electric iron.","In the kitchen, mainly participating in activities related to cooking and food preparation",C repeatedly twists thread with the needle and operates the handloom to create fabric.,"Measuring, cutting, stitching with the sewing machine, and ironing the cloth"
114670,,"Based on the overall video, explain the primary differences in playstyle and technique between c and the man.?","C primarily uses the right hand, while the man uses both hands.","C efficiently handles paint tubes, brush, palette, scissors, and paper while managing her workspace.","C and the man participate in a card game, exchanging and organizing cards.","C lubricates her hand, cuts, squeezes, and forms dough balls, and dips them in oil",C appears exploratory and purposeful
20695,,"What are the primary tasks performed by c in this video, and how do they differ from one another in terms of priority and context?","C primarily prepares and consumes food, disposes waste, and cleans kitchen items and surfaces.","C mainly focuses on uprooting weeds and disposing them, using his hands, a pair of scissors, and a dustbin.","C used a rag and screwdriver to clean the bottle, also inspecting and shaking the bottle","C primarily removed twigs from the barb wire, progressively using both hands and adjusting the wire.","C is making bread, using the dough roller to knead the dough and the cooker to ferment it before baking."
121085,,"Summarize the main interactions between c, the woman, and other individuals in the video. what is the purpose of these interactions?","C and the woman converse about their selections, occasionally seeking others' opinions.","C's main objective was to clean and remove paint from the shoes, which they progressively achieved by washing, knocking, and using a screwdriver.","The main objective was to create dough-wrapped sausages, with visible differences being the addition of red pepper and oil in some preparations.",C's main purpose is to maintain the garden by trimming shrubs while the other character assists by disposing of the clippings.,"Preparing and cooking vegetables, with stages: cutting and peeling onions, slicing and bagging tomatoes, chopping lettuce, and cooking onions in a pot"
6346,,"How do the actions performed in the video present an iterative pattern, and why is that pattern essential for the final result?","The iterative pattern includes cutting and adjusting fabric pieces, sewing them together, trimming excess, and repeating this process to gradually build the final piece.",C repeatedly twists thread with the needle and operates the handloom to create fabric.,"C shapes and manipulates dough with repetitive compression, kneading, and rolling, transitioning between the chopping board and aluminum plate.","C primarily uses a trowel to repeatedly apply and press concrete on bricks, aiming to create a solid structure.",Assembling and adjusting components
29275,,"Describe the general workflow of 'c' while painting the door, without listing each action in detail.?","Dips the tool in paint, applies it to the door, repeats the process","The actions with the ingredients and utensils demonstrate c's process of combining, mixing, and cooking the ingredients in the saucepan.","C shapes and manipulates dough with repetitive compression, kneading, and rolling, transitioning between the chopping board and aluminum plate.",Cutting the apple and cleaning the counter facilitated progression in the cooking process.,Preparing and applying cement
119651,,"What was the turning point or most significant moment in the video, and how does it reflect the relationship between c and the woman?","Woman putting a scarf on c, showcasing her helpful and supportive attitude.","C prepared the work area, measured and marked the watercolor paper, and then cut it to size.",The main purpose is organizing and handling objects in a shared space collaboratively.,"Folding the cloth, measuring, cutting, using the sewing machine, and trimming the edges","C primarily prepares and rolls the dough, while the woman focuses on cooking and adjusting the camera."
36010,,"Based on the sequence of actions, what do you think the primary objective of c was in this video, and why do you think c performed certain actions in the order they appeared?","C's primary objective was to assemble craft materials; the sequence served to gather necessary tools, arrange materials, and retrieve additional equipment.","In the cupboard, primarily for the storage and examination of various items","C is baking cookies, using the dough roller to fold and mix the dough and the cooker to bake it directly on the countertop.","In the kitchen, mainly participating in activities related to cooking and food preparation","C focuses mainly on painting while occasionally looking around, shaking the paint, and dropping samples in intervals."
112280,,"Based on c's interactions with the man and the woman as well as their response to these interactions, what can be inferred about c's relationship to them and the shared activity they are engaged in?","C is likely a customer, engaging with a cashier and fellow shopper","They seem to cooperate in different tasks, possibly working together to clean and organize the space.","In the kitchen, mainly participating in activities related to cooking and food preparation",A man helps c mix sand and cement,C and the woman collaboratively prepared and arranged various pieces of cloth for display or storage.
114420,,"Based on the sequence of events, identify three key elements or areas that c prioritized during the cleaning process, and explain why these areas may have been chosen as a priority.?","Cupboard, drawer, and table were prioritized due to their central role or prominence within the room.","The actions with the ingredients and utensils demonstrate c's process of combining, mixing, and cooking the ingredients in the saucepan.","C mainly focuses on uprooting weeds and disposing them, using his hands, a pair of scissors, and a dustbin.","C stored and organized items in cartons, maintaining a tidy workspace.","C focused on the preparation of onions, potatoes, and bell peppers; onions were chopped, potatoes were peeled and sliced, and bell peppers were diced."
74793,,"At what point does c encounter difficulties in the process, and what actions does c take to address them? explain the importance of resolving this specific issue.?","C encounters difficulties while knitting, consults the manual for guidance, untwines the fabric, and resumes her work, ensuring a proper outcome.",C uses the damp serviette to frequently sanitize her hands,She had trouble with the paperboard tube's stability and solved it with glue and bracing elements,"C lubricates her hand, cuts, squeezes, and forms dough balls, and dips them in oil","The books were dusty, and c used a rag to clean them before shelving"
126778,,Identify the key turning points in the video that significantly contribute to the progression of the main action. how do these turning points alter the video's direction?,"Card shuffling and exchanges, impacting game progression.",Turns of tasks emphasize c's careful handling and cooking progression.,They exhibit collaborative gameplay focused on turn-taking and adhering to game rules.,"The woman and c collaboratively arranged and disarranged the puzzle, making significant progress in its completion.",Increased focus and concentration
13585,,"From the entire set of actions c performs in the video, identify the two major components of his work and explain how they are interconnected.?","The two major components are uprooting weeds and disposing them in the dustbin, both essential steps in maintaining a clean and organized environment.","C acts as a harvester and gatherer, focusing on collecting vegetables and preparing them for distribution or sale.","C primarily uses a trowel to repeatedly apply and press concrete on bricks, aiming to create a solid structure.",C is engaged in a cutting and measuring process.,C's primary activity is trimming and cutting plants.
27449,,"In the context of the actions carried out by both c and the woman in the video, how would you describe their key roles and their collaboration through the whole process?","C primarily prepares and rolls the dough, while the woman focuses on cooking and adjusting the camera.","Sketching the design, cutting, adjusting, sewing, and straightening the fabric","Precise measuring, marking, and cutting",Primarily chopping and arranging carrots while maintaining cleanliness.,"C lubricates her hand, cuts, squeezes, and forms dough balls, and dips them in oil"
59989,,"If we had to classify c’s overall activities in the video in terms of prioritizing and organizing tasks, what would be their primary activity?",C's primary activity is trimming and cutting plants.,C repetitively prepares dough by flattening and flipping it using a rolling pin.,"C initially preps onions and tomatoes by peeling, cleaning, and chopping.",C primarily works on dough preparation while another person cooks it on the pan.,"Primarily washing wine glasses, with differences in sponge usage and holding glasses with the left hand"
24788,,What is the primary objective that character c seems to have throughout the video?,Planting plants,C's primary goal is to prepare celery by consistently cutting and chopping it.,"C primarily prepares and rolls the dough, while the woman focuses on cooking and adjusting the camera.","C's objective was preparing potatoes for further use, consistently peeling and turning them.",C's primary objective is processing cassavas; a secondary goal is maintaining cleanliness by wiping fingers.
12474,,"Based on the different actions and behaviors of the two characters, what roles do you think they could be assuming within this scenario, and what could be the possible implications on the story being told?","Casual acquaintances, engaging in leisurely activities with minimal implications","Measuring, cutting, stitching with the sewing machine, and ironing the cloth","Competing in the game, following game rules, advancing pawns through cells, rolling dice, and strategizing","In the kitchen, mainly participating in activities related to cooking and food preparation","Sketching the design, cutting, adjusting, sewing, and straightening the fabric"
60041,,"Based on your observations, what would you consider to be the main goal or purpose of the actions performed by c in this video?",Preparing sliced cabbage for a later use.,C primarily focused on collecting moringa leaves by plucking them from stems and branches onto a plate.,"C primarily uses a trowel to repeatedly apply and press concrete on bricks, aiming to create a solid structure.","C's main objective was to clean and remove paint from the shoes, which they progressively achieved by washing, knocking, and using a screwdriver.",C repeatedly twists thread with the needle and operates the handloom to create fabric.
54324,,"What are the key differences between c's and the woman's card-related actions throughout the video, based on their roles in the process?","C often initiates card exchanges, while the woman responds",C appears exploratory and purposeful,Preparing vegetables by cutting and peeling,Collaborative partners with a shared task,C's key actions include attaching pins to cloth and hammering them into the craft bag.
1819,,"What are the main tasks c accomplishes throughout the video, and what objects does she utilize to be successful in these tasks?","C washes a tray and wipes the oven, using sponge, kitchen towel, and paper towel.","C lubricates her hand, cuts, squeezes, and forms dough balls, and dips them in oil",C is engaged in a cutting and measuring process.,"C is preparing dough, rolling and cutting it, and then cooking it, using the dough roller to flatten the dough and the cooker to heat the pan.","C is making bread, using the dough roller to knead the dough and the cooker to ferment it before baking."
116769,,Identify three ways both players adjust their strategies during the game and explain how these adjustments reflect their understanding of the game's dynamics in terms of stability and challenge.?,"Adjustments include gentle block removal, letting go of blocks in the tower, and shifting body positions for stability.","C removes and reattaches wheels, tightens bolts with a spanner, and adjusts parts, ensuring proper scooter assembly and functionality.","C lubricates her hand, cuts, squeezes, and forms dough balls, and dips them in oil","C collects ingredients, prepares and cooks, multitasking with her phone.","Sanding, dusting, cutting sandpaper, and gluing to smoothen and attach the wood to the woodwork"
126760,,Describe the shift in focus from cards to another type of activity in this video. how does this change in focus contribute to the video's overarching theme?,"The focus shifts from cards to reading and moving papers, suggesting a transition from gameplay to information processing.","Knitting, cutting, and tying thread",Preparing and shaping the dough for baking,Preparing dough for baking,Knocking soil with a trowel and spreading soil with hands
60083,,Identify the key moments when c interacts with the pot and analyze the significance of these actions in ensuring a successful outcome. consider the connection and purpose without explicitly mentioning the actions.?,Ensuring an even cook and neat workspace,Competent and detail-oriented,C is engaged in a cutting and measuring process.,"C shapes and manipulates dough with repetitive compression, kneading, and rolling, transitioning between the chopping board and aluminum plate.","The key actions are holding the mango, dividing it, and positioning the pieces suitably for cooking."
13678,,"Considering the various tasks executed in the video, what was the likely primary objective c aimed to achieve?",Assembling a wooden structure with deck balusters,C is engaged in a cutting and measuring process.,C's primary goal is to prepare celery by consistently cutting and chopping it.,Consistent focus on cleaning and organizing the kitchen,C is primarily focused on cleaning the garage by sweeping the floor using a dustpan and brush and organizing the tools.
80622,,What was the primary purpose and general pattern of c's actions in the kitchen throughout the video?,Cooking and organizing the kitchen,"C used a rag and screwdriver to clean the bottle, also inspecting and shaking the bottle",C's primary goal is to prepare celery by consistently cutting and chopping it.,C repeatedly twists thread with the needle and operates the handloom to create fabric.,"C mainly focuses on uprooting weeds and disposing them, using his hands, a pair of scissors, and a dustbin."
84553,,"How does c effectively utilize both their left and right hands during the course of the video, and what is the significance of this in achieving the objective?","Left hand for positioning, right hand for cutting tools",C's objective is to prepare and cook pastries.,"C lubricates her hand, cuts, squeezes, and forms dough balls, and dips them in oil","C cut and measured planks, arranged them on the frame, and adjusted the position","Measuring, cutting, stitching with the sewing machine, and ironing the cloth"
10292,,"Summarize how c interacts with the paint, pen scraper, and pouch in different ways over the course of the video. then, determine c's overall goal by considering how these interactions work together.?","C peels and scrapes paint from the pouch using a pen scraper, highlighting meticulous paint removal as the overall goal.","Repetitive, focused on arranging cards, with occasional breaks to look around.","C was in the kitchen to clean and organize items, with less emphasis on preparing hot beverages.","C focused on the preparation of onions, potatoes, and bell peppers; onions were chopped, potatoes were peeled and sliced, and bell peppers were diced.","C is making bread, using the dough roller to knead the dough and the cooker to ferment it before baking."
36042,,"Identify the most crucial actions ""c"" executed during the video and explain their significance in achieving the video's overall purpose.?",C's key actions include attaching pins to cloth and hammering them into the craft bag.,C is engaged in a cutting and measuring process.,Main phases include folding brown materials and gluing paper objects.,"C persistently uses the needle to knit, sew buttons, and thread through eyelets fabric in the making.","C mainly focuses on uprooting weeds and disposing them, using his hands, a pair of scissors, and a dustbin."
59166,,"What are the two primary activities that c and the man perform throughout the video, and how do their actions differ?","C primarily files the cage, while the man clears the ground with a hoe.",C repeatedly twists thread with the needle and operates the handloom to create fabric.,"C performs laundry chores, utilizing detergents and washing machines while the man assists her.","Build a birdhouse using the nylon, thread, and pencil","C is baking cookies, using the dough roller to fold and mix the dough and the cooker to bake it directly on the countertop."
119684,,"Describe and compare the main techniques c uses during the video, focusing on interactions between his hands and tools. can you extract important strategies c applies throughout the video?","C uses his left hand to draw with a marker and right hand to adjust the line level, frequently coordinating both to achieve precision and accuracy.","C consistently handled, folded, and placed towels in a manner that promoted neatness, organization, and visual appeal.","C used a rag and screwdriver to clean the bottle, also inspecting and shaking the bottle",C is consistently working on the blue scooter's tire alignment,C is focused on adjusting and removing bolts
105518,,"Describe the process 'c' followed for multiple clothes, and how did they utilize technology and other interactions to make a decision?","C inspected clothes, checked their appearance in a mirror, and used a phone to take pictures as part of the decision-making process.",C is engaged in a cutting and measuring process.,Competent and detail-oriented,"Hand gestures, phone operation, and scanning the environment","C's overall purpose is to clean an object, with actions like washing, scrubbing, and drying contributing to this goal."
54040,,"Considering the actions of c and the woman throughout the video, how would you describe the overall purpose of their actions in a single sentence?",C and the woman collaboratively prepared and arranged various pieces of cloth for display or storage.,"In the kitchen, mainly participating in activities related to cooking and food preparation",C primarily focused on collecting moringa leaves by plucking them from stems and branches onto a plate.,Scissors for cutting and the sewing machine for stitching to create the final cloth piece,"C's main objective was to clean and remove paint from the shoes, which they progressively achieved by washing, knocking, and using a screwdriver."
79666,,"Apart from c's primary focus on the cardboard tubes, identify two notable occurrences or distractions during the video and describe their potential impact on c's overall process.?",Cat walking past and playing with a bucket; causes brief distraction.,Smoking and eating,"C briefly handles a screwdriver and a measuring tape, implying her focus switches to more technical tasks.",Moving pawns and rolling the dice,C used a vacuum cleaner to remove dust and used a cloth with liquid soap for polishing.
57831,,What aspects of c's process demonstrate their attention to detail and continuous refinement of their work?,C frequently checks the laptop and adjusts their painting accordingly.,"C constantly engages in adjusting the fabric, sewing it, measuring, and folding it to ensure a well-finished product.","C focuses on trimming, cutting, and arranging materials on the table, adjusting the sewing machine, and occasional flipping of materials for better view.","The actions with the ingredients and utensils demonstrate c's process of combining, mixing, and cooking the ingredients in the saucepan.","C consistently handled, folded, and placed towels in a manner that promoted neatness, organization, and visual appeal."
106135,,"Considering key activities in the video, can you formulate a conclusion about the possible intent or purpose driving c's actions?",C's intent appears to be practicing and refining their drawing skills using ink and pen.,"The primary activity that occurs multiple times is c and a man dribbling the tennis ball, which could be associated with them practicing or warming up.","In the kitchen, mainly participating in activities related to cooking and food preparation","C and the man participate in a card game, exchanging and organizing cards.",C's key actions include attaching pins to cloth and hammering them into the craft bag.
117835,,"From the activities taking place in the video, identify the most significant turning point or interaction that allows us to infer the main purpose of their meeting.?","Male and c repeatedly converse and interact with cards, which implies the main purpose is related to card activities.",C and the man are engaging in a card game or activity that involves alternating actions.,"The most significant moment is when the man starts shuffling cards, progressing the gameplay.","C and the man exchange cards and align them, showcasing their engagement in a card game.","The primary focus is the card-related activity, with the man and c engaging in a back-and-forth exchange."
126456,,"In the context of the video, identify a significant communication exchange between the lady and c and how it contributes to the overall narrative.?","Lady talks with c, prompting mutual engagement.",Discussing and weighing vegetables,C and the woman participated in a discussion regarding the cards on the table.,Discussing a board game and its setup,Discussing and making decisions about products.
88615,,"Considering the main tasks performed in the video, what might c's ultimate goal be, and why?",Creating a precise layout on the paper,"C primarily uses a trowel to repeatedly apply and press concrete on bricks, aiming to create a solid structure.",C's goal is to create textured wooden pieces by painting and applying sawdust.,"Preparing ingredients, cooking, and measuring solids","Picking, peeling, cutting, and arranging vegetables on a tray"
58614,,"Can you identify the key events, including the interactions with cards and chips, that shaped the flow of the video and present them in the form of a cohesive storyline or strategy?","Frequent card exchanges, chip placements on the sequence, and collaborative decision-making","The most essential sequences were placing cards on other cards and putting chips on the board, as these actions relate to progressing the game.","Preparing and cooking vegetables, with stages: cutting and peeling onions, slicing and bagging tomatoes, chopping lettuce, and cooking onions in a pot","C consumes food and drinks, mainly using a fork for food and hands for cups; eating food and drinking tea are most frequent.",The primary focus is manipulating and examining dice and cards.
80628,,"Considering the actions in this video, in what ways did ""c"" demonstrate attention to detail, organization, and cleanliness in their process? provide a concise summary without listing individual actions.?","Careful food preparation, meticulous cleanup, and organized storage","The actions with the ingredients and utensils demonstrate c's process of combining, mixing, and cooking the ingredients in the saucepan.",Competent and detail-oriented,Persistent and detail-oriented,"C carefully and methodically manipulates the fabric and thread by sewing, adjusting, and utilizing various tools like scissors and a needle."
